translated	origin_language
The sea returns the vessels to these quiet edges;/ The hymen promises its fruits, the earth its treasures./ I give everyone laws, fields, homes./ But our fate follows us in these new asylums: / A contagious air, exhaling its poison, / load of its vapors the burning season: / The dried up water, the grass dies, and the sterile year / sees on its blackened forehead.	fr
"The GO play table is chess, but has no light and dark squares like a chessboard. In Go, the pieces are not placed on ""squares"", but to the intersection of lines, horizontal and vertical, drawn on the table."	ru
If there was not the world such as assignment, my personal opinion is, and I hope you agree with me, that we could hear ourselves much better than we do and could be infinitely better company than we are.	fr
War only does justice in two cases: firstly, when it comes to resisting the aggression of an enemy, and secondly, if it is important, to rush to help an ally which has been attacked.	de
There are no more problems in corporate life, there are only challenges. And the challenges are opportunities. So it's not a problem at all if the company is in red, it's just another opportunity!	ru
The young king shared his intention to marry and ordered all the young girls of the kingdom to come to a feast so that he can choose a wife from them.	fr
He had hoped to be presented to these young ladies, whose beauty he had heard;But he only saw the father. These ladies were happier;They had the advantage of making sure, through one of the windows, that he wore a blue coat and rose a black horse.	fr
We recommend adding phrases and translations in its strongest language. If he is mainly interested in correcting his sentences, he should try a site like Lang-8.com, where that is the goal.	ru
He wore a cheerful chocolate velvet coat, with diamond buttons, and with two huge pockets that were always full of bones, left there during dinner by his affectionate lover.	es
I thought I had to put my car in the workshop and pay a horrendous amount again, but luckily it turned out that only the battery was empty caused by Tom forgot to switch off the interior lighting.	de
I just saw a game of ladies, played by Francçaldo Gonçalves de Souza in 1997, more beautiful than the chess game called the Immortal, played by Adolf Anderssen in 1895.	fr
Roger Miller's father died when he was only one year old and his mother fell ill just after, so she was sent to live with her uncle to Erick, Oklahoma.	ru
Remember that the purpose of the Tatoeba project is to create example phrases that can be used to study languages. It is not really a place to contribute phrases that are not in their mother tongue because others correct them for you.	ru
If you want to sound like a native speaker, you must be willing to practice saying the same phrase again and again in the same way that a banjo musician practices the same phrase over and over again until they can play it correctly and in the expected time.	es
"In my language, "","" it's called coma, "";""It is called a point and coma, "":"" It is called two points, ""..."" It is called suspensive points and this phrase ends with an end point."	es
And when this happens, and when we allow freedom to sound, when we let it sound from each people and each village, from each state and every city, we can accelerate that day when all the children of God, black men and whites, Jews and Gentiles, Protestants and Catholics, be able to join and sing with the words of the old black spiritual: free at last! Free at last!	es
Black plays in E8 and captures the white stone in D8. In E8, the black stone is in KO, that is, in the next move, it will be forbidden to the white to capture it by playing in D8. The white then plays in E2, practically forcing black to play in E1. Now the white can play D8 and capture the KO stone.	ru
He wrote an epitaph to his beloved telling him everything he had never dared to say, despite knowing that it was too late. If she had yet been alive and had the opportunity to hear it, perhaps her end would have been different.	es
I know that adding phrases only in his mother tongue or in his stronger language is probably not funny what he practiced in foreign languages, but, to please, he does not add phrases in the corpus of Tatoeba if it is absolutely not sure they are corrected. If he wants to practice the languages ​​he is studying, for pleasure, do it using a website designed for this purpose such as www.lang-8.com.	ru
In ninety -nine percent of cases it is not worth keeping one thing. It only occupies space and overwhelms you. Have you realized that it is not you who possesses things but that things possess you?	es
"By the way, do you know what a Shinto sanctuary is?""I have some knowledge on the subject. It is a religious structure in which what is the object of worship, the so -called Genius Loci, is sanctioned."""	ru
I can seem to be sure of me, but I become extremely nervous to speak in front of the people. My hands tremble, I become completely silent and sometimes I don't even know what I'm saying.	ru
"Where are you from?""My country no longer exists.""""What do you mean?""""I was born, grew, and I spent the majority of my adult life in the Soviet Union. It is no longer there. When the country collapsed, I was in Algeria, so I decided to stay here forever.""""Are you Russian?""""No. In fact, I am a mixture of several cultures, many more than you can imagine.""""Why don't you return to Russia?""""I'm not even from Russia. I have no country to return."""	es
"One of the greatest misunderstandings in our era seems to me to be the claim that - with the decay of the Communist Soviet country - socialism failed and capitalism won. But was the ""socialism"" of the Soviet Union different from state capitalism?"	de
I just saw a ladies game, played by Françualdo Gonçalves de Souza in 1997, more beautiful than the chess game called Immortal, played by Adolf Anderssen in 1895.	es
I want to stand as close to the edge as I can without going beyond. From the edge, we see all the kinds of things that cannot be seen from the center.	fr
When the Golf Cameroonian champion Issa Nlabe Amang lost his legs and most of his fingers due to meningitis in 2018, many thought that his sports life was over. But, thanks to donors, he was able to get prostheses that allowed him to return to sport and become the only disabled professional golf of Western Africa.	es
In 1992, the seemingly unbeatable world champion of Ladies, Marion Tinsley (1927-1995), defended his title against the Chinook computer program in a series of games, of which he won 4, lost 2 and tied 33. This game marked the first time in history that a human world champion defended his title against a computer.	es
My Indian friend Jaï, whose family was Hindu, and I often discussed the belief system that would be good for India. We both tended to think that Buddhism or secularism would be the best.	fr
"The future will not be built by force, not even with the desire to conquer but through the patient application of the democratic method, the spirit of constructive consent and respect for freedom """	ru
In the game of chess, the relative value of the pieces is normally the following: the woman is worth 9, the tower 5, the standard bearer 3, the horse 3 and the pedestrian 1. The king has absolute value.	ru
It is a very strange feeling, for someone in my kind, to write a diary. Not only because, before, I have never written, but it seems to me that later, neither me nor anyone else will be interested in the confidences of a school maker of thirteen.	fr
I was panicked when I read that they expect great protests in Riyadh today, but then my wife reassured me, saying that she had just bought two bottles of olive oil, guaranteeing our standard of living for months, even if the oil prices should explode.	ru
"In the first prison I saw, it was written: ""Let go of the evil; learn good things!"", But since the inscription was outside, the prisoners could not see them."	de
The microbes of the soil, such as bacteria and fungi, fertilize land, favor food production and act as a sink of carbon dioxide that we emit to the atmosphere with the burning of fossil fuels.	es
I flee a man I love, but above all I am Roman and good Catholic. Now, this man would lose my soul if I stayed longer with him;It is an atheist and a necromancer, whom God has just warned by the voice of his thunder.	fr
At that time, in the courts of the feudal lords there were many scholastics dedicated to discrimination, such as the followers of Xun Kuang, who wrote books that were disseminated throughout the world.	es
America, we got that far. We saw so much. But there is so much more to do. So let's ask us this evening whether our children should live to see the next century, whether my daughters will be so happy to live as long as Ann Nixon Cooper, what change will you experience? What progress will we have made?	de
Kamui no Ken was a kind of samurai or nin wet history that plays during the transition period between the decline of the Tokugawa Schogunat and the restoration of Japan under Emperor Meiji in 1868.	de
In many languages ​​as the Portuguese, the German, the French, the Spanish and the Italian, the termination of the verbs is changed according to who performs the action of the verb. Then you have to learn the patterns of the verb.	es
It is not uncommon for two people to do both a dupe market, although one of them is the most losing;As was the case for the one who sold a blind horse and received a false ticket in payment.	fr
The seven wonders of ancient world are the great pyramid of Giza, the hanging gardens to Babylon, the temple of Artemis, the Zeus statue of Olympia, the tomb of Halicarnassus, the colossus of Rhodes and the lighthouse of Alexandria.	de
Since most of the Esperanto speakers have learned their language through individual study, in general on the Internet, websites such as www.lernu.net in particular, they were of great benefit for the language.	ru
Tom grew up in five language;His father was even seven -language. At home there was mostly German, Ukrainian and Polish, with friends and acquaintances.	de
I can not anymore. This is an emotional roller coaster ride and everything we have to do is to look into the boss's face to find out whether we will all be happy or sad.	de
The mastery is the best goal because the rich cannot buy it, the impatient cannot rush it, the privileged cannot inherit it, and no one can steal it. It can only be achieved through commitment. Master is the supreme status.	es
Tom had lost a hand and leg to the knee in the fight against a shark and now wore a wooden leg and a catch instead of his hand.	de
A black stone captured a white stone that was removed from the board. The black stone only had one freedom. If a white stone occupied the same place in the next train that was now empty, he would beat this black stone, but that was not allowed because it would repeat the last position on the board.	de
I stand alone at the top of the year that all breaks his waves to my feet, the planets circle around my head, and break me temporarily with the wind that they spark without giving an answer that would fill the abyss.	de
In 1992, the apparently unbeatable world champion Marion Tinsley (1927-1995) defended his title against the Chinook computer program in a series of games, of which he won 4, lost 2 and draw 33. This meeting scored the first time in history that a world champion, human, defended his title against a computer.	ru
A quarter of a century after the end of the Cold War, the world is less violent and wealthy than ever before, and yet our societies are full of uncertainty, unrest and argument.	de
If you want my opinion, they have never put your feet in Italy, if not, how would you explain that you don't know any word in Italian claiming to have lived there for ten years?	es
Popular will is the foundation of government authority;This will must be expressed through periodic and truthful elections, carried out with a universal and equal suffrage, and with a secret vote, or according to an equivalent procedure of free voting.	ru
The current fly on the mirror does not worry about this opposite fly on the tips of the legs of which it arises and short;But on the contrary, she sees on the polished level quantity of very small things that interest her and that we confuse under the name of dust and dirt.	fr
"Boeing's security experts have merged with other experts from industry to form an international working group with the aim of eliminating a certain type of plane crashes, which is called ""Controlled Flight into Terrain (CFIT)"", in German ""Controlled Flight Insferge""."	de
The eleven -year -old Gracia sits in a chair that is two numbers too big, lets her thin legs dangle, and talks mastery and wise about a life that was not easy.	de
"It seems that today, small models of Open Source code are supposed to be more efficient than their larger counterparts if they are taught to ""reason"", that is to say to ""generate more tokens that take into account all the possible options in a logical question"", before producing a final answer."	fr
Stanley Abbott, an architect, was the first highway designer. He believed it was important to have a variety in what people saw. Together with the mountains, Abbott wanted the visitors of the highway to see the valleys, forests, farms, rivers and homes of the surrounding communities.	es
If the current development continues, the variety of animal and plant on the American double continent will decrease by 15% by 2050. This means that there will be 40% fewer animals and plants than at the beginning of the 18th century.	de
In fact, I wanted to be a Damisela in a tower saved by seven dragons, and then the prince came on his white horse, decapitated the dragons and released me.	es
Whenever such a failure takes place in another department, I am attempted to call them idiots, but then people like you appear to demonstrate what true idiocy is.	ru
Now a big fire was lit in the courtyard, it should be burned in it, and the king was up on the window and watched with crying eyes because he still loved it so much.	de
Astronomy is perhaps the only science in which discoveries are due to chance, in which human understanding is manifested in all its greatness, but it is also where its infinite smallness is known.	es
It is true that behavior cannot be regulated, and the laws cannot force you to love me, but the laws can prevent you from lynched me, and I think it is quite important.	fr
Without giving up your intimacy, I also advise you to share with him what you do when he is not, naturally, so that he understands that there are no reasons for his jealousy.	es
Jealousy is a disease;Love is a healthy condition. The immature mind often confuses each other, or assumes that the greater love, the greater the jealousy. In fact they are almost incompatible;Both at the same time produce unbearable agitation.	es
Ian Nepomniachtchi (2695), the 30 -year -old great Russian teacher, has just won the candidate tournament, ensuring the right to compete this year with the current champion, Magnus Carlsen, for the title of world champion of chess world.	es
Based on everything Mary, John and Alice have done in their short lives, it is likely that, while they lived, one of Tom's clones let them access the cloning machine without knowing the real Tom.	es
"Two dragonflies look over your head.""I didn't feel them land, are they still in my hair?""-No, they fled again.-Oh, now I see them, how beautiful they are!"	es
"In 1969 Roger Miller recorded a song called ""You don't want my love"". Today this song is better known as ""In The Summer Time"". It is the first song that wrote and sang to have become popular."	ru
The teenagers, copying the Raperos American fat people, have started some years ago to walk like metronomes, leaning from right to left, which is the only way to move forward when you have more than one hundred and twenty kilos, but it is revealed totally ineffective when you are a thin teenager of half of that weight, because most of the energy is lost laterally, that without talking about how totally ridiculous that is this pendulous march.	es
This is the reason why Tatoteba is multilingual. But not in a way in which two languages ​​simply form a pair of language and some language pairs are neglected.	de
But I will always be honest with you about the challenges in front of us. I will listen to you, especially when we disagree. And above all, I will ask you to join you in the company to reconstruct this nation, in the sole way that America has known for 221 years;Block block, brick brick, callose callose callose.	ru
Although open orders are considered enforceable and legally binding, we allow us to cancel, shift and to cancel our requirements and needs before the delivery of goods or the provision of services.	de
If an Icelandic sentence has an English translation, and the English sentence has a swahili translation, then, indirectly, this will provide a swahili translation for the Icelandic sentence.	fr
Remember that the purpose of the Tatoeba project is to create example phrases that can be used to study languages. It is not really a place to contribute phrases that are not in their mother tongue because others correct them for her.	ru
It can be impossible to have a completely free corpus from errors because of this type of collaborative commitment. Nonetheless, if we encourage members to contribute with sentences in their languages ​​rather than experimenting with the languages ​​they are learning, we could be able to minimize errors.	ru
The whole world is a stage and all fraun and men mere players. They appear and release again. For his life one plays some roles through seven acts.	de
In connection with the concern expressed by Angela Merkel in view of the events in Crimea and in Ukraine as a whole, Vladimir Putin referred to the non -declining threat of violence by ultra -nationalist forces, which endanger life and legitimate interests of the Russian citizens and the entire Russian -speaking population.	de
My nephew has a kitten. The kitten has white and black fur and green eyes. My nephew loves to play with her. He called her alive. Live is beautiful. It is our pet.	ru
The sister of North Korean leader Kim Jong One split a most worrying military threat to South Korea, promising non-specified reprisals against South Korean activists who distributed anti-Pyongyang leaflets to the north.	fr
There is a squeaky duck on my table, which I sometimes ask for technical help. Of course it cannot answer, but explaining the problem often helps me to find a solution.	de
And here it is the signs that will accompany those who have believed: in my name they will drive the demons;They will talk about new languages;They will take snakes;And when they have drunk something deadly, that will not harm them;They will impose their hands on the infirm, and they will be well.	fr
After many years of meditation, I came to the conclusion that for each person the meaning of life consists precisely in finding the meaning of life. Each of us is a unique individual. And each of us has in itself the potential to find and create a unique mission in one's life.	ru
There are a lot of problems for which the Karush-Kuhn-Tuker conditions are not sufficient to guarantee optimality, but that does not change the fact that these conditions are an essential tool when you make optimization.	fr
The one who fights against the monsters has to try not to become one, since, when you look too long at an abyss, the abyss also observes you.	es
You were alive when you were born and you are alive at the moment, so you had to be alive at any time between the two. This implies that everyone's life is convex.	fr
They came to the place that it was revealed by God, and he erected an altar in the ancient way, and the wood was organized just as he wanted him to happen to burn his son after he killed him.	ru
We, the people of the United States, in order to form a more perfect union, establish justice, affirm inner tranquility, provide common defense, promote general well -being and ensure for ourselves and for our descendants the benefits of freedom, we statute and sanction this Constitution for the United States of America.	es
The fathers of modern science - Copernicus, Galileo, Kepler, Newton, Boyle and many others - saw clear tests of the drawing in the universe and, in fact, were inspired by discovering the laws of nature from their faith in a transcendent legislator.	ru
"When I was younger, I hated going to weddings. My grandmothers and aunts squeezed around me, they gave me a snag in the side and chuckled ""you are the next one! You are the next!""They interrupted this absurdity only when I started doing the same thing at the funeral."	ru
"""What are you hiding behind your back?""- ""Nothing! Nothing!""- ""Show it!""- ""Man, Maria! This is your birthday present, which should actually be a surprise. Why do you always have to come into the room like this without knocking on?"""	de
No one is responsible for the Wall Street crash. No one organized the speculation that preceded it. Both are the fruit of the free choice and the decision of hundreds of thousands of individuals.	fr
They traveled through a large forest for two days, without food and drink and without getting past a single house, and every night they had to climb up into the trees out of fear of the wild animals that lived in the forest.	de
Particularly over the past twenty years, the supposed link between advanced social protection policies and economic failure in the countries of Northern Europe, seems to highlight the difficulty in supporting both complete social protection and international competitiveness.	fr
All human beings are born free and equal in dignity and rights. They are endowed with reason and conscience and must act towards each other in a spirit of fraternity.	fr
In the 2nd century BCChr. Hipparch, the most important Greek astronomer of its time, calculated the relative brightness of at least 1000 different stars and the distance of the moon from the earth.	de
Please forget the orientation you did in that outdoor school. Well, in reality, you don't have to forget it, but the orientation we are doing here is completely different.	ru
And although I am no longer with us, I know that my grandmother is watching;Together with my family, who did what I am. Today I miss them. I know that my debt towards them is immeasurable. To my Mayan sister, my sister Alma, my other brothers and sisters, thank you very much for the support you have given me. I am grateful to you.	es
There are no more problems in corporate life, there are only challenges. And the challenges are opportunities. So it's not a problem at all if the company is in red, it's just another opportunity!	ru
We now whip less than before in our good schools, but then we learn less;Which means that schoolchildren earn on one side, they lose it on the other.	fr
To tell the truth, I wanted to be a Damoiselle, in a tower guarded by seven dragons, and then a prince on a white horse would have cut off the dragons and would have delivered me.	fr
Since he arrived in Guantanamo Bay, Tom has been subjected to various forms of torture: deprivation of sleep and sensory stimulation, extreme temperatures, prolonged isolation, sun exposure and limited health care.	fr
The Polish authorities have prohibited swimming on over 50 beaches of the country's Baltic coast after the hot weather in the unusually warm sea led to the development of poisonous bacteria.	de
All men who enjoy the fruits of the earth must give a part to the church which will affect it to three objects: the subsistence of the pastors, the maintenance of the buildings of the worship, the relief of the poor.	fr
"A doctor visited a patient to take a good and bad news: ""The bad news is: you will not live beyond the end of this day. And here is the good news: I forgot to tell yesterday."""	es
I live in the French village of Scheibenhard;I want to buy bread in Scheibenhardt, on the German side, but the covid prevents me: then, I am sad.	fr
Once, Zhuangzi dreamed of being a butterfly, but when he woke up, he was not sure if it was Zhuangzi who had dreamed of being a butterfly, or if it was a butterfly who now dreamed of being Zhuangzi.	fr
When I went through the narrow streets of my hometown - which I had not visited for years - many people gave me mocking looks as if they just laughed and made fun of me - on the other hand, I'm also a clown.	de
Tangled the wheels of their cars, which could barely advance. Then the Egyptians said: we fled to Israel, because Yahweh fights for them against Egypt.	es
Those who do not read, at 70 will have lived a single life: their own! Those who read will lived 5000 years: there was when Cain killed Abele, when Renzo married Lucia, when Leopardi admired the infinite ... because reading is an immortality backwards.	ru
The peon that reaches the last row in front, stopping there, will be promoted to Lady, an exceptional mobility piece and that in a large number of cases represents a decisive advantage.	es
"In England the service asked us: ""How much beer do you want? A pint or half a pint?""Since we didn't know how much that was, we let the glasses show ourselves."	de
The plan begins to immunize first those who are more vulnerable to serious diseases and death, including residents of long -term care centers and the people who take care of them, the remote and at risk indigenous communities, and the elderly people.	es
"""You should have let me know earlier.""- ""How should we have done this if you didn't go to the phone? Unfortunately, we don't have another way to get in touch with you."""	de
