translated	origin_language
Shortly after, a Turkish dictator decided that all his people had to dress in the western way. Anyone who had disobeyed would have been sentenced to death. Subsequently, he returned to speak again with the astronomers of his discovery. And this time everyone believed that he was saying the truth.	ru
Even if we find ourselves here tonight, we know that there are courageous American Americans who wake up in the deserts of Iraq and in the mountains of Afghanistan to risk our lives for us.	ru
"To be able to face recurrence criminals, Mr. Johnson is also establishing a ""two shots and you are out"" policy: serious violations of the rules will involve permanent removal of the rights of free travel."	ru
"""I said Maria that I don't have time for a relationship because I have to concentrate on school,"" Tom explained to his father.- ""I am glad to hear that, my boy,"" he replied satisfied and knocked on his son on the shoulder.""There is still enough time for such things later."""	de
Women and men who are capable of marriage have the right to marry and found a family due to the breed, nationality or religion. You have equal rights during the marriage, during the marriage and the resolution.	de
There was always a minority that feared something and a majority that feared the dark, the future, the past, the present, feared of themselves and their shadows.	es
Is it possible to believe that the subatomic particles, as well as the very particular forces which lead them to combine to generate matter, are not the work of a supernatural intelligence?	fr
There is the known known: there are things that we know we know. There is also the known unknown, that is, we know that there are things that we do not know. But there is also the unknown unknown: what we don't know we don't know.	es
"Welcome.""I'm Honda. I have a reservation for 10.""""Thank you for coming to come. Today, we will provide a taxi service. It will take a little more because the taxi arrives, therefore, please wait here, if you don't mind.""""Okay then, I'm going to smoke a cigarette while I wait."""	ru
The United States is a rogue state. It is not me who says it. I read it in the writings of various respectable authors who were born and live in the United States.	ru
Against an oil defense not very skillfully played by Ian Nepomniachtchi, Magnus Carlsen obtained his second victory in the game of the World Championship Fide-2021 in Dubai. Now: Carlsen 5 - Nepo 3.	ru
Each spider is a versatile genius: he plans his network as an architect and then carries out this plan as the skilled weaver he is. It is also a chemical that can synthesize silk using a computer -controlled manufacturing process and then use the silk to spin.	es
"""What did you get for Christmas?""- ""I got a computer game from my father, a few sweaters from my mother, from my grandparents wooden toys and from my little sister a picture she painted for me."""	de
"""We believe that the fantasy football will lead this year a shortfall of around $ 9 billion in wages paid to employees who, otherwise, are unproductive when they participate in fantasy football games in the office instead of working,"" says Andrew Challenger, vice-president of the Challenger professional reintegration firm, Gray & Christmas."	fr
"Ida was the second asteroid that was observed by a space aircraft. In this case it was the Galileo spacecraft that took pictures on August 28, 1993. These not only show a cratered surface, but also a small moon called ""Dactyle"", which has a cross -section of about 1.6 km⋅1.2km and revolves around the asteroid at a distance of 90 km."	de
The four -year trench war was intended - like the British and Americans idealistically affirmed - as the war that ends all wars. But hardly more than 20 years later, a global conflict was supposed to break again, with unprecedented number of victims.	de
"""But we haven't seen each other for a long time, Tom! Did you get a little bit?""- ""Yes, I haven't been able to get myself up to move at all lately."""	de
On a self -erected high seat, located in a secluded forest far away from all streets and paths, where it hardly ever slapped a person, Tom and John often met to observe the animals and to go about life.	de
It was my turn to play and my king was not attacked, that is, he was not in the chess. But none of my characters could make a valid train. A stalemate had set up. The game ended.	de
Life means love and love. If you don't like it, don't love. But if you don't love, what do you live for?	de
"André Danican Philidor used to play three games simultaneously, two blind and one looking at the set. Diderot and d'Alembert cited it in the encyclopedia as ""one of the most phenomenal manifestations of the human mind.»»"	fr
In the days of doubt, in the days of painful brooding over my fatherland's fate, you are my only support, my only stop, oh big, mighty, true and free Russian language!	de
Coded in a four -letter alphabet in the two intertwined strands of the DNA molecule, there are the instructions to produce all proteins, each with its specific function, necessary to maintain life.	es
Japanese punkers and Medellín punkers only resemble the way of dressing;But, in terms of attitude, Medellín's punker is a answer, while Japanese is pure pose.	es
For most of the last century, the faith of America in freedom and democracy was a rock in a stormy sea. Now it is a seed in the wind that takes root in many nations.	ru
Our Father that you are in heaven. Sanctified be your name. Come to us your kingdom. Do your will on earth and in heaven. Give us our daily bread today. Forgive our offenses as we forgive those who offend us. Don't let us fall into temptation. And deliver us from evil.	es
I am a marketing specialist and that is why I know that I have never had control. Your brand is what people say about you when you are not in the room, as the saying goes.	es
There is only one law for all, namely, this is the law that governs all laws, the law of our creator, the law of humanity, justice and equality: the law of nature and nations.	es
It is easy to find out how a verb is conjugated elsewhere (for example in the Wiktionary). It is much more difficult to grasp the meaning of a word, as it is in a realistic sentence. In the same way, Tatoleba's central mission is what makes it unique and what we, I think, should concentrate on.	de
If a phrase in Icelandic has a translation into English and the English phrase has a translation in Swahili, then this will indirectly provide a translation into Swahili for the phrase in Icelandic.	ru
Now I know why there were so many people in the dark in the field in front of the forest last night: it was the day when the star swarm of Perseids reached its maximum.	de
To expand the Tatoeba knowledge base, any user contributing to this project must imperatively give vast permissions to the public so that he can redistribute and reuse his content freely, provided that the source of this content is clearly indicated and that the same freedom in the face of redistribution and reuse applies to copies and derivatives.	fr
The center of the chess game, formed by boxes E4, E5, D4 and D5, has exceptional strategic importance. Whoever has a strong center will always have advantage in carrying out both attack and defense operations.	es
I live in the French village of Scheibenhard;I want to buy bread in Scheibenhardt on the German side, but Covid prevents me from: Then I'm sad.	de
You can not learn to speak well as a native speaker, but you should be able to speak well enough so that native speakers will understand what you have to say.	ru
To be absolutely sure that the Solar Probe Cup resisted the hostile environment, Odeillo's solar oven - which concentrates the heat of the sun through 10,000 adjustable mirrors - was used to test the cup against intense sun emission.	ru
My Latin teacher looked at me severely above the edge of his glasses, but now I know that he had to do only with the fact that he wore reading glasses and that he would find annoying to remove them continuously, so what he seemed contempt for us students could very well be really kindness.	ru
If there is one thing that I learned a long time ago, it is that anger obnalls the mind. I saw so many people who know in person to transform into irrational beasts when they get infurious and your shit is no different. Try to keep calm.	ru
A carbon imprint is the amount of carbon dioxide pollution that we produce as a result of our activities. Some people try to reduce their carbon imprint because they are worried about climate change.	ru
A building with high ceilings and huge rooms may be less practical than the colorless office block that replaces it, but it often fits well into its surroundings.	de
Even if sentences from non -mother speakers are sometimes quite good, it is difficult to rely on it. It is therefore greater help if you are limited to contributing sentences in your mother tongue.	de
Maria wanted to redeem her birthday voucher, which the telephone company had sent to her, but the article was no longer in stock, so that she had to pull off sadly without a gift. Infinite disappointed, she changed the provider.	de
If all the insects of the Earth disappear, in less than 50 years it would disappear a lifetime. If all human beings disappear from the earth, in less than 50 years all life forms would flourish.	es
"Welcome.""I'm Honda. I have a reservation for 10.""""Thank you for coming. Today, we will provide a taxi service. It will take a little more because the taxi arrives, then, please wait here, if you don't mind.""""Okay then, I'm going to smoke a cigarette while I wait."""	ru
Read every day something else is reading. Think daily of something that nobody else is thinking. Do every day something that nobody else would be so idiot to do. It is bad for the mind to always be part of unanimity.	es
In return that Maria played his girlfriend at the school meeting, Tom had to consent to repair her car in his workshop free of charge and bring it through the TÜV.	de
Parents can no longer smoke while waiting to retire their children from school, and teachers will not be able to smoke among classes. The offenders will be fined for a considerable sum of $ 46 (2000 Baht), which represents about a week and average income for an average wage earner.	es
Nobody says that the disasters that occurred lately in Siberia, Australia, northwest of North America, Central Europe, China, etc. are caused directly by climate change but that it aggravates them and considerably increases the probability of that they occur.	es
In the distance you could hear the tintineo of a bell gently moved by the wind. Sara heard and smiled, maybe it was the signal she was waiting for.	es
After his successful flight to space, Juri Gagarin was officially thanked by the Soviet Union with a six -hour parade on the Red Square and a subsequent ceremony at the Leninmausoleum, where he was greeted by General Secretary Nikita Khrushchev.	de
If you want to seem like a mother tongue, you must be willing to practice repeating the same phrase over and over again in the same way that the Banjo players repeatedly practice the same sentence until they can play it correctly and the desired time.	ru
Nobody can find happiness without work. Woe to the lazy guy! Laziness is a serious illness and must be treated immediately;Yes, even from early childhood. Otherwise, he will kill you at the end.	ru
As part of a project that is in the service of the European efforts to switch from fossil fuels to renewable energies, Germany and Norway officially put a nautical cable between them on Thursday.	de
He thought that he could make it his striving to convince Chloe's father of his freedom qualities because he was far from being superior to her other admirers;But there was an obstacle that gave him great concern: Lamon, his own father, was not exactly rich, and when he remembered that his chances of success seemed very little.	de
I modified the French sentence because the English sentence of which it was the translation has itself been modified to be a little more natural. Consequently, it may be necessary to review this translation in Esperanto.	fr
To justify their war crimes, the United States bombard and destroy whole countries in the name of freedom and democracy. Of course, societies that sell missiles to the Pentagon, as well as mercenaries societies have very little to do with freedom and democracy. To have more oil, the American economy needs to devour millions of lives and these wars also benefit companies that sell weapons or praise killers.	fr
During the second time to play after the capture of his stone by the black, the white was able to occupy the point where his stone was taken, because between these two strokes, the position on the table changed. The capture of the black stone, at this moment only, was legal.	fr
Languages ​​that would never have been found together in traditional systems can be connected in Tatoeba. Great, isn't it? But where do we get those phrases, and how do we translate them? Obviously, this cannot be a person's work. This is why Tatoeba is done from collaboration.	es
Aming said he couldn't go to the saddle for ten weeks, so he went to see a doctor. The doctor replied that there was no problem. He just suggested eating more vegetables.	fr
If I am right with regard to my theory of relativity, the Germans will say that I am German and the French will say that I am a citizen of the world. If my theory turns out to be false, the French will say that I am German and the Germans will say that I am Jewish.	fr
We have all heard that one million monkeys typing on a million writing machines, over time they would reproduce the complete works of Shakespeare. Now, thanks to the Internet, we know this is not true.	es
Being an English speaker is double -edged. On the one hand, you speak the language most useful in the world to perfection;But on the other, nobody wants to speak another language with you, which makes it difficult to learn a foreign language.	fr
"Can you specify a date on which a language came into life?""What a question!""You want to say. And yet;There is such a date: July 26th, the EsperantoTag. On this day, a brochure by Ludwik Lejzer Zamenhof was published in Warsaw about an ""international language"" in Warsaw."	de
The room at the bottom of the hall seemed to have an open window but as I approached I noticed that it was a trapTojo painted on the wall.	es
During the imprisonment of Sir Thomas there was a frequent exchange of letters between him and this beloved daughter and, when he was deprived of pen and ink, he managed to write it with a coal.	es
"Are you calling me lazy? Ha! I have invented a way of acquiring everything I need from the comfort of my chair just by making this bell ring. I call her ""My younger sister.""I am a genius, right?"	es
If Darwin lived today, would you imagine that the highly sophisticated information processing system that our advanced technology allows us to see in the cells arise randomly, blindly and by natural selection?	es
"The new Tatoteba website will use a homemade ""Hyper"" database and a search engine that has been started from zero and run completely from Tatotebium on a Tatotebux-OS server with Tatoetel CPU."	de
In Ankara, I clearly said that America is not - and will never be - at war with Islam. We will constantly face violent extremists who pose a serious threat to our security.	fr
The cows fed with brachiaria are much less methane, a greenhouse gas. And Cruz says that by rotating the pineapple grass and the brachiaria every 6-8 years, he tripled the number of cows per hectare and eliminated the use of commercial fertilizers.	ru
With the help of animals - especially [non -human] monkeys, chimpanzees and dogs - American and Russian scientists - to what extent their own country was able to shoot a living organism into space and then bring it back to earth safely and intact.	de
"Tom, say that you liked it.""Ah, what?""""I say you liked"" for what? """"I just say.""""I like you ..."" ""Thank you.""""What was that?""""Nothing, don't worry."""	es
"""Can you tell me what you are doing in my room?"""" "" Nothing. I just wanted to see how your flowers go. I know how much they count for you.""And I am the queen of Saba. Cleared ! Fissa!»»"	fr
Consequently, it is undeniable that discipline, important, and moral education have been neglected. By granting excessive importance to the success of studies, many parents have forgotten the basic social life rules such as consideration for others.	fr
"Each preposition has a precise fixed meaning, but if we have to use some type of preposition and the meaning does not tell us what kind of preposition we should use, then we use the preposition ""je"", which has no specific meaning."	ru
"I do not understand how all over the world they can take your stuff in custody, but then the guy of the post office has the courage to say ""I'm sorry, we lost it"" and wait for it to end there."	ru
"""What's going on between you and Céline?"""""" What do you mean? """"Are you two ...? You know.""No, I don't know.»« I mean: are you going out together?"" "" Oh. Yes ... in a way.""What do you mean by"" in a way ""?""»« I mean: Take care of your things, Gwynn!»»"	fr
The will of the people is the basis of the authority of public power;This will will be expressed through authentic elections that will be held periodically, by universal and equal suffrage and by secret vote or other equivalent procedure that guarantees the freedom of the vote.	es
"""Here, for you.""- ""But we didn't want to give ourselves anything for Christmas!""- ""Yes, that's right. But when I saw it in the shop window, I just couldn't help it - I had to buy it to you.""- ""Strange. Something similar happened to me. Here, this gift is for you!"""	de
Recently, our son has been crying to try to get what he wants. A part of me wants to give in to get street, but I know that would be a bad parental education.	es
As there are usually several websites on any topic, I usually only give the back button when I enter a web page that has ads in emerging windows. I just go to the next page found by Google and I hope to find something less irritating.	es
Veroned passengers, we would now like to ask you to stow your luggage in front of you, to open the table and backrest, but to fold down your armrest, to put on your seat belt and open the window flaps.	de
Each individual has the right to education. Education must be free at least as regards the elementary and fundamental classes. Elementary education must be mandatory. Technical and professional education must be placed within everyone's reach and higher education must be equally accessible to everyone on the basis of the merits.	ru
It is true that Aristotle distinguishes the King's tyrant in which the first governs for his own utility and the second only for his subjects, would be deduced from the distinction of Aristotle who from the beginning of the world would not have existed a single king.	es
When I keep the theory of relativity right, the Germans will say that I am German, and the French, I am a world citizen. If my theory proves to be wrong, the French will say that I am German, and the Germans, I was a Jew.	de
We believe that it is our duty, in the name of human freedom, human dignity and human prosperity, to take up in heaven the goods which it stole from the earth and to restore them to the earth.	fr
Mathematicians are like the French: they take everything they tell them, translate it into their own language and transform it into something completely different.	de
In this book, you will find Esperanto two variants of the Hippocratic oath: the version from the original oath in Latin and that of the French version of the Order of Doctors of France.	fr
Technology has the potential to transform education into America, which allows students to learn more, to do it at their own pace, and to develop the knowledge and skills that employers require.	ru
"My girlfriend asked about the secret of her long and unusually harmonious marriage, explained: ""Right at the beginning, my husband and I noticed that we could not agree on anything. And that's why we never tried it."""	de
"""Is there no whipped cream to the cake? Without whipped cream, it tastes only half as good.""- ""Not this time. Grandpa forgot and we just noticed it.""- ""Wait short! I'll go over to Meiers. They definitely have those who can give us."""	de
Film dubbing seems a bigger business in the developing world. I have seen two science fiction films, without much understanding, in Hindi: Prometheus (2012), then the time machine (2002), which I have seen in English. It seems that many in India see science fiction in Hindi.	es
If I love someone, but someone does not love the person I loved when that first person loved me, and someone is a person, but someone does not want another person unless that person loves someone, does anyone love someone or does not love someone?	es
Although bids from time to time loses the overview of what his age is normal, his government will be a stable because he will gather experts and listen to their advice.	de
When he woke up, he remembered the dream as if it had been a nightmare, and since that day he began to forget a large number of very important details of his life.	es
A black stone captured a white stone, which was removed from the table. The black stone remained only one freedom. At the next move, if a white stone occupied the same point, now empty, it would capture that black stone, but this was not allowed, because this would have repeated the last position on the table.	ru
"Now, when Pharaoh tells you and will say: ""What are your occupations?""""You will answer:"" Your servants have gone to cattle from their youth so far and our fathers.""It is so that you stay in the province of Gessen, because the Egyptians hate any pastor of a cattle menu."	fr
I have cake, but I already had some yesterday, and I don't want to start fat, so I will attribute it to the little demons in my head, who wants to make life difficult for me, and ignore it.	de
Whenever such a failure takes place in another department, I am attempted to call them idiots, but then people like you appears to demonstrate what true idiocy is.	ru
There was a complaint from the neighbors because a drunk was making noise in the park. When the policemen arrived on the Kusanagi place he was alone, drunk rotten and completely naked.	ru
The researchers are quick to underline that genes are not necessarily fate and that devoted parents can still influence their children in a positive way, even if they are working only on a small percentage of the total variation.	ru
Maria couldn't sleep while her husband Tom was blessed next to her in Morpheusen's empire. It was true, she thought that you are nowhere more lonely next to a sleeper. But she didn't know where she had heard.	de
For many experts, lobsters and flour worms, among others, are the food of the future because they are rich in protein and much less harmful to the environment than, for example, cows. But are they also tasty?	es
I never got married because I have three pets at home who meet the same purpose as a husband. I have a dog that growls every morning, a parrot that escapes all afternoon and a cat that comes home late at night.	de
By dedicating his latest prayers, before deciding to be floated and devoured, he saw a man look over the fellow of the brick: he raised both hands;He agreed above the surface, and, by the incongruity of his movements, he happily attracted attention.	fr
It is high time that the Communists reveal to the face of the whole world their points of view, their objectives, their tendencies, and that they respond to this fable of the spectrum of communism by a manifesto of the party as such.	fr
Angry with Leif Ericson for having stolen the discovery 500 years before, Christopher Columbus once wrote a rigorous mathematical demonstration that showed that Ericson had never really been in North America. Unfortunately, this was too difficult to understand even for the brightest mathematicians.	es
All cetaceans (whales, dolphins and focus), all sirens (laminates and dugons) and several marine carnivores (seals, launches, triche and polar bears) are protected by the agreement on the international trade of the species of fauna and wild flora threatened of extinction (Cites).	ru
There were three beautiful sisters, lovely and tender. The dress of one was red, the second blue and that the third of pure white. They danced hand in hand in the bright moonlight on the quiet lake.	de
At a moment when our economy is growing, our companies create new jobs as quickly as in the 90s, and the salaries rise, we have to make decisions and consider what kind of country we want to be.	de
Kevin Spraggett made a really incredible lady sacrifice against Fred South in Ontario 1976: 1. E4 CC6 2. CF3 D6 3. D4 AG4 4. D5 CE5 5. CXE5 AXD1. Black surrendered in the nineteenth movement.	es
We are still moving away from the present moment. Our mental lives, which are intangible and devoid of dimensions, pass along the dimension of time with a uniform speed, from the cradle to the grave.	fr
How is it possible that a being with such sensitive jewels as the eyes, with such enchanted musical instruments such as the ears and with such a fabulous nerve mesh can experience itself as a little less than a god?	de
The opinions sustained with passion are always those for which there are no good arguments;In fact, passion is the way to measure the lack of conviction of the person who holds it. In politics and religion, opinions are almost always passionately sustained.	es
