Monsieur D'Espilly stimò la popolazione della Francia a più di 22 milioni di persone; più precisamente, 10.562.631 uomini e 11.451.726 donne; di conseguenza, la proporzione delle donne rispetto agli uomini era circa 14 a 13.	Monsieur D'Espilly, in the year 1772, calculated the population of France at upwards of 22 millions; namely, 10,562,631 males, and 11,451,726 females; consequently the proportion of females to males was about 14 to 13.
L'autista di un'auto in arrivo ha fatto lampeggiare le luci in direzione di Tom per avvertire che più avanti c'era un autovelox mobile. Tom, che stava sfrecciando, ha rallentato immediatamente e ha superato l'autovelox appena sotto il limite di velocità.	The driver of an oncoming car flashed his lights at Tom as a warning that there was a mobile speed camera up ahead. Tom, who had been speeding, immediately slowed down and passed the camera at just under the speed limit.
I nobili non esistono solo perché c'è un sistema di titolo nobiliare. Anche se non ci fosse alcun sistema nobiliare, ci saranno persone che sono naturalmente dominanti e che saliranno presto alla nobiltà. Così tanto per la nostra nobiltà, allora. Perché, siamo dei semplici contadini.	Nobles do not exist merely because there is a peerage system. Even if there were no peerage system, there will be people who are naturally dominant and who will quickly rise to nobility. So much for our nobility then. Why, we are mere peasants.
Gli impatti derivati dall'innalzamento del livello del mare e dalle ondate di tempesta, eventi meteorologici estremi, temperature più elevate e ondate di calore, i cambiamenti delle precipitazioni, il riscaldamento dell'Artico e le altre condizioni climatiche stanno coinvolgendo l'affidabilità e la capacità del sistema di trasporto degli Stati Uniti in molti modi.	The impacts from sea level rise and storm surge, extreme weather events, higher temperatures and heat waves, precipitation changes, Arctic warming, and other climatic conditions are affecting the reliability and capacity of the U.S. transportation system in many ways.
La chiusura delle scuole, ha detto Romano, è stata la cosa giusta da fare per limitare la diffusione del virus. Ma ha detto che il governo avrebbe anche dovuto fare chiudere le discoteche e fermare i viaggi in autobus perché le persone sono vicine anche in questi luoghi e rischiano di contrarre il virus.	The closure of schools, Romano said, was the right thing to do to limit the spread of the virus. But he said the government should also have closed discos and stopped bus travel because people are near each other also in these places and risk contracting the virus.
Dio non è una persona limitata che siede da sola tra le nuvole su un trono d'oro. Dio è pura Coscienza che dimora in tutto. Comprendendo questa verità, impara ad accettare e amare tutti allo stesso modo.	God is not a limited individual who sits alone up in the clouds on a golden throne. God is pure Consciousness that dwells within everything. Understanding this truth, learn to accept and love everyone equally.
E quando il primo americano musulmano è stato eletto di recente nel Congresso, ha promesso di difendere la nostra Costituzione usando lo stesso Sacro Corano che uno dei nostri Padri Fondatori - Thomas Jefferson - teneva nella sua biblioteca personale.	And when the first Muslim-American was recently elected to Congress, he took the oath to defend our Constitution using the same Holy Koran that one of our Founding Fathers – Thomas Jefferson – kept in his personal library.
Tommaso era ateo. Ora sta studiando biochimica e si è convinto che qualcosa come le molecole di DNA e RNA non possono essere il prodotto di leggi e forze naturali generate dal Big Bang.	Thomas was an atheist. Now he is studying biochemistry and has become convinced that something like DNA and RNA molecules cannot be the product of natural laws and forces generated by the Big Bang.
Gli Stati Uniti sono uno Stato canaglia. Non sono io che lo dice. L'ho letto negli scritti di vari autori rispettabili che sono nati e vivono negli Stati Uniti.	The United States are a rogue state. It is not me who says it. I read in the writings of several respectable authors who were born and live in the United States themselves.
La capacità inesauribile dell'uomo di credere a ciò che preferisce essere vero piuttosto che ciò che l'evidenza dimostra di essere probabile e possibile mi ha sempre stupito. Aspiriamo a un Universo premuroso che ci salverà dai nostri errori infantili, e di fronte alle montagne di prove del contrario riporremo tutte le nostre speranze sul più sottile dei dubbi. Dio non è stato dimostrato non esistere, quindi deve esistere.	Man's unfailing capacity to believe what he prefers to be true rather than what the evidence shows to be likely and possible has always astounded me. We long for a caring Universe which will save us from our childish mistakes, and in the face of mountains of evidence to the contrary we will pin all our hopes on the slimmest of doubts. God has not been proven not to exist, therefore he must exist.
I proprietari di animali domestici sono sempre felici di condividere un ricordo di quando il loro cane ha risposto al loro disagio venendo da loro o cercando di attirare la loro attenzione. Ma quelle sembravano solo storie, finché una nuova ricerca sulla rivista Learning & Behavior non ha scoperto che i cani provano davvero empatia verso i loro proprietari.	Pet owners are always happy to share a memory about the time their dog responded to their distress by coming to them or trying to get their attention. But those seemed to just be stories, until new research in the journal Learning & Behavior found that dogs really do feel empathy toward their owners.
Le traduzioni grigie sono traduzioni indirette. In altre parole, sono traduzioni di traduzioni, e non traduzioni della frase principale (la frase principale è la frase con le lettere grandi).	Grey translations are indirect translations. In other words, they are translations of the translations, and not translations of the main sentence (the main sentence is the sentence in big letters).
Dio non è una persona limitata che siede da sola tra le nuvole su un trono d'oro. Dio è pura Coscienza che dimora in tutto. Comprendendo questa verità, imparate ad accettare e amare tutti allo stesso modo.	God is not a limited individual who sits alone up in the clouds on a golden throne. God is pure Consciousness that dwells within everything. Understanding this truth, learn to accept and love everyone equally.
Tutti gli esseri umani nascono liberi ed eguali in dignità e diritti. Essi sono dotati di ragione e di coscienza e devono agire gli uni verso gli altri in spirito di fratellanza.	All human beings are born free and equal in dignity and rights. They are endowed with reason and conscience and should act towards one another in a spirit of brotherhood.
"Benvenuto. ""Sono Honda. Ho una prenotazione per le 10."" ""Grazie per essere venuto. Oggi, forniremo un servizio taxi. Ci vorrà un po' di più perché il taxi arrivi, quindi, per piacere, aspetti qui, se non le dispiace."" ""Va bene allora, vado a fumare una sigaretta mentre aspetto."""	"Welcome. ""I'm Honda. I have a reservation for 10 o'clock."" ""Thank you for coming. Today, we’ll be providing a taxi service. It will take a little more for the taxi to arrive, so please wait here, if you don’t mind."" ""Alright then, I'll just go have a smoke while I wait."""
Ricordi che lo scopo del Progetto Tatoeba è di creare frasi di esempio che possono essere utilizzate per studiare le lingue. Non è proprio un posto per contribuire delle frasi che non sono nella propria lingua madre perché altri le correggano per lei.	Remember that the purpose of the Tatoeba Project is to create example sentences that can be used for studying languages. It's not really a place to be contributing non-native language sentences for others to correct for you.
Se volete scattare una foto di qualcuno a mezz'aria, registrate un video della persona che salta, guardate il video, trovate il momento perfetto in esso e fate uno screenshot di quel momento.	If you want to take a picture of someone in midair, just record a video of the person jumping, view the video, find the perfect moment in it, and take a screenshot of that moment.
Più sono i paesi in cui si parla una lingua, meno importante è sembrare un madrelingua, dato che chi parla quella lingua è abituato a sentire vari dialetti.	The more countries a language is spoken in, the less important it is to sound like a native speaker, since speakers of that language are accustomed to hearing various dialects.
"Quando ero più giovane, odiavo andare ai matrimoni. Le mie nonne e le mie zie si stringevano attorno a me, mi davano un colpetto nel fianco e ridacchiavano ""Sei la prossima! Sei la prossima!"" Hanno interrotto questa assurdità solo quando ho iniziato a fare la stessa cosa ai funerali."	"When I was younger, I hated going to weddings. My grandmothers and aunts would huddle around me, poke me in the side, and giggle ""You're next! You're next!"" They only stopped this nonsense when I began to do the same thing at funerals."
Poco dopo, un dittatore turco ha deciso che tutta la sua gente doveva vestirsi alla maniera occidentale. Chiunque avesse disobbedito sarebbe stato condannato a morte. Successivamente, è tornato a parlare di nuovo con gli astronomi della sua scoperta. E questa volta tutti credevano che stesse dicendo la verità.	Shortly after, a Turkish dictator decided that all his people must dress in the Western fashion. Anyone who disobeyed would be sentenced to death. Afterwards, he went back to speak again with the astronomers about his discovery. And this time everyone believed he was telling the truth.
Io sono del parere che si dovrebbe riconoscere un creatore dalla sua creazione, e il mondo mi sembra essere assemblato in modo così doloroso che preferisco credere che non sia stato creato da nessuno che pensare che qualcuno abbia creato questo intenzionalmente.	I am of the opinion that you would recognize a creator by his creation, and the world appears to me to be put together in such a painful way that I prefer to believe that it was not created by anyone than to think that somebody created this intentionally.
Se una pietra nera occupa l'ultima libertà di una pietra bianca, questa viene catturata e rimossa dal tavolo. Questa cattura sarà un punto da detrarre dal conteggio finale del Bianco.	If a black stone occupies the last freedom of a white stone, the latter is captured and removed from the board. That capture will be a point to be deducted from White's final count.
Un gruppo algebrico affine su un campo k è un funtore covariante rappresentabile dalla categoria di algebre commutative su k alla categoria di gruppi tale che l'algebra che rappresenta è finitamente generato.	An affine algebraic group over a field k is a representable covariant functor from the category of commutative algebras over k to the category of groups such that the representing algebra is finitely generated.
E mentre lei non è più con noi, so che mia nonna sta osservando, insieme alla famiglia che mi ha reso quello che sono. Mi mancano stasera. Lo so che il mio debito verso di loro è oltre misura. A mia sorella Maya, a mia sorella Alma, a tutti i miei altri fratelli e sorelle, grazie mille per tutto il supporto che mi avete dato. Sono grato a loro.	And while she's no longer with us, I know my grandmother's watching, along with the family that made me who I am. I miss them tonight. I know that my debt to them is beyond measure. To my sister Maya, my sister Alma, all my other brothers and sisters, thank you so much for all the support that you've given me. I'm grateful to them.
La foresta diventava sempre più piccola, però gli alberi hanno scelto ancora e ancora l'ascia, perché era saggia e poteva persuadere gli alberi che era una di loro grazie al suo manico di legno.	The forest grew smaller and smaller, but the trees chose the axe again and again, because it was wise and could persuade the trees that it was one of them due to its wooden handle.
La nuotatrice, Cindy Nicholas, è riuscita a malapena a giungere a riva a Dover alla fine della lunga nuotata, però un portavoce della Channel Swimming Association ha annunciato che era molto in forma.	The swimmer, Cindy Nicholas, barely made it ashore at Dover at the end of the exhausting swim, but a spokesman from the Channel Swimming Association announced that she was in very good shape.
Le linee del tavolo hanno intersezioni ovunque si incrocino o si toccano. Ogni intersezione è chiamata punto, anche se si trova su un angolo o su un bordo del tavolo.	The lines of the board have intersections wherever they cross or touch each other. Each intersection is called a point, even if it is at a corner or an edge of the board.
Molte persone, soprattutto le persone ignoranti, vogliono punirvi per aver detto la verità, per essere corretti, per essere voi. Mai scusarsi per essere corretti o per essere anni prima del vostro tempo. Se avete ragione e lo sapete, dite quello che pensate. Anche se siete una minoranza di uno, la verità è ancora la verità.	Many people, especially ignorant people want to punish you for speaking the truth, for being correct, for being you. Never apologize for being correct or for being years ahead of your time. If you’re right and you know it, speak your mind. Even if you are a minority of one, the truth is still the truth.
Il vostro tempo è limitato, per cui non lo sprecate vivendo la vita di qualcun altro. Non fatevi intrappolare dai dogmi, che vuol dire vivere seguendo i risultati del pensiero di altre persone. Non lasciate che il rumore delle opinioni altrui offuschi la vostra voce interiore. E, cosa più importante di tutte, abbiate il coraggio di seguire il vostro cuore e la vostra intuizione. In qualche modo loro sanno che cosa volete realmente diventare.	Your time is limited, so don't waste it living someone else's life. Don't be trapped by dogma - which is living with the results of other people's thinking. Don't let the noise of others' opinions drown out your own inner voice. And most important, have the courage to follow your heart and intuition. They somehow already know what you truly want to become.
La foresta diventava sempre più piccola, ma gli alberi hanno scelto ancora e ancora l'ascia, perché era saggia e poteva persuadere gli alberi che era una di loro grazie al suo manico di legno.	The forest grew smaller and smaller, but the trees chose the axe again and again, because it was wise and could persuade the trees that it was one of them due to its wooden handle.
Non vi è nulla di simile, in questa fase della storia del mondo in America, come una stampa indipendente. Tu lo sai e io lo so. Non c'è nessuno di voi che osa scrivere le proprie opinioni oneste, e se l'avete fatto, si sa in anticipo che non apparirebbe mai in stampa Io sono pagato settimanalmente per tenere le mie opinioni oneste fuori dal giornale a cui sono collegato. Altri di voi sono pagati con stipendi simili per cose simili, e chiunque di voi che sarebbe sciocco da scrivere opinioni oneste sarebbe fuori per le strade in cerca di un altro lavoro. Se ho lasciato le mie opinioni oneste di apparire in una questione di mie carte, prima di 24 ore la mia occupazione sarebbe andato. L'attività del giornalista è quella di distruggere la verità, di mentire apertamente, di pervertire, di diffamare, di strisciare ai piedi di Mammona, e di vendere il suo paese e la sua razza per il suo pane quotidiano. Tu lo sai e io lo so, e che follia è questo brindare per una stampa indipendente? Noi siamo i burattini, loro tirano i fili e noi balliamo. I nostri talenti, le nostre possibilità e le nostre vite sono tutte proprietà di altri uomini. Noi siamo delle prostitute intellettuali.	There is no such thing, at this stage of the world’s history in the United States, as an independent press. You know it and I know it. There is not one of you who dare write your honest opinions, and if you did, you know beforehand that it would never appear in print. I am paid weekly for keeping my honest opinions out of the paper I am connected with. Others of you are paid similar salaries for similar things, and any of you who would be foolish as to write honest opinions would be out on the streets looking for another job. If I allowed my honest opinions to appear in one issue of my papers, before twenty-four hours my occupation would be gone. The business of the journalist is to destroy the truth, to lie outright, to pervert, to vilify, to fawn at the feet of Mammon, and to sell his country and his race for his daily bread. You know it and I know it, and what folly is this toasting an independent press? We are the jumping jacks, they pull the strings and we dance. Our talents, our possibilities and our lives are all the property of other men. We are intellectual prostitutes.
Poco dopo, un dittatore turco decise che tutta la sua gente doveva vestirsi alla maniera occidentale. Chiunque avesse disobbedito sarebbe stato condannato a morte. Successivamente, tornò a parlare di nuovo con gli astronomi della sua scoperta. E questa volta tutti credevano che stesse dicendo la verità.	Shortly after, a Turkish dictator decided that all his people must dress in the Western fashion. Anyone who disobeyed would be sentenced to death. Afterwards, he went back to speak again with the astronomers about his discovery. And this time everyone believed he was telling the truth.
Può non imparare a parlare bene come un madrelingua, però dovrebbe essere in grado di parlare sufficientemente bene in modo che i madrelingua capiranno quello che ha da dire.	You may not learn to speak as well as a native speaker, but you should be able to speak well enough that native speakers will understand what you have to say.
Le sindromi prendono spesso il nome dal medico o dal gruppo di medici che le hanno scoperte o che inizialmente hanno descritto il quadro clinico completo. Tali nomi di sindromi omonime sono esempi di eponimi medici. Recentemente, c'è stato uno spostamento verso la denominazione delle condizioni in modo descrittivo (per sintomi o causa sottostante) piuttosto che in modo eponimo, ma i nomi omonimi della sindrome spesso persistono nell'uso comune.	Syndromes are often named after the physician or group of physicians who discovered them or initially described the full clinical picture. Such eponymous syndrome names are examples of medical eponyms. Recently, there has been a shift towards naming conditions descriptively (by symptoms or underlying cause) rather than eponymously, but the eponymous syndrome names often persist in common usage.
Bianco: Torre in a1, pedone in b6, re in c8. Nero: pedoni in a7 e b7, re in a8, alfiere in b8. Il Bianco mette l'avversario nello zugzwang giocando la torre in a6, dopodiché il Nero ha solo due opzioni: prendere la torre in a6 o muovere il suo alfiere in qualsiasi altro scacco sulla diagonale b8-h2. Nel primo caso, il Bianco fa avanzare il suo pedone da b6 a b7 e dà scacco matto. Nella seconda situazione, la torre bianca prende il pedone nero in a7, con lo stesso risultato.	White: rook on a1, pawn on b6, king on c8. Black: pawns on a7 and b7, king on a8, bishop on b8. White puts the opponent in zugzwang by playing the rook to a6, after which Black has only two options: take the rook on a6 or move his bishop to any other square on the diagonal b8-h2. In the first case, White advances his pawn from b6 to b7 and checkmates. In the second situation, the white rook takes the black pawn on a7, with the same result.
Dopo ore di navigazione su TV Tropes, Lyle riusciva a prevedere il finale di ogni spettacolo. Questo gli ha dato il disgusto per l'intrattenimento che, in modo indiretto, gli ha permesso di crearsi il tempo per una vita più produttiva.	After hours of browsing TV Tropes, Lyle could predict the ending of any show. This gave him a distaste for entertainment that, in a roundabout way, enabled him to make time for a more productive life.
Gli impatti dei cambiamenti climatici aumenteranno i costi totali dei sistemi di trasporto della nazione e dei loro utenti, ma questi impatti possono essere ridotti attraverso il reindirizzamento, il cambiamento di modalità e una vasta gamma di azioni di adattamento.	Climate change impacts will increase the total costs to the Nation’s transportation systems and their users, but these impacts can be reduced through rerouting, mode change, and a wide range of adaptive actions.
La foresta diventava sempre più piccola, ma gli alberi hanno scelto ancora e ancora l'ascia, perché era saggia e riusciva a persuadere gli alberi che era una di loro grazie al suo manico di legno.	The forest grew smaller and smaller, but the trees chose the axe again and again, because it was wise and could persuade the trees that it was one of them due to its wooden handle.
Quindi, non ci sia dubbio: l'Islam è parte integrante dell'America. E io credo che l'America custodisca al proprio interno la verità che, indipendentemente da razza, religione, o posizione nella vita, tutti noi condividiamo aspirazioni comuni - vivere in pace e sicurezza; ricevere un'istruzione e lavorare con dignità; amare le nostre famiglie, le nostre comunità e il nostro Dio. Queste cose che abbiamo in comune. Questa è la speranza di tutta l'umanità.	So let there be no doubt: Islam is a part of America. And I believe that America holds within her the truth that regardless of race, religion, or station in life, all of us share common aspirations – to live in peace and security; to get an education and to work with dignity; to love our families, our communities, and our God. These things we share. This is the hope of all humanity.
Non sono contrario al vostro apprendimento dell'inglese per acquisire conoscenza o per guadagnare il vostro sostentamento, ma mi oppongo al vostro dare tanta importanza all'inglese e dare un posto basso alla vostra lingua nazionale, l'hindi. Io non credo che sia giusto da parte vostra usare nelle vostre conversazioni con i vostri amici e parenti in qualsiasi altra lingua che non sia la vostra lingua nazionale o la vostra lingua madre. Amate la vostra propria lingua.	I do not object to your learning English for the sake of acquiring knowledge or for the sake of earning your livelihood but I object to your giving so much importance to English and giving a low place to your national language, Hindi. I do not think it is right on your part to use in your conversation with your friends and relatives any other language than your national language or your mother tongue. Have love for your own language.
Il cavallo bianco in f3 è stato bloccato dall'alfiere nero in g4, ma è saltato e ha catturato un cavallo nero in e5, il che ha permesso all'alfiere nero di catturare la donna bianca in d1. È stato un bellissimo sacrificio intuitivo. Il bianco ha vinto la partita.	The white knight on f3 was pinned by the black bishop on g4, but it jumped and captured a black knight on e5, which allowed the black bishop to take the white queen on d1. It was a beautiful intuitive sacrifice. White won the game.
Ogni individuo ha diritto, in posizione di piena eguaglianza, ad una equa e pubblica udienza davanti ad un tribunale indipendente e imparziale, al fine della determinazione dei suoi diritti e dei suoi doveri, nonché della fondatezza di ogni accusa penale che gli venga rivolta.	Everyone is entitled in full equality to a fair and public hearing by an independent and impartial tribunal, in the determination of his rights and obligations and of any criminal charge against him.
È malattia essere ossessionati dalla vittoria, è malattia essere ossessionati dall'utilizzo delle arti marziali, ed è malattia essere ossessionati dal presentare tutto quello che si ha imparato. È malattia essere ossessionati con l'attacco, ed è malattia anche essere ossessionati dalla difesa. È malattia anche essere ossessionati dallo sbarazzarsi della malattia. Fissare la mente ossessivamente su qualsiasi cosa è considerato malattia.	It is sickness to be obsessed with winning, it is sickness to be obsessed with using the martial arts, and it is sickness to be obsessed with putting forth all one has learned. It is sickness to be obsessed with offense, and it is also sickness to be obsessed with defense. It is also sickness to be obsessed with getting rid of sickness. To fix the mind obsessively on anything is considered sickness.
Quando ero un ragazzino, pensavo che se io fossi morto il mondo sarebbe solo scomparso. Che delusione infantile! Semplicemente non potevo accettare che il mondo avrebbe potuto continuare ad esistere senza di me.	When I was a kid, I thought that if I died the world would just disappear. What a childish delusion! I just couldn't accept that the world could continue to exist without me.
Il conducente di un'automobile in arrivo fece lampeggiare le luci in direzione di Tom per avvertire che più avanti c'era un autovelox mobile. Tom, che stava sfrecciando, rallentò immediatamente e superò l'autovelox appena sotto il limite di velocità.	The driver of an oncoming car flashed his lights at Tom as a warning that there was a mobile speed camera up ahead. Tom, who had been speeding, immediately slowed down and passed the camera at just under the speed limit.
All'alba del mattino vi era la povera piccina, con le guance pallide e la bocca sorridente, appoggiata al muro. Era stata congelata a morte l'ultima sera dell'anno; e il sole di Capodanno salì e brillo su di un piccolo cadavere!	In the dawn of morning there lay the poor little one, with pale cheeks and smiling mouth, leaning against the wall. She had been frozen to death on the last evening of the year; and the New Year's sun rose and shone upon a little corpse!
