Viswanathan Anand, noto anche come Vishy Anand, è diventato il primo Gran Maestro indiano nel 1988, quando aveva 18 anni. È il più forte giocatore di scacchi non russo da Bobby Fischer.	Viswanathan Anand, also known as Vishy Anand, became the first Indian Grand Master in 1988, when he was 18 years old. He is the strongest non-Russian chess player since Bobby Fischer.
"Benvenuto. ""Sono Honda. Ho una prenotazione per le 10."" ""Grazie per essere venuto. Oggi, forniremo un servizio taxi. Ci vorrà un po' di più perché il taxi arrivi, quindi, per piacere, aspetta qua, se non ti dispiace."" ""Va bene allora, vado a fumare una sigaretta mentre aspetto."""	"Welcome. ""I'm Honda. I have a reservation for 10 o'clock."" ""Thank you for coming. Today, we’ll be providing a taxi service. It will take a little more for the taxi to arrive, so please wait here, if you don’t mind."" ""Alright then, I'll just go have a smoke while I wait."""
La prima rivolta è contro la tirannia suprema della teologia, del fantasma di Dio. Finché abbiamo un padrone in cielo, saremo schiavi sulla terra.	The first revolt is against the supreme tyranny of theology, of the phantom of God. As long as we have a master in heaven, we will be slaves on earth.
"Il 22 dicembre 1960, gli scienziati sovietici tentarono di lanciare Damka (""Piccola Signora"") e Krasavka (""Bellezza"") su uno Sputnik Korabl. Tuttavia, lo stadio superiore del razzo fallì e il lancio fu annullato. I cani furono recuperati sani e salvi dopo il loro volo suborbitale non pianificato."	"On December 22, 1960, soviet scientists attempted to launch Damka (""Little Lady"") and Krasavka (""Beauty"") on a Korabl Sputnik. However, the upper rocket stage failed and the launch was aborted. The dogs were safely recovered after their unplanned suborbital flight."
Non vi sono più problemi nella vita aziendale, ci sono solo sfide. E le sfide sono opportunità. Quindi non è per niente un problema se la società è in rosso, è solamente un'altra opportunità!	There are no longer any problems in business life, there are only challenges. And challenges are opportunities. So it is no problem at all if the company is in the red, it's just another opportunity!
Se mi inchino all'autorità degli specialisti e dichiaro di essere pronto a seguire, in una certa misura e per tutto il tempo che mi sembrerà necessario, le loro indicazioni e persino le loro direzioni, è perché la loro autorità non mi è imposta da nessuno, né dagli uomini né da Dio. Altrimenti li respingerei con orrore e inviterei il diavolo a seguire i loro consigli, le loro indicazioni e i loro servigi, certo che mi avrebbero fatto pagare, con la perdita della mia libertà e del rispetto di me stesso, tali brandelli di verità, avvolti in una moltitudine di bugie, come potrebbero darmi.	If I bow before the authority of the specialists and avow my readiness to follow, to a certain extent and as long as may seem to me necessary, their indications and even their directions, it is because their authority is imposed upon me by no one, neither by men nor by God. Otherwise I would repel them with horror, and bid the devil take their counsels, their directions, and their services, certain that they would make me pay, by the loss of my liberty and self-respect, for such scraps of truth, wrapped in a multitude of lies, as they might give me.
"Benvenuto. ""Sono Honda. Ho una prenotazione per le 10."" ""Grazie per essere venuto. Oggi, forniremo un servizio taxi. Ci vorrà un po' di più perché il taxi arrivi, quindi, per favore, aspetta qua, se non ti dispiace."" ""Va bene allora, vado a fumare una sigaretta mentre aspetto."""	"Welcome. ""I'm Honda. I have a reservation for 10 o'clock."" ""Thank you for coming. Today, we’ll be providing a taxi service. It will take a little more for the taxi to arrive, so please wait here, if you don’t mind."" ""Alright then, I'll just go have a smoke while I wait."""
Una ragione per evitare auto e mezzi pubblici è, considerando i costi già detti, che alcuni di voi non potrebbero permettersi tutte le spese, per cui vi è la necessità di ridurre queste spese quando possibile.	One reason to avoid cars and public transportation is that, with the costs mentioned above, some of you could not afford all the expenses, so they must be reduced when possible.
Le persone schiacciate dalla legge hanno speranze solamente dal potere. Se le leggi sono i loro nemici, essi saranno i nemici delle leggi; e coloro che hanno molto da sperare e nulla da perdere saranno sempre pericolosi.	People crushed by law, have no hopes but from power. If laws are their enemies, they will be enemies to laws; and those who have much to hope and nothing to lose, will always be dangerous.
La mia insegnante di latino mi guardava severamente sopra l'orlo dei suoi occhiali, ma adesso so che aveva a che fare solo con il fatto che indossava occhiali da lettura e che avrebbe trovato fastidioso toglierli continuamente, quindi quello che sembrava disprezzo verso noi studenti potrebbe benissimo essere davvero gentilezza.	My Latin teacher used to look down sternly on me over the rim of her glasses, but now I know it only had to do with the fact that she was wearing reading glasses and that she will have found it a nuisance taking them off all the time, so what looked like contempt towards us students might well and truly have been kindness.
"Come ti è piaciuto, cara amica, disse Tom con un sorriso, ""questo scacco matto che ti ho dato con la mia donna?"" - All'inizio Maria era scioccata. Mi sto perdendo qualcosa? Ma poi ha sorriso anche lei e ha risposto: ""Beh, cosa penseresti se catturassi la tua donna con il mio cavallo?"" E dopo aver mosso il cavallo, rimosse la donna dalla scacchiera."	"How did you like that, dear friend, said Tom with a smile, ""this checkmate that I gave you with my queen?"" - Mary was shocked at first. Would she have missed something? But she soon smiled too and replied, ""Well, what would you think if I captured your queen with my knight?"" And having moved the knight, she removed the queen from the board."
Questa mattina ho avuto un po' di disaccordo con mia moglie. Non pensavo che fosse un grande affare, ma vedendo com'è questa sera penso che devo averla sconvolta.	This morning I had a bit of a disagreement with my wife. I didn't think it was a big deal, but seeing what she's like this evening I think I must have upset her.
Il vero amore è eterno, infinito, e sempre come se stesso. È equo e puro, senza manifestazioni violente: lo si vede con i capelli bianchi ed è sempre giovane nel cuore.	True love is eternal, infinite, and always like itself. It is equal and pure, without violent demonstrations: it is seen with white hairs and is always young in the heart.
Sono venuto qui per cercare un nuovo inizio tra gli Stati Uniti e i musulmani di tutto il mondo; un inizio basato sull'interesse reciproco e sul mutuo rispetto; e uno basato sulla verità che l'America e l'Islam non sono esclusivi, e non devono essere in competizione. Invece, si sovrappongono e condividono principi comuni - principi di giustizia e di progresso; la tolleranza e la dignità di tutti gli esseri umani.	I have come here to seek a new beginning between the United States and Muslims around the world; one based upon mutual interest and mutual respect; and one based upon the truth that America and Islam are not exclusive, and need not be in competition. Instead, they overlap, and share common principles – principles of justice and progress; tolerance and the dignity of all human beings.
Sotto la cappa del camino c’era un vecchio contadino che suonava la chitarra, bim bum sbarra.	Eeny, meeny, miny, moe, catch a tiger by his toe, if he hollers let him go, eeny, meeny, miny, moe. My mother told me to catch the very best one and you are not it.
Per gran parte del secolo scorso, la fede dell'America nella libertà e nella democrazia era una roccia in un mare in tempesta. Adesso è un seme nel vento che mette le radici in molte nazioni.	Through much of the last century, America’s faith in freedom and democracy was a rock in a raging sea. Now it is a seed upon the wind, taking root in many nations.
Negli ultimi anni, gli adolescenti che imitano dei rapper americani sovvrappeso hanno camminato come pendoli invertiti, oscillando da sinistra a destra, che è l'unico modo possibile se si pesa più di duecentosessanta libbre, ma del tutto inefficace se sei un adolescente magro che pesa la metà, dal momento che la maggior parte dell'energia viene sprecata per i passi laterali, per non parlare della pura assurdità di tale andatura oscillante.	For the past few years, teenagers who imitate overweight American rappers have been walking like inverted pendulums, swinging from left to right, which is the only way forward if you weigh over two hundred and sixty pounds, but completely ineffective if you are a scrawny teenager weighing half of that, since most of the energy is wasted on side steps, not to mention the sheer absurdity of that swinging gait.
Le persone schiacciate dalla legge hanno speranze soltanto dal potere. Se le leggi sono i loro nemici, essi saranno i nemici delle leggi; e coloro che hanno molto da sperare e nulla da perdere saranno sempre pericolosi.	People crushed by law, have no hopes but from power. If laws are their enemies, they will be enemies to laws; and those who have much to hope and nothing to lose, will always be dangerous.
"Molti attivisti per i diritti degli animali, che credono che le specie non domestiche appartengano alla natura selvaggia, hanno condannato la proprietà di animali domestici cosiddetti ""esotici"". Un numero crescente di città e contee degli Stati Uniti ha vietato la proprietà di alcuni animali selvatici, come puma e lupi, per motivi di sicurezza pubblica. E il collegamento tra vaiolo delle scimmie e cani della prateria sta portando alcune persone a chiedersi se alcuni animali selvatici debbano essere tenuti come animali domestici."	"Many animal rights activists, who believe non-domesticated species belong in the wild, have condemned so-called ""exotic"" pet ownership. An increasing number of U.S. cities and counties have banned the ownership of certain wild animals, like mountain lions and wolves, for public safety reasons. And the connection between monkeypox and prairie dogs is causing some people to question whether any wild animals should be kept as pets."
"Ho raccontato agli altri bambini che il nostro treno ha urtato una persona e che per questo abbiamo avuto un ritardo. ""Oh mio Dio, no, non l'hai fatto, davvero? La maestra mi chiamerà..."" ""Tutti volevano sapere se la persona era morta e io ho detto che era andata in ospedale."" ""Prima raccontavi ai bambini della guerra in Ucraina, ora questo? Per piacere, non parlare di queste cose a scuola, tesoro. Alcuni bambini si arrabbieranno."""	"I told the other kids all about how our train hit a person, and that's why we were delayed. ""Oh my God, no you didn't, really? The teacher is going to call me. . ."" ""Everyone wanted to know if the person died, and I said they went to the hospital."" ""First you were telling kids about the war in Ukraine, now this? Please don't talk about this stuff at school honey. Some kids will be upset."""
"Quando ero più giovane, odiavo andare ai matrimoni. Le mie nonne e le mie zie si stringevano attorno a me, mi davano un colpetto nel fianco e ridacchiavano ""Sei la prossima! Sei la prossima!"" Hanno interrotto questa assurdità solo quando ho cominciato a fare la stessa cosa ai funerali."	"When I was younger, I hated going to weddings. My grandmothers and aunts would huddle around me, poke me in the side, and giggle ""You're next! You're next!"" They only stopped this nonsense when I began to do the same thing at funerals."
Potrebbe non essere in grado di trovare frasi aggiunte di recente perché non sono ancora indicizzate. L'indicizzazione di frasi non è ancora eseguita sul momento, ma solo ogni settimana.	You may not be able to find sentences that have been added recently because they have not been indexed yet. Indexation of sentences is not yet executed on-the-fly, only every week.
"Che brava gente, pensò dentro di sé Pinocchio. E dimenticando suo padre, il cappotto nuovo, l'abbecedario, e tutti i suoi buoni propositi, disse alla Volpe e al Gatto: ""Andiamo. Sono con voi."""	"What good people, thought Pinocchio to himself. And forgetting his father, the new coat, the A-B-C book, and all his good resolutions, he said to the Fox and to the Cat: ""Let us go. I am with you."""
So che aggiungere frasi solo nella tua lingua madre o nella tua lingua più forte non è probabilmente divertente quanto esercitarsi a scrivere in lingue straniere, ma, per favore, non aggiungere frasi nel corpus di Tatoeba se non sei assolutamente sicura che siano corrette. Se vuoi praticare le lingue che stai studiando, per piacere, fallo utilizzando un sito web progettato a tale scopo come www.lang-8.com.	I know that adding sentences only in your native or strongest language is probably not as much fun as practicing writing foreign languages, but please don't add sentences to the Tatoeba Corpus if you are not absolutely sure they are correct. If you want to practice languages that you are studying, please do so by using a website designed for that purpose such as www.lang-8.com.
Poiché i geni bianchi sono mutazioni dei geni degli uomini originali di colore - e i maschi sono mutazioni delle femmine originali - possiamo finalmente rispondere alla domanda: Dio è nero? La risposta è: Sì, Lei lo è.	Because the white genes are mutations of the genes of the original men of color — and males are mutations of the original females — we can finally answer the question Is God black? The answer is Yes, She is.
L'autista di un'auto in arrivo fece lampeggiare le luci in direzione di Tom per avvertire che più avanti c'era un autovelox mobile. Tom, che stava sfrecciando, rallentò immediatamente e superò l'autovelox appena sotto il limite di velocità.	The driver of an oncoming car flashed his lights at Tom as a warning that there was a mobile speed camera up ahead. Tom, who had been speeding, immediately slowed down and passed the camera at just under the speed limit.
Un'impronta di carbonio è la quantità di inquinamento da anidride carbonica che produciamo come risultato delle nostre attività. Alcune persone cercano di ridurre la loro impronta di carbonio perché sono preoccupate per il cambiamento climatico.	A carbon footprint is the amount of carbon dioxide pollution that we produce as a result of our activities. Some people try to reduce their carbon footprint because they are concerned about climate change.
So che aggiungere frasi solo nella sua lingua madre o nella sua lingua più forte non è probabilmente divertente quanto esercitarsi a scrivere in lingue straniere, ma, per favore, non aggiunga frasi nel corpus di Tatoeba se non è assolutamente sicuro che siano corrette. Se vuole praticare le lingue che sta studiando, per favore, lo faccia utilizzando un sito web progettato a tale scopo come www.lang-8.com.	I know that adding sentences only in your native or strongest language is probably not as much fun as practicing writing foreign languages, but please don't add sentences to the Tatoeba Corpus if you are not absolutely sure they are correct. If you want to practice languages that you are studying, please do so by using a website designed for that purpose such as www.lang-8.com.
Dal 26 al 28 settembre 2015, nove persone provenienti da cinque Paesi si sono riunite a Brno (Repubblica Ceca) per divertirsi insieme imparando a utilizzare la lingua Toki Pona. In questo video si trovano in un giardino botanico universitario e parlano di ciò che vedono.	From the 26th to the 28th of September 2015, nine people from five countries gathered in Brno (Czech Republic) to have fun together learning and using the Toki Pona language. In this video they are in a university botanical garden and talk about what they see.
Ogni volta che un fallimento del genere avviene in un altro reparto, sono tentato di chiamarli idioti, ma poi la gente come voi compare per dimostrare cos'è la vera idiozia.	Every time a failure like that occurs in another department, I'm tempted to call them idiots, but then people like you come along to demonstrate what true idiocy looks like.
All'inizio del gioco, il pedone è il pezzo con il valore più basso, ma se un pedone avanza all'altra estremità della scacchiera (ottava fila per il bianco, prima fila per il nero) sarà promosso, cioè sarà sostituito, a scelta del giocatore, con un cavallo, un alfiere, una torre o, più spesso, una donna.	At the beginning of the game, the pawn is the piece with the lowest value, but if a pawn advances to the other end of the board (eighth row for white, first row for black) it will be promoted, that is, it will be replaced, to player's choice, by a knight, a bishop, a rook or, most often, a queen.
In un momento in cui la nostra economia è in crescita, le nostre imprese stanno creando posti di lavoro al ritmo più veloce dagli anni '90, e i salari stanno iniziando a salire di nuovo, noi dobbiamo fare delle scelte sul tipo di paese che vogliamo essere.	At a moment when our economy is growing, our businesses are creating jobs at the fastest pace since the 1990s, and wages are starting to rise again, we have to make some choices about the kind of country we want to be.
Un discorso veritiero non è elegante, e un discorso elegante non è veritiero. Le parole buone non sono convincenti, e le parole convincenti non sono buone. Gli esperti non sono molti, e i molti non sono esperti.	Truthful speech is not elegant, and elegant speech is not truthful. Good words are not persuasive, and persuasive words are not good. The knowledgeable are not many, and the many are not knowledgeable.
La foresta diventava sempre più piccola, però gli alberi scelsero ancora e ancora l'ascia, perché era saggia e poteva persuadere gli alberi che era una di loro grazie al suo manico di legno.	The forest grew smaller and smaller, but the trees chose the axe again and again, because it was wise and could persuade the trees that it was one of them due to its wooden handle.
La volontà popolare è il fondamento dell’autorità del governo; tale volontà deve essere espressa attraverso periodiche e veritiere elezioni, effettuate a suffragio universale ed eguale, ed a voto segreto, o secondo una procedura equivalente di libera votazione.	The will of the people shall be the basis of the authority of government; this will shall be expressed in periodic and genuine elections which shall be by universal and equal suffrage and shall be held by secret vote or by equivalent free voting procedures.
Ian Nepomniachtchi, con i pezzi bianchi, ha commesso un grave errore nel nono incontro della partita per il Mondiale FIDE-2021, a Dubai, subendo la sua terza sconfitta. Ora: Carlsen 6 - Nepo 3.	Ian Nepomniachtchi, with the white pieces, blundered a bishop in the ninth game of the match for the FIDE-2021 World Championships, in Dubai, suffering his third defeat. Now: Carlsen 6 - Nepo 3.
"Quando ero più giovane, odiavo andare ai matrimoni. Le mie nonne e le mie zie si stringevano attorno a me, mi davano un colpetto nel fianco e ridacchiavano ""Sei la prossima! Sei la prossima!"" Hanno interrotto questa assurdità solamente quando ho iniziato a fare la stessa cosa ai funerali."	"When I was younger, I hated going to weddings. My grandmothers and aunts would huddle around me, poke me in the side, and giggle ""You're next! You're next!"" They only stopped this nonsense when I began to do the same thing at funerals."
La mia insegnante di latino mi guardava severamente sopra l'orlo dei suoi occhiali, ma ora so che aveva a che fare solo con il fatto che indossava degli occhiali da lettura e che avrebbe trovato fastidioso toglierli continuamente, quindi quello che sembrava disprezzo verso noi studenti potrebbe benissimo essere davvero gentilezza.	My Latin teacher used to look down sternly on me over the rim of her glasses, but now I know it only had to do with the fact that she was wearing reading glasses and that she will have found it a nuisance taking them off all the time, so what looked like contempt towards us students might well and truly have been kindness.
Monsieur D'Espilly stimò la popolazione della Francia a più di 22 milioni di persone; più precisamente, 10.562.631 maschi e 11.451.726 femmine; di conseguenza, la proporzione delle femmine rispetto ai maschi era circa 14 a 13.	Monsieur D'Espilly, in the year 1772, calculated the population of France at upwards of 22 millions; namely, 10,562,631 males, and 11,451,726 females; consequently the proportion of females to males was about 14 to 13.
Se solo in passato avessi iniziato a socializzare con la gente, a quest'ora forse sarei un'altra persona, ma, a causa del mio carattere chiuso che avevo a quei tempi, mi ritrovo con pochi amici e basta.	Had I started to socialize with people in the past, maybe I would be a different person now, but, because of the shy disposition I had at that time, now I really have few friends.
Un modo per ridurre il numero degli errori nel corpus di Tatoeba sarebbe incoraggiare la gente a tradurre solo nella propria lingua materna invece che al contrario.	One way to lower the number of errors in the Tatoeba Corpus would be to encourage people to only translate into their native languages instead of the other way around.
Se rinunci alla donna o a una torre in cambio dell'alfiere, del cavallo o anche del pedone del tuo avversario, stai facendo un sacrificio, che è quasi sempre, in effetti, un investimento perché stai cercando di ottenere una compensazione vantaggiosa.	If you hand over the queen or a rook in exchange for your opponent's bishop, knight, or even pawn, you are making a sacrifice, which is almost always, in fact, an investment because you are looking to gain advantageous compensation.
Le diverse forme di culto che esistevano nel mondo romano erano tutte considerate dal popolo egualmente vere, dai filosofi egualmente false, e dai pubblici poteri egualmente utili. Perciò la tolleranza provocava non solo indulgenza reciproca, ma anche concordia religiosa.	The various modes of worship which prevailed in the Roman world were all considered by the people as equally true; by the philosopher as equally false; and by the magistrate as equally useful. And thus toleration produced not only mutual indulgence, but even religious concord.
Lo scoppio della seconda guerra mondiale, nel 1939, rese impossibile lo svolgimento delle partite tra Alexander Alekhine e Paul Keres per il Campionato mondiale di scacchi in quel momento.	The outbreak of World War II, in 1939, made it impossible to carry out the match between Alexander Alekhine and Paul Keres for the World Chess Championship at that time.
Consigliamo di aggiungere frasi e traduzioni nella tua lingua più forte. Se sei interessato principalmente a correggere le tue frasi, dovresti provare un sito come Lang-8.com, dove quello è l'obiettivo.	We recommend adding sentences and translations in your strongest language. If you are interested primarily in having your sentences corrected, you should try a site like Lang-8.com, where that's the focus.
"Nel 1778, è stata stimata di essere circa di dieci milioni e, da un'enumerazione fatta nel 1787, la popolazione è stata accertata a 10.409.879 persone, e Boetticher, nel suo ""Conti statistici"", dichiara la popolazione composta da 11 milioni di persone."	In 1778, it was calculated to be about ten millions; and, by an enumeration made in 1787, the population was ascertained to be 10,409,879; and Boetticher, in his Statistical Accounts, states the population at 11 millions.
È come essere un guardiano dello zoo che fa da babysitter a quei bambini: hanno due cani, cinque lucertole, una tartaruga, avevano due capre svenute ma le hanno vendute o sono morte o qualcosa del genere, e i bambini sono come tre porcellini che si rincorrono e strillano.	It's like being a zookeeper babysitting those kids -- they have two dogs, like five lizards, a turtle, they used to have two fainting goats but they sold them or they died or something -- and the kids are like three little pigs chasing each other around and squealing.
"Per potere affrontare i criminali recidivi, il signor Johnson sta anche stabilendo una politica ""due colpi e sei fuori"": gravi violazioni delle regole comporteranno la rimozione permanente dei diritti del viaggio libero."	"In order to deal with repeat offenders, Mr Johnson is also establishing a ""two strikes and you're out"" policy - serious breaches of the rules will result in permanent removal of free travel rights."
Posso sembrare sicura di me, però divento estremamente nervosa a parlare davanti alle persone. Mi tremano le mani, divento completamente ammutolita e a volte non so nemmeno cosa sto dicendo.	I may seem confident, but I get extremely nervous speaking in front of people. My hands tremble, I get all tongue-tied, and sometimes I don't even know what I'm saying myself.
"Quando Giovanni, che era in prigione, sentì parlare delle gesta di Cristo, mandò due dei suoi discepoli a chiedergli: ""Sei tu colui che deve venire o dobbiamo aspettare un altro?"""	"When John, who was in prison, heard about Christ's deeds, he sent two of his disciples to ask him ""Are you the one who is to come, or should we expect another?"""
