"Possiamo risparmiare sulle traduzioni, dandole ad un impiegato la cui madre parli quella lingua. ""E suppongo che tu risparmi sul costo del medico facendoti visitare da qualcuno la cui madre era un dottore?"""	"We can save on translations by giving it to an employee whose mother speaks that language. ""And I suppose you save on the cost of a doctor by seeing someone whose mother had been a doctor?"""
I ricercatori sono rapidi a sottolineare che i geni non sono necessariamente il destino e che i genitori devoti possono ancora influenzare i loro figli in modo positivo, anche se stanno lavorando solamente su una piccola percentuale della variazione totale.	The researchers are quick to point out that genes are not necessarily destiny and that devoted parents can still influence their children in positive ways, even if they are only working on a small percentage of the total variation.
Venuta la sera, dato che eri un po' stanca, volesti sederti davanti a una nuova caffetteria situata all'angolo di un nuovo boulevard, ancora pieno di ghiaia e già mostrante i suoi splendori incompiuti.	Evening come, since you were slightly tired, you wished to sit in front of a new Café located on the corner of a new boulevard, still full of gravel and already showing its unfinished splendors.
Tatoeba è più di un sito web. Tatoeba è un gruppo di volontari che traduce delle frasi esistenti, o ne scrive di nuove, per poter permettere agli altri di avere familiarità con le proprie lingue.	Tatoeba is more than a website. Tatoeba is a group of volunteers that either translates existing sentences or writes new ones in order to make others familiar with the beauty of their own languages.
Un modo per ridurre il numero degli errori nel corpus di Tatoeba sarebbe incoraggiare la gente a tradurre soltanto nella propria lingua materna invece che al contrario.	One way to lower the number of errors in the Tatoeba Corpus would be to encourage people to only translate into their native languages instead of the other way around.
Quando c'era disperazione nella piana polverosa e depressione attraverso la terra, vide una nazione conquistare la paura stessa con un New Deal, nuovi posti di lavoro, un nuovo senso di scopo comune. Sì, possiamo.	When there was despair in the dust bowl and depression across the land, she saw a nation conquer fear itself with a New Deal, new jobs, a new sense of common purpose. Yes, we can.
Il padre di Roger Miller è morto quando aveva solo un anno e sua madre si è ammalata appena dopo, quindi è stato mandato a vivere con suo zio a Erick, Oklahoma.	Roger Miller's father died when he was only one year old and his mother became sick soon after, so he was sent to live with his uncle in Erick, Oklahoma.
La traduzione è sempre un tradimento, come osserva un autore Ming, può al meglio essere solo il rovescio di un broccato, tutti i fili ci sono, ma non la sottigliezza del colore o il design.	Translation is always a treason, and as a Ming author observes, can at its best be only the reverse side of a brocade,—all the threads are there, but not the subtlety of colour or design.
Ricordi che lo scopo del Progetto Tatoeba è di creare frasi di esempio che possono essere usate per studiare le lingue. Non è proprio un posto per contribuire delle frasi che non sono nella propria lingua madre perché altri le correggano per lei.	Remember that the purpose of the Tatoeba Project is to create example sentences that can be used for studying languages. It's not really a place to be contributing non-native language sentences for others to correct for you.
Studi hanno anche dimostrato che quando le piante sono sotto attacco rilasciano sostanze chimiche aromatiche. Tali sostanze chimiche attraggono insetti amici che attaccano gli insetti che mangiano la pianta. Schultz afferma che questa segnalazione chimica può essere facilmente rilevata da uno degli annusatori più sofisticati della natura, i cani.	Studies have also shown that when plants are under attack they release aromatic chemicals. Those chemicals attract friendly insects that attack the bugs eating the plant. Schultz says this chemical signaling can be easily detected by one of nature's most sophisticated sniffers, dogs.
Io e le mie colleghe abbiamo vissuto in una piccola cabina da due camere costruita sul bordo di una scogliera sulla montagna. Dico due camere, ma oltre all'ingresso, c'era una sala con un tatami da sei per due. Abbiamo mangiato patate, pesce essiccato e tofu. Dato che eravamo sulla cima di una montagna fredda, le patate sarebbero congelate durante l'inverno.	Me and my colleagues lived in a small 2 room cabin built on the edge of a cliff on the mountain. I say 2 rooms, but besides the entrance, there was a 6 by 2 tatami room. We ate potatoes, dried fish and tofu. Because we were on the top of a cold mountain, the potatoes would freeze during the winter.
Secondo Tom, la teoria dell'evoluzione attraverso mutazioni casuali e selezione naturale non è convincente per diverse ragioni, la più importante delle quali è l'esistenza del DNA. Tra gli altri punti inaccettabili, aggiunge Tom, questa teoria afferma che la mente umana – Socrate, Platone, Aristotele, Galileo, Newton, Shakespeare, Cartesio, Da Vinci, Mozart, Einstein, lo stesso Darwin – si è evoluta dalla mente di un primate non identificato, che sarebbe il nostro antenato.	According to Tom, the theory of evolution by random mutations and natural selection is not convincing for several reasons, the most important of which is the existence of DNA. Among other unacceptable points, Tom adds, this theory claims that the human mind – Socrates, Plato, Aristotle, Galileo, Newton, Shakespeare, Descartes, Da Vinci, Mozart, Einstein, Darwin himself – evolved from the mind of an unidentified primate, which would be our ancestor.
"E poi gli ululati sconsolati e ossessionanti echeggiarono lungo le strettoie del fiume e nelle nostre orecchie da un miglio di distanza, e prima che avessimo la possibilità di guardarci increduli, i cani risposero al branco con gioia. ""Siamo qui!"" sembravano dire. ""E siamo qui!"" ulularono di rimando i lupi."	"And then the forlorn and haunting howls echoed down the river narrows and into our ears from a mile away, and before we had a chance to look at each other in disbelief the dogs answered the pack joyously. ""We're over here!"" they seemed to say. ""And we're over here!"" the wolves howled back."
Quando una persona media invia un messaggio in una bottiglia, è solo una fantasia infantile. Quando Cristoforo Colombo invia un messaggio in una bottiglia, il destino di un intero paese è in gioco.	When an average person sends a message in a bottle, it's just a childish fantasy. When Christopher Columbus sends a message in a bottle, the fate of an entire country is at stake.
La chiusura delle scuole, ha detto Romano, è stata la cosa giusta da fare per limitare la diffusione del virus. Ma ha detto che il governo avrebbe anche dovuto far chiudere le discoteche e fermare i viaggi in autobus perché le persone sono vicine anche in questi luoghi e rischiano di contrarre il virus.	The closure of schools, Romano said, was the right thing to do to limit the spread of the virus. But he said the government should also have closed discos and stopped bus travel because people are near each other also in these places and risk contracting the virus.
La grande domanda che non ha mai avuto risposta, e alla quale non sono ancora stato in grado di rispondere, malgrado i miei trent'anni di ricerca sull'anima femminile è: che cosa vuole una donna?	"The great question that has never been answered, and which I have not yet been able to answer, despite my thirty years of research into the feminine soul, is ""What does a woman want?"""
Noi consigliamo di aggiungere frasi e traduzioni nella vostra lingua più forte. Se siete interessati principalmente a correggere le vostre frasi, dovreste provare un sito come Lang-8.com, dove quello è l'obiettivo.	We recommend adding sentences and translations in your strongest language. If you are interested primarily in having your sentences corrected, you should try a site like Lang-8.com, where that's the focus.
Gli amici possono aiutarsi a vicenda. Un vero amico è qualcuno che ti permette di avere la totale libertà di essere te stesso - e soprattutto provare emozioni. Oppure non provarne. Qualunque cosa ti capita di provare in un dato momento va bene per loro. Questo è ciò a cui ammonta l'amore vero - lasciare una persona essere quello che è realmente.	Friends can help each other. A true friend is someone who lets you have total freedom to be yourself - and especially to feel. Or, not feel. Whatever you happen to be feeling at the moment is fine with them. That's what real love amounts to - letting a person be what he really is.
Una simpatica signora mi ha portato in un'enorme, gigantesca - almeno per la prospettiva di un bambino di tre anni - stanza, con alti scaffali pieni di giocattoli. E io ero seduto lì, nello stesso posto, non ho idea di quanto tempo, ma probabilmente per cinque eterni minuti minuti o giù di lì, e poi ho iniziato a piangere come non ho mai pianto prima (o almeno è così che me l'ha descritto mia mamma). Le signore dalla scuola materna hanno cercato di calmarmi, ma non è servito a niente. Per fortuna, mia madre era ancora lì, a parlare con un genitore di un altro bambino, quindi è venuta da me e mi ha portato a casa. E hanno deciso di non portarmi lì di nuovo fino a quando non avevo sei anni o giù di lì.	A nice lady took me into a huge, gigantic – at least from a 3-year-old's perspective – room, with tall shelves filled with toys. And I was sitting there, in one place, for I have no idea how long, but probably for a colossal 5 minutes or so, and then I just started crying like I've never cried before (or at least that's how my mom described it to me). Ladies from the kindergarten tried to calm me, but there was no use. Fortunately, my mother was still there, talking with a parent of another kid, so she came to me and took me home. And they decided to never take me there again until I was 6 or so.
Negli scacchi, uno dei concetti più importanti è quello di opposizione, legato alla distanza (verticale, orizzontale o diagonale) che i re mantengono l'uno dall'altro alla fine di una partita.	In chess, one of the most important concepts is that of opposition, related to the distance (vertically, horizontally, or diagonally) that the kings keep from each other at the end of a game.
E tutti quelli che guardano stasera da oltre le nostre coste, dai parlamenti e dai palazzi, a quelli che sono rannicchiati intorno alle radio negli angoli dimenticati del mondo, le nostre storie sono singolari, ma il nostro destino è condiviso e una nuova alba della leadership americana è alle porte. mano.	And all those watching tonight from beyond our shores, from parliaments and palaces, to those who are huddled around radios in the forgotten corners of the world, our stories are singular, but our destiny is shared, and a new dawn of American leadership is at hand.
Il mio cane si chiama Belysh. Quest'estate gli ho insegnato a mettere la zampa. Ogni mattina mi sveglio presto e gli do da mangiare. Poi andiamo a fare una passeggiata. Mi difende dagli altri cani. Quando vado in bici, mi corre accanto. Ha un'amica, si chiama Chernyshka. Gli piace giocare con lei. Belysh è un cane molto gentile e intelligente.	My dog's name is Belysh. This summer I taught him to put out his paw. Every morning I wake up early and feed him. Then we go for a walk. He defends me from other dogs. When I go bike riding, he runs beside me. He has a friend, her name is Chernyshka. He likes playing with her. Belysh is a very kind and clever dog.
Il centro del gioco degli scacchi, formato dagli scacchi e4, e5, d4 e d5, ha un'importanza strategica eccezionale. Chi ha un centro forte avrà sempre un vantaggio nello svolgere sia operazioni di attacco che di difesa.	The center in the game of chess, formed by the e4, e5, d4, and d5 squares, has exceptional strategic importance. Whoever has a strong center will always have an advantage in carrying out both attack and defense operations.
"Ogni preposizione ha un preciso significato fisso, ma se dobbiamo usare un qualche tipo di preposizione e il senso non ci dice che tipo di preposizione dovremmo usare, allora usiamo la preposizione ""je"", che non ha alcun significato specifico."	"Every preposition has a definite, fixed meaning, but if we have to use some kind of preposition and the sense doesn't tell us what kind of preposition we should use, then we use the preposition ""je"", which has no specific meaning."
Ogni pistola che è prodotta, ogni nave da guerra varata, ogni razzo sparato significa, nel senso finale, un furto ai danni di coloro che hanno fame e non sono nutriti, quelli che hanno freddo e non sono vestiti. Questo mondo di armi non sta spendendo solo i soldi. Sta spendendo il sudore dei suoi operai, il genio dei suoi scienziati, le speranze dei suoi figli.	Every gun that is made, every warship launched, every rocket fired signifies, in the final sense, a theft from those who hunger and are not fed, those who are cold and not clothed. This world in arms is not spending money alone. It is spending the sweat of its laborers, the genius of its scientists, the hopes of its children.
Un modo per abbassare il numero degli errori nel corpus di Tatoeba sarebbe incoraggiare le persone a tradurre solamente nelle loro lingue materne invece che al contrario.	One way to lower the number of errors in the Tatoeba Corpus would be to encourage people to only translate into their native languages instead of the other way around.
La morte è qualcosa di cui siamo spesso scoraggiati a parlare o anche pensare, ma ho capito che la preparazione alla morte è una delle cose più donanti potere che si possono fare. Pensare alla morte chiarisce la vita.	Death is something that we're often discouraged to talk about or even think about, but I've realized that preparing for death is one of the most empowering things you can do. Thinking about death clarifies your life.
Non butto mai i mozziconi di sigaretta dal balcone quando fumo, perché ho paura che il vento li soffi nella finestra di qualcuno e scoppierà un incendio, le bombole del gas esploderanno, la gente morirà, ci sarà un'indagine e la gente capirà che è stata colpa mia e verrò mostrato in TV, e mia madre scoprirà che fumo.	I never throw cigarette butts off my balcony when I smoke, because I'm afraid the wind will blow them into someone's window and a fire will break out, gas containers will explode, people will die, an investigation will take place, and people will figure out that it was my fault and I'll be shown on TV, and my mom will find out that I smoke.
La Cina è l'unico paese in cui tre persone possono mangiare in un buffet di hotpot di media qualità per soli 5 RMB, ma un hamburger costa cinque volte tanto. Scopritelo!	China's the only country where three people can eat at a mid-range hotpot buffet for only 5 RMB, but a hamburger costs five times as much. Figure that one out!
La mia insegnante di latino mi guardava severamente sopra l'orlo dei suoi occhiali, ma adesso so che aveva a che fare solo con il fatto che indossava degli occhiali da lettura e che avrebbe trovato fastidioso toglierli continuamente, quindi quello che sembrava disprezzo verso noi studenti potrebbe benissimo essere davvero gentilezza.	My Latin teacher used to look down sternly on me over the rim of her glasses, but now I know it only had to do with the fact that she was wearing reading glasses and that she will have found it a nuisance taking them off all the time, so what looked like contempt towards us students might well and truly have been kindness.
"Quando ero più giovane, odiavo andare ai matrimoni. Le mie nonne e le mie zie si stringevano attorno a me, mi davano un colpetto nel fianco e ridacchiavano ""Sei la prossima! Sei la prossima!"" Hanno interrotto questa assurdità solamente quando ho cominciato a fare la stessa cosa ai funerali."	"When I was younger, I hated going to weddings. My grandmothers and aunts would huddle around me, poke me in the side, and giggle ""You're next! You're next!"" They only stopped this nonsense when I began to do the same thing at funerals."
Due anni fa, l'idea di offrire un semestre di ricerca per gli insegnanti particolarmente interessati e impegnati è diventata realtà. L'obiettivo è quello di migliorare la comunicazione tra le scuole e le università. Dal momento che gli insegnanti sono le persone migliori per diffondere la conoscenza appena acquisita, avranno l'opportunità di trascorrere un anno sabbatico di ricerca presso un'università e di integrare successivamente tale conoscenza in aula.	Two years ago, the idea of offering a research semester for particularly interested and committed teachers became reality. The aim is to improve communication between schools and universities. Since teachers are the best people for diffusing newly acquired knowledge, they will be given the opportunity to spend a research sabbatical at a university and to subsequently integrate this knowledge into classroom teaching.
Allora, questo bambino di quattordici anni imparò, come nei compiti, quello che nascondiamo alle fanciulle fino alla loro prima notte di nozze. Sfogliò i disegni del libro di anatomia, quei superbi disegni di una sanguinosa realtà. Si fermò ad ogni organo, capendo il più segreto di essi, quelli su cui fu costruita la vergogna di uomini e donne.	Then, this child of fourteen years learned, as in a homework, that which we hide to maidens until their wedding night. She flipped through the drawings of the anatomy book, those superb drawings of a bloody reality. She paused upon each organ, understanding the most secret of them, those upon which is built the shame of men and women.
"André Danican Philidor giocava tre partite allo stesso tempo, due alla cieca e una guardando la scacchiera. Diderot e D'Alembert l'hanno citato nell'Enciclopedia come ""una delle manifestazioni più fenomenali della mente umana""."	"André Danican Philidor used to play three games at the same time, two blindly and one looking at the board. Diderot and D'Alembert cited it in the Encyclopedia as ""one of the most phenomenal manifestations of the human mind""."
"Gli uomini tra noi amano interrogarsi sul futuro, mentre le donne tendono a riflettere sul passato. L'intelligenza artificiale è davvero una grande ""carta jolly"" da considerare. Gli umani coesisteranno con le macchine intelligenti? L'intelligenza artificiale sarà la nostra serva? O noi umani saremo i loro schiavi? Saremo come cani e gatti accanto alle macchine intelligenti? L'intelligenza artificiale ci tollererà? Almeno posso fare una congettura: forse missioni pericolose come i viaggi spaziali saranno svolte dall'intelligenza artificiale. Il corpo umano sarà troppo fragile per lo spazio? Il ""transumanesimo"" ci trasformerà in esseri più forti, con parti cibernetiche e bioingegnerizzate? Questo genere di cose è materia di storie di fantascienza oggi, ma domani potrebbero essere realtà..."	"The masculine amongst us like to wonder about the future, as the feminine tend to ponder about the past. Artificial Intelligence is indeed a big ""wildcard"" to consider. Will humans coexist with intelligent machines? Will AI be our servant? Or, will we humans be their slaves? Will we be like cats and dogs beside intelligent machines? Will AI tolerate us? At least I can conjecture: Maybe dangerous missions like space travel will be done by AI. Will the human body be too fragile for outer space? Will ""transhumanism"" transform us into stronger beings, with cybernetic and bioengineered parts? These kinds of things are the stuff of science fiction stories today, but tomorrow they may be reality…"
"I trogloditi dicevano ""ponte"" quando uno di loro attraversava un fiume, camminando sul tronco di un alto albero caduto lì per caso. Purtroppo, però, nessuno sa quale fosse quella parola."	"The troglodytes said ""bridge"" when one of them crossed a river, walking on the trunk of a tall tree that had fallen there by chance. Unfortunately, however, no one knows what that word was."
Che male farebbe se dovessi andare in giardino per un breve periodo di tempo e divertirmi tra gli alberi e fiori, e gli uccelli cantanti e le farfalle svolazzanti e il ronzio degli insetti, e guardare le gocce di rugiada che si nascondono dai raggi del sole nel cuori delle rose e gigli, e vagano sotto il sole, invece di rimanere tutto il giorno in questa stanza?	What harm would it do if I were to go into the garden for a short time and enjoy myself among the trees and flowers, and the singing birds and fluttering butterflies and humming insects, and look at the dew-drops hiding from the sunbeams in the hearts of the roses and lilies, and wander about in the sunshine, instead of remaining all day in this room?
Se non riesce a visitare un paese in cui parlano la lingua che sta imparando, trovi un bar locale in cui i madrelingua di quella lingua si incontrano e cominci a frequentarlo.	If you can't visit a country where they speak the language you are learning, find a local bar where native speakers of that language hang out and start hanging out there.
Vogliamo portare gli strumenti linguistici al livello successivo. Vogliamo vedere l'innovazione nel panorama delle lingue. E questo non può avvenire senza risorse linguistiche aperte che non possono essere costruite senza una comunità che non può contribuire senza delle piattaforme efficienti.	We want to bring language tools to the next level. We want to see innovation in the language learning landscape. And this cannot happen without open language resources which cannot be built without a community which cannot contribute without efficient platforms.
Non è perché si ha un titolo che si è un nobile. Ci sono persone che hanno una nobiltà naturale e sono nobili fini. Le persone come noi che hanno solo titoli nobiliari non sono nobili, siamo più come i contadini.	It's not because you have a title, that you're a noble. There are people who have a natural nobility and are fine nobles. People like us who only have nobility titles are not nobles, we're more like peasants.
"A proposito, sai che cos'è un santuario shintoista? ""Ho un po' di conoscenza in materia. Si tratta di una struttura religiosa in cui ciò che è l'oggetto di culto, il cosiddetto genius loci, è sancito."""	"By the way, do you know what a Shinto shrine is? ""I've a little bit of knowledge on the subject. It's a religious facility where that which is the object of worship, that called the genius loci, is enshrined."""
Thomas capisce che le leggi e le forze naturali, lo spazio-tempo, i campi elettromagnetici e gravitazionali, l'energia, gli atomi, le stelle, le galassie, la vita - in breve, tutto ha avuto origine in una singolarità indescrivibile che è misteriosamente esplosa: il Big Bang.	Thomas understands that natural laws and forces, space-time, electromagnetic and gravitational fields, energy, atoms, stars, galaxies, life, everything, in short, had its origin in an indescribable singularity that mysteriously exploded: the Big Bang.
Non vi è nulla di simile, in questa fase della storia del mondo in America, come una stampa indipendente. Tu lo sai e io lo so. Non c'è nessuno di voi che osa scrivere le proprie opinioni oneste, e se l'avete fatto, si sa in anticipo che non apparirebbe mai in stampa Io sono pagato settimanalmente per tenere le mie opinioni oneste fuori dal giornale a cui sono collegato. Altri di voi sono pagati con stipendi simili per cose simili, e chiunque di voi che sarebbe sciocco da scrivere opinioni oneste sarebbe fuori per le strade in cerca di un altro lavoro. Se ho lasciato le mie opinioni oneste di apparire in una questione di mie carte, prima di 24 ore la mia occupazione sarebbe andato. L'attività del giornalista è quella di distruggere la verità, di mentire apertamente, di pervertire, di diffamare, di strisciare ai piedi di Mammona, e di vendere il suo paese e la sua razza per il suo pane quotidiano. Tu lo sai e io lo so, e che follia è questo brindare per una stampa indipendente? Noi siamo i burattini, loro tirano i fili e noi balliamo. I nostri talenti, le nostre possibilità e le nostre vite sono tutte proprietà di altri uomini. Noi siamo delle prostitute intellettuali.	There is no such thing, at this stage of the world’s history in America, as an independent press. You know it and I know it. There is not one of you who dare write your honest opinions, and if you did, you know beforehand that it would never appear in print. I am paid weekly for keeping my honest opinions out of the paper I am connected with. Others of you are paid similar salaries for similar things, and any of you who would be foolish as to write honest opinions would be out on the streets looking for another job. If I allowed my honest opinions to appear in one issue of my papers, before twenty-four hours my occupation would be gone. The business of the journalist is to destroy the truth, to lie outright, to pervert, to vilify, to fawn at the feet of Mammon, and to sell his country and his race for his daily bread. You know it and I know it, and what folly is this toasting an independent press? We are the jumping jacks, they pull the strings and we dance. Our talents, our possibilities and our lives are all the property of other men. We are intellectual prostitutes.
