translated	origin_language
"Notice to parents: if your children use Tatoeba to study languages, it is advisable to take the time to run research on a sample of words that you consider inappropriate;And go ahead without restraint! You have no idea of ​​the level of garbage that spreads there without the slightest censorship, in the idea that ""it is language, after all""."	fr
To learn all the languages ​​he has learned, he should reach 90 years. And there is still a lot. I don't know that it will be more difficult then, learn or survive.	es
One of the bittersweet experiences of learning languages ​​is that, at some point, one ends up discovering that the lyrics of some songs that one liked are simply stupid or offensive.	es
A false but widespread idea on Christopher Columbus is that he once impressed a tribe of natives by predicting a moon eclipse. The truth is that he triggered her.	fr
As a prank, some students let go of three goats in their school after painting numbers 1, 2 and 4 on the sides of the goats. The teachers brought most of the day to search for goat number 3.	de
China is the only country in which three people can eat in a medium -quality hotpot buffet for only 5 RMB, but a hamburger costs five times a lot. Find out!	ru
When an average person sends a message in a bottle, it is just a childhood fantasy. When Cristoforo Colombo sends a message in a bottle, the fate of an entire country is at stake.	ru
Even if all the countries of the world and all the media recognize the legitimacy of this racist regime, it will always remain racist on the moral level.	fr
Hot dogs, nuts and seeds, pieces of meat or cheese, whole grapes, sticky or sticky candies, corn doves, pieces of peanut butter, raw vegetables, raisins, mask rubber and masters are known asphyxiation hazards for children.	es
According to Eugene Wigner, a Nobel Prize winner for physics, human consciousness could actually “stretch” - inexplicably - and change the physical condition of a system.	de
My Latin teacher looked at me severely above the hem of his glasses, but now I know that he had to do only with the fact that he wore reading glasses and that he would find annoying them continuously, so what seemed contempt for us students could very well be very kindness.	ru
Is it possible to believe that the subatomar particles and the very peculiar powers that make you connect to create matter are not the work of supernatural intelligence?	de
One of the reasons why Twitter is popular in Japan is a characteristic of Japanese: this language uses ideograms that make it possible to transmit in just 140 characters a lot of information compared to other languages, not counting the Chinese. Coincidentally, the Japanese version of this phrase is written with exactly 140 characters. How many characters are needed in other languages?	es
Federal Minister of Health Jens Spahn announced on Thursday that the nation vaccinated millions more than before. The epidemic protection authority, the Robert Koch Institute, became known to unimproved vaccination numbers.	de
It's quite easy to look elsewhere (at Wikionary for example) how to combine a verb. It is much more difficult to find the meaning of a word in a realistic sentence. This is the main mission of Tatoeba, which makes this project unique. I think we should focus on it.	fr
The individual stars of a constellation may appear very close together, but in fact huge distances can be between them;Of course, they don't have a real connection to each other.	de
Strasbourg is also an ideal starting point to make excursions through the RIN and visit the cuddled castles in the heart of the vineyards, villages perched on the slopes of the mountains between lakes and forests and other lovely places.	es
If a black stone occupies the last freedom of a white stone, it is captured and removed from the table. This capture will be a point to deduce from the final count of the whites.	fr
The spectacle, included in its entirety, is both the result and the project of the existing production method. It is not a real world supplement, its boiled decoration. It is the heart of the unrealism of real society. In all its particular forms, information or propaganda, advertising or direct consumption of entertainment, the spectacle constitutes the present model of socially dominant life. It is the omnipresent assertion of the choice already made in production, and its corollary consumption. Form and content of the show are identically the total justification of the conditions and ends of the existing system. The show is also the permanent presence of this justification, as the main part of the main part of the time experienced outside of modern production.	fr
Hot dogs, nuts and seeds, pieces of meat or cheese, whole grapes, hard or sticky candies, blown corn, peanut butter pieces, raw vegetables, raisins, chewing gum and marshmallows are known to suffocate for children.	fr
Every Friday I get up early, walk from here to the train station, buy a ticket to New York and spend the weekend with my parents. Then I drive home.	de
A carbon footprint is the amount of carbon dioxide pollution that we produce as a product of our activities. Some people try to reduce their carbon footprint because they are worried about climate change.	es
Why do so many people study the Japanese? The Kanyis do not respond to a logic, there are two alphabets, there are no spaces between the words, the adjectives change with the time of the prayer, there are various grammatical constructions for the different courtesy levels.	es
Schwarz makes the first train in a go game, i.e. puts the first stone on the board. In a handicap game, white plays first.	de
The EU has 24 official languages: English, Bulgarian, Czech, Danish, Estonian, Finn, French, Greek, Dutch, Croatian, Irish, Lithuanus, The Lastand the Italian.	es
If they spoke to me English, they wanted to sell me something. They spoke to me Esperanto, they wanted to be my friends.	de
My Latin teacher looked at me severely above the edge of his glasses, but now I know that he had to do only with the fact that he wore reading glasses and that he would find annoying them continuously, so what he seemed contempt for us students could very well be really kindness.	ru
"The micro-plastic bags (remains of plastic bags, packaging of take-out, and straws that disintegrate ""almost entirely but not quite"" in the oceans) are found in 3 fish out of 4, such as calamari, cuttlefish and saber fish from the different markets around the world."	fr
I would not push it to the end. You don't know what he could do. In my opinion, we are never too careful. It is even said that an agony would bit a cat if it had no choice.	fr
It is wrong. With all due respect, your holiness is wrong. Christ did not come here with Colombo. It was the antichrist who came. The indigenous holocaust was worse than the Holocaust of the Second World War, not even the Pope can deny it.	ru
"In the shade of the pendant tower of Pisa sits the singer of the city, eating a plate of pea soup. After that he will tell the children the fairy tale ""The princess on the pea""."	ru
"In the amusement park, Mary found a child just crying, and kindly said.""Hey, boy, what's wrong with you, are you lost? Do you want me to take you to the center of lost children?"	es
I am as light as a feather, I'm as happy as an angel, I'm as happy as a school boy. I dizzy like a drunk. All a Merry Christmas! A happy new year in the world.	de
Among some who have read Blackstone, and more that have not read it, there is the opinion that a man may chastise his wife as long as the weapon is not thicker than his little finger.	de
I was talking to my therapist in high school, and seeing that we were having a good time, suddenly I thought I had a chance, and tried to kiss her. But he told me to stop. I felt so shame while walking to my next class.	es
During the repression of the Manifestations of Paris of October 17, 1961, the Police murdered dozens of people;It is not known how many, but most likely they were between one hundred and two hundred. The massacre was silenced and censored while the media offered the official version of the death of five people, however, later, for weeks, bodies appeared in the Seine River.	es
Everyone has a house that she picks up, a home in which they find refuge. My house is the desert, my home is the lean heath. The north wind alone is my fire, the rain alone my bathroom.	de
Everyone has the right to education. Education must be free, at least regarding elementary and fundamental instruction. The elementary instruction will be mandatory. The technical and professional instruction must be generalized;Access to higher studies will be the same for all, depending on the respective merits.	es
Do you think that a peasant living a more organic life than you in an abandoned country, while she uses cow dung to make fire, is a certain richer way than you?	fr
Eugenio did not like to lift weights or make abdominals, or get tired in general, so his personal coach had him complicated to find a way of losing weight.	es
"Stay with all the land they want, said the aboriginal chief.""Oh no,"" said English general, ""we'll only keep an island.""""And what island?""The aboriginal chief asked.""Only Australia island,"" replied the English general."	es
America, we have gone so far. We have seen so much. But there is still much to do. So tonight let's ask ourselves: if our children lived to see the next century, if my daughters were so lucky as to live as much as Ann Nixon Cooper, what changes will see? What progress will we have done?	es
In the Kabyle dress, there are more than one color. There is, black, blue, green, mauve, navy blue, pink, red, silver, turquoise, purple, white, yellow, orange, and gray. She is multicolored.	fr
If Darwin were living today, he would imagine that the highly developed information processing system, which we can see in action thanks to our advanced technology in the cells, has arisen randomly and blindly and through natural selection?	de
I consider the theater as one of the greatest art forms, the most immediate way in which a human being can share with another the meaning of what it is to be a human being.	fr
If you give up the lady or a tower against the runner, jumper or even farmers from your opponent, you will bring a victim who is almost always an investment because you want to achieve an advantageous compensation.	de
And then the flies came;They crawled her on her eyes, and she also blinked: they didn't flew away;They couldn't do that either, because they had torn their wings out of them.	de
Remember that the purpose of the Tatoeba project is to create example phrases that can be used to study languages. It is not really a place to contribute phrases that are not in their mother tongue because others correct them for you.	ru
In the depths of the collective unconscious of humanity, the way of thinking of the troglodites must be found. Toki Pona is a useful tool to bring this to the surface of our conscience.	ru
"The people who have experienced the so -called ""lucid dreams"" often describes them as 'more real than reality'. Also, after waking up from a 'lucid sleep', they describe reality as a 'fantasy dream'."	es
When I did a CCO for the first time, I could not understand one thing explained in the classroom. Thank God I had a friend who is a programmer to explain to me how shack and puppets worked.	ru
"The recent vain epidemic of the monkeys in the American Midwest and its connection with the dogs of the prairie kept as pets has focused attention on the so -called ""property of exotic pets"". Here in America, it is not at all unusual that people keep pets such as dogs, cats or horses like pets. But prairie dogs are wild animals and for this reason, some people believe they should not be owned. But as Maura Farrelly from Voa discovered, dogs are not the only wild animals that are brought to American homes."	ru
Patriotism, in its simple, clear and obvious sense, is nothing else, in the eyes of the leaders, that an instrument allowing them to achieve objectives based on their thirst for domination and on their selfishness, while in the eyes of the citizens, it is the renunciation of human dignity, reason, consciousness, as well as their own servile submission to those who are in power.	fr
"As is customary on Christmas days, Pope Francis appeared on the balcony of St. Peter's Basilica and spoke the blessing ""Urbi et Orbi"" - for the city and for the earth."	de
I know that adding phrases only in his mother tongue or in his stronger language is probably not funny what he practiced in foreign languages, but, please does not add phrases in the corpus of Tatoeba if it is absolutely not sure they are correct. If he wants to practice the languages ​​he is studying, please do it using a website designed for this purpose such as www.lang-8.com.	ru
The money spent by Brazil in the construction of the stadiums for the 2014 FIFA World Cup already exceeded what were spent jointly Germany, in 2006, and South Africa, in 2010.	es
All are the same before the law and have, without distinction, the right to equal protection of the law. Everyone has the right to equal protection against all discrimination that violates this statement and against any provocation to such discrimination.	es
I dreamed that Congress carried out a sensitive tax reform to improve the situation of the working class. Then I woke up in a gutter with nothing more than tattered clothes and a stolen guitar in my name.	es
As Lincoln said to a much more divided nation than ours, we are not enemies but friends. Although passion has experienced them, it should not break our bonds of affection.	fr
After 136 movements and almost 8 hours of intense competition, Magnus Carlsen, with the white pieces, beat Ian Nepomniachtchi in the sixth game of the World Chess Championship, Dubai-2021. Now we have Carlsen 3.5 - Nepo 2.5.	es
All science is empirical;But the validity of the results obtained in each experiment is inseparably linked to the conditions and context of the consciousness in which the essay is carried out, that is, the entire nature.	es
As the government of the United States of America has not in any way based on the Christian religion, and as it does not carry in it any character of hostility towards the laws, the religion or the tranquility of Muslims and as the said states have never started war or act of hostility against any Muslim nation, the parties declare that no pretext based on religious opinions can never interrupt the existing harmony between the two countries.	fr
"Guerra had a parra, and Parra had a dog, and the dog of Parra bit the war parra. And Guerra hit the Prara to the Prare de Parra.""Say, Mr. Guerra: Why has you hit the bitch with the bitch?""""Because if the Parra bitch had not bit the war, war, she would not have hit her from Parra."""	es
My sister did not take over the lamp, she invented a story about aliens who come to Earth with the aim of destroying all yellow furniture.	es
"""Jeeves, my dear, I think something is wrong here.""- ""What do you think, sir?""- ""You drive on the left side of the street.""- ""Observed, sir.""- ""Well, we're here in Germany!"""	de
For over 200 years - in other words since the industrial revolution - the concentration of carbon dioxide in the air is increasing by heating fossil fuels and changing soil use.	de
Time has no divisions to mark its passage, there is never a storm or a blow of trumpets to indicate the beginning of a new month or year. Even when a new century begins it is only us, mortals, who play the bells and shoot with our guns.	es
Sometimes I want to ask God why he authorizes poverty, famine and injustice in the world, when he could do something, but I fear that he can ask me exactly the same question.	fr
I know that adding phrases only in his mother tongue or in his stronger language is probably not funny what he practiced in foreign languages, but, please does not add phrases in the corpus of Tatoeba if it is absolutely not sure they are corrected. If he wants to practice the languages ​​he is studying, please do it using a website designed for this purpose such as www.lang-8.com.	ru
The future will not be built by force, nor by the desire for conquest, but through the patient application of the democratic method, the spirit of constructive consensus and respect for freedom.	fr
Bad actors and trolls who are looking to take advantage of people around the Coronavirus use a variety of techniques to sow confusion. Wrong news articles are just a small part of it.	de
"From time to time, she sank into a kind of reverie and, when she was totally alone, she reasoned like this: ""I am suffering and yet I ignore the cause. I suffer, although I have no injury. I feel afflicted and I have not lost any of my sheep. I burn, while sitting in the shade. How many times have brambles skinned my skin without my crying? How many bees have they stung me with their darts and was I not healed so quickly? So what has now injured my heart should be more lively than all of this!»»"	fr
Let him like God that I am among the roses, who to kiss you lean while you swing, while on the lowest branch a bud unfolds, a buds unfold, to touch you, my queen.	fr
"Unlike most sports recognized by the International Olympic Committee, where competition can be ""mixed"" (for all, regardless of gender) or accessible only for men or only for women, in chess women can compete in an ""open"" division (including the world chess championship) but also have an exclusively feminine championship."	es
To claim the conspicuous inheritance that your distant prozius has left you in his will, I am happy to inform you that everything you need to do is carry out a bank transfer of $ 500 one tantum on the following account.	ru
In the exercise of their rights and in the enjoyment of their freedoms, every person will only be subject to the limitations established by law with the sole purpose of ensuring the recognition and respect of the rights and freedoms of others, and of satisfying the just demands of morality, public order and general welfare in a democratic society.	es
There were three 9 -points territories: one, at the center of the table, surrounded by 12 white stones;another, on the right side, surrounded by 9 black stones;And another, in the upper left corner, surrounded by 6 black stones.	ru
"The police are very easy to understand that someone has stolen my credit card and has taken a huge amount of money. It is much more difficult to make them understand that ""someone has stolen my magic sword."""	es
According to a legend, the French composer Alkan is said to have been killed by a crazy bookshelf when he wanted to use the Talmud, a holy book of Judaism, in the study room of his house.	de
"Today, on the morning of blue sky of July 2, 2022, returning from a convenience store in a corner in Lulu Island, I saw Miguel the Danish-French. He said he was fighting against nicotine. Then, he said he had to know that I have been a great traveler of this world.""I've seen everything!""I boasted. Miguel said the best is ""great literature while traveling.""As a musician, Miguel himself has traveled in North America, the Caribbean and Mexico. He said he has never been in Europe.""It's a completely different planet!""I said."	es
Beware of your thoughts because they will change in words. Beware of your words because they will become your actions. Beware of your actions because they will become your habits. Beware of your habits because they form your character. Beware of your character, because it is your destiny.	fr
"There is an expression that says that ""those who do not understand Unix are condemned to reinvent it poorly"". If we look at office linux, we realize that this is also true for office operating systems."	fr
Any political party should try to abolish social security, unemployment insurance and eliminate work laws and agricultural programs, it would not be heard about that party once again in our political history. There is a small splitting group, of course, who believes these things can be done. Among them are H. L. Hunt (probably knows its history), a couple of other millionaires of Texas oil, and an occasional politician or businessman from other areas. Their number is negligible and are stupid.	ru
It can be said, in fact, that the research, exploring the largest and smaller, contributes to the glory of God that is reflected in every part of the universe.	ru
Not finding his Sacapuntas, Luis tried to take a tip with the pencil with the scissors but not getting it, he went to buy a new Sacapuntas.	es
To deactivate a J-11 robot, attack it from above jumping from a window on the second floor, then breaking a bucket full of mud on its head.	fr
In the culture of certain peoples, has registered, in an indelible way, a feeling of superiority such, that he makes them able to completely dehumanize other peoples, to the point that all torture, all rape, all mass assassination appears to them legitimate.	fr
I know that adding phrases only in your mother tongue or in your stronger language is probably not funny what you practice in foreign languages, but, please not add phrases in the corpus of Tatoeba if you are absolutely not sure they are correct. If you want to practice the languages ​​you are studying, for pleasure, do it using a website designed for this purpose such as www.lang-8.com.	ru
"In the case of Big-Bang theory, it is assumed that all the matter and energy of the universe, and all space and time, were packaged at an infinitally small point. Of this ""singularity"", as it is called, it is that the entire universe sprouted."	es
If there is no more fuel available for the meltdown in medium -sized stars, the remaining matter contracts under the gravity, so that the star shrinks. It is then called a white dwarf.	de
"André Danican Philidor played three games at the same time, two blind and one on the board. Diderot and D'Alembert cited it in encyclopedia as ""one of the most phenomenal manifestations of the human mind""."	de
The most prosperous branches in the United States and Europe are the arms and pharmacy industry. Knowing this, there is no need to explain why there are always wars on earth. Yes, it's a shame.	fr
"When I went to bed on November 27, I hugged my blind cat and said to her: ""You and me, we are alone in this world.""But two days later my blind cat died and I stayed alone."	de
A group of scientists who evaluate data by a satellite surrounding the Mars claims to have discovered references to several underground lakes at the southern Pole of the planet, which is believed to consist of liquid salt water.	de
If someone still doubts that America is a place where everything is possible;who still wonders if our founders' dream is alive in our time;That still questions the power of our democracy, tonight is your answer.	es
I took a soup plate and carefully pushed the glass over the table corner, then poured water into the soup plate so that it could not flow on the floor.	de
Throughout the universe, there are an infinite number of these huge rotating spheres of matter, each with its own oddities and wonders, but without living beings on them to do something, like what we have on earth.	ru
Tom was the first man that Maria could not embrace who was unapproachable for her, and that meant that she completely fell into him.	de
That ineffable dignation of a god made man, pouring blood for the redemption of all men, was the most powerful reason that induced the Church to be interested in so much zeal in the manumission of slaves.	es
The examiner Committee wants me to have a contact to which to ask questions or to ask to ask for indications on the city and resources of the same;I therefore believe that she would be precisely that type of contact for me.	ru
"Etymologically, Scacco Matto means ""the king is dead"". However, the king has not been ""dead"" in the game of chess for a long time. In fact, the king is the only piece that cannot even be captured, even if the crackle ends the game and, rigorously, can be considered as a ""death"" for the king."	ru
She sat down next to the harvesters. He was given roast grain;She ate and satisfied herself, and she kept the rest. Then she got up to glean. Boaz gave this order to her servants: whom she also gleaks between the sheaves, and do not worry her, and even you will remove for her wreaths, which you will let her glean, without making her reproach.	fr
A rope hangs between two trees, on it is a board: it is a swing. Two pretty little girls in snow -white dress and with grinds that flutter from the hat, sit on it and swing.	de
In chess, the castling can only be done when both the king and the tower have not moved, all the boxes between them are free and are not dominated by any opposite piece and the king is not in check and would not be put in check when the castling was performed.	es
I do not place precise goals, neither in chess nor in life. Why if I did and reach that goal, what stimulus could I have after?	ru
"When the king of your opponent is at first (or eighth) row and is blocked by his own pawns or pieces, if you can, fail with the lady or a tower, even if this initially requires one or two sacrifices;The result of this maneuver will be failure and mat. In Brazil, this type of game is called ""failure and mat in the corridor"" or ""failure and mat in the drawer""."	fr
Oh no, Viviana, you should see that you will not really want to share your life with that non -vegetarian wandering of William, right? Someone who drinks so much whiskey, vodka and wine and goes voluntarily from the butcher will not have long life and you will soon be widowed.	ru
