"Liu Manqiang, stellvertretender Direktor des Chinesischen Forschungszentrums für Sozialwissenschaften und Informationstechnik, sagt: ""Die Informations- und Kommunikationstechnik hat ein hohes Wachstumspotenzial; ein wichtiges Ziel bei der Entwicklung der chinesischen Informationstechnik ist es, die Einwohner ländlicher Gebiete in höherem Maße von der Informations- und Kommunikationsindustrie profitieren zu lassen."""	"Liu Manqiang, deputy director of the Chinese Research Centre and College for Social Sciences and Information Technology, says ""Information and communication technology has the potential for a huge increase in value; an important goal for the development of China's information technology is allowing more rural citizens to benefit from the information technology industry."""
Sollten Sie heute irgendwo eine kleine, aufgeregte Frau mit einem viel zu großen Koffer die Straße entlangeilen sehen, schenken Sie mir ein aufmunterndes Lächeln. Dieses kann ich gut gebrauchen, denn ich schicke mich an, die größte Reise meines Lebens zu unternehmen.	If you see a small woman somewhere today looking hot and bothered and hurrying down the street with a suitcase that's far too big, give me an encouraging smile. I could do with it, because I'm about to embark on the biggest journey of my life.
„Da unten sitzt Tom.“ – „Dann sitzt er da halt.“ – „Willst du nicht hingehen und ihn ansprechen? Er wartet doch bestimmt darauf.“ – „Dann soll er warten. Wenn er was will, kann er kommen.“	"Tom's sitting down there. ""It's a free country."" ""Don't you want to go and speak to him? He's definitely waiting for you."" ""Then he can keep waiting. If he wants something, he can come here."""
Die Oberflächentemperatur auf der sonnenzugewandten Seite des Merkur erreicht 427 °C, das ist heiß genug, um Zinn zu schmelzen. Auf der sonnenabgewandten Nachtseite hingegen fällt die Temperatur auf −183 °C.	The surface temperature on the side of Mercury closest to the Sun reaches 427 degrees Celsius, a temperature hot enough to melt tin. On the side facing away from the Sun, or the night side, the temperature drops to -183 degrees Celsius.
Die Gravitationskraft zwischen zwei Objekten ist proportional zum Produkt der beiden Massen und umgekehrt proportional zum Quadrat des Abstandes der Schwerpunkte.	The force of gravity between two objects is proportional to the product of the two masses, and inversely proportional to the square of the distance between their centers of mass.
„Diese Suppe würde ich gerne nachkochen“, sagte Maria, ein aufgeschlagenes Kochbuch vor sich auf dem Tisch, „aber dafür brauche ich Wakame.“ – „Das kriegst du doch“, erwiderte Tom, „zum Beispiel in dem asiatischen Lebensmittelgeschäft in der Schillerstraße.“ – „Da gibt’s das? Dann lass uns da gleich mal hinfahren!“	"I'd like to make this soup, said Mary, an open cookery book in front of her on the table, ""but I need some wakame."" ""You can get that from the Asian food shop in Schiller Street,"" replied Tom. ""They've got it? Let's go there now, then!"""
Es wohnt Genuss im dunklen Waldesgrüne, Entzücken weilt auf unbetretner Düne, Gesellschaft ist, wo alles menschenleer, Musik im Wellenschlag am ewigen Meer; die Menschen lieb ich, die Natur noch mehr.	There is a pleasure in the pathless woods, there is a rapture in the lonely shore, there is society where none intrudes, by the deep sea, and music in its roar; I love not man the less, but Nature more.
Ich freue mich, Ihnen mitteilen zu dürfen, dass Sie zur Inanspruchnahme des Ihnen von Ihrem entfernten Großonkel in seinem Testament vermachten beträchtlichen Erbes nur eine einmalige Banküberweisung in Höhe von 500 Talern auf das folgende Konto zu entrichten haben.	In order to claim the sizable inheritance that your distant great uncle left you in his will, I'm happy to inform you that all you have to do is make a one-time, $500 bank transfer to the following account.
Papier ist geduldig. Von der Planung eines Vorhabens bis zur Ausführung kann eine lange Zeit vergehen. Nicht alles, was schriftlich vereinbart wird, wird eingehalten. Es wird viel geschrieben, was nicht stimmt.	Paper is patient. It can be a long time from the planning stage till the execution of a project. Not everything agreed on paper will be respected and accomplished. There is much written down that is wrong.
In Amerika stürzten die wichtigsten Aktienindizes am Montag einmal um drei Prozentpunkte ab, weil sich Investoren auf sichere Häfen, wie Gold oder amerikanische Staatsanleihen, stürzten.	In the United States, the major stock market indices at one point were down three percentage points on Monday, as investors rushed to safe havens, including gold and U.S. Treasury bonds.
Und wärst du auch dem ärmsten Bettler gleich, bleibt dir ein Freund, so bist du reich. Doch wer den höchsten Königsthron gewann und keinen Freund hat, ist ein armer Mann.	And even if you were the poorest beggar, if one friend remained, you would be rich. But he who has won the highest king's throne and has no friend is a poor man.
„Wir haben uns aber lange nicht gesehen, Tom! Hast du ein bisschen zugelegt?“ – „Ja, in letzter Zeit konnte ich mich überhaupt nicht dazu aufraffen, mich zu bewegen.“	"We haven't seen each other in a long time, Tom! Have you put on a little weight? ""Yes, lately I haven't been able to get myself to move around at all."""
„Tom ist schon seit Wochen keinen Tag mehr zu spät zur Arbeit gekommen, und es heißt, die Arbeit, die er leiste, sei ausgezeichnet.“ – „Ich bin wirklich froh, das zu hören. Ich habe mir schon große Sorgen um ihn gemacht.“ – „Dazu besteht nun kein Anlass mehr.“	"Tom has not been to work too late for weeks, and the work he's doing is said to be excellent. ""I'm really glad to hear that. I've been very worried about him."" ""There is no reason for that anymore."""
Dann schlich sie in der Annahme, ich schliefe noch, geräuschlos aus dem Zimmer, und einen Moment später vernahm ich einen schrillen, quietschenden Ton, der nur von den Angeln der Eingangstür herrühren konnte.	Then, thinking that I was still asleep, she slipped noiselessly from the room, and an instant later I heard a sharp creaking which could only come from the hinges of the front door.
Als Semiten (nach Sem, dem ältesten Sohn Noahs) bezeichnet man seit dem Ende des 18. Jahrhunderts aufgrund der Völkertafel im 1. Buch Mose, 10. Kapitel diejenige Gruppe von Völkern, die um das Jahr 3000 v. Chr. wahrscheinlich von der arabischen Halbinsel nach Mesopotamien, Syrien, Palästina und, vor 700 v. Chr., von Südarabien nach Abessinien, dem gegenüberliegenden afrikanischen Festland, vorgedrungen sind.	Since the end of the eighteenth century, the group of peoples who spread, probably from the Arabian peninsula, to Mesopotamia, Syria and Palestine around 3000 BCE — and, before 700 BC from southern Arabia to Abyssinia, on the opposite African mainland — have been designated as Semites. They were so called after Shem, who, according to the first Book of Moses, chapter 10, was the eldest son of Noah.
Eine Gruppe von Wissenschaftlern, die Daten von einem den Mars umkreisenden Satelliten auswerten, will am Südpol des Planeten Hinweise auf mehrere unterirdische Seen entdeckt haben, von denen angenommen wird, dass sie aus flüssigem Salzwasser bestehen.	A team of scientists studying data from a satellite orbiting Mars say they have discovered evidence of several lakes of what they believe is salty, liquid water beneath the surface of the planet’s south pole.
„Nein, nein, Vater“, sagte die Prinzessin, „ich bin zum Heiraten noch nicht alt genug. Gib mir wenigstens ein Jahr und einen Tag, bis die Hochzeit stattfindet!“ Sie hoffte nämlich, dass Georg kommen und sie vor dem gemeinen Marschall retten möge.	"No, no, father, said the princess, ""I am not old enough to marry yet; give me, at any rate, a year and a day before the wedding takes place,"" for she hoped that George would come and save her from the wicked marshal."
Als Rapunzel zwölf Jahre alt war, schloss es die Zauberin in einen Turm, der in einem Walde lag und weder Treppe noch Türe hatte, nur ganz oben war ein kleines Fensterchen.	When Rapunzel was twelve years old, the enchantress shut her into a tower, which lay in a forest, and had neither stairs nor door, but quite at the top was a little window.
Da der Kommunismus ausgedient hat und die Diktatur des Proletariats Geschichte ist, bewährt sich der Kapitalismus bisher bestens, obwohl er an sich noch eine Bedrohung für die Menschheit ist.	Since communism became obsolete and the dictatorship of the proletariat is out of date, capitalism proves to be the best so far, even though it itself is still a threat for humanity.
Ich bin so leicht wie eine Feder, ich bin so glücklich wie ein Engel, ich bin so froh wie ein Schuljunge. Mir schwindelt wie einem Betrunkenen. Allen frohe Weihnachten! Ein glückliches neues Jahr der ganzen Welt.	I am as light as a feather, I am as happy as an angel, I am as merry as a school-boy. I am as giddy as a drunken man. A merry Christmas to everybody! A happy New Year to all the world.
Gegen eine von Ian Nepomniachtchi nicht sehr geschickt gespielte Petroff-Abwehr holte Magnus Carlsen seinen zweiten Sieg im FIDE-2021-Weltmeisterschaftsspiel in Dubai. Jetzt: Carlsen 5 - Nepo 3.	Against a Petroff defense less skilfully played by Ian Nepomniachtchi, Magnus Carlsen took his second win in the FIDE-2021 World Championship match in Dubai. Now: Carlsen 5 - Nepo 3.
„Du brauchst einen Liebhaber!“ meinte Maria. – „Welchen aus der Schlange da draußen soll ich denn nehmen?“ entgegnete Anna lachend, denn sie meinte, dass selbst dann, wenn sie einen wollte, keiner zur Verfügung stünde. Schlange standen sie jedenfalls nicht.	"You need a man! said Mary. ""Which one should I choose from the queue out there?"" laughed Anna, believing that, even if she wanted one, there were none available. They weren't queuing up at any rate."
Spinoza erkannte, und zwar, wie ich finde, mit großer Tiefgründigkeit, dass ein fallender Stein, wenn er Verstand hätte, dächte: „Ich will mit einer Beschleunigung von 9,81 m/s² fallen.“ Unser freier Wille, das heißt, wenn wir die Begierde empfinden, wenn wir uns dessen bewusst sind, das, was wir tun, zu wollen, könnte selbst für uns eine Illusion sein.	"Spinoza saw, and I think with great profundity, that if a falling stone could reason, it would think, ""I want to fall at the rate of thirty-two feet per second per second."" Free will for us—that is, when we feel desire, when we are conscious of wanting to do what we do—may be even for us an illusion."
Wie ist es möglich, dass ein Wesen mit so sensiblen Juwelen wie den Augen, mit so verzauberten Musikinstrumenten wie den Ohren und mit einem so fabelhaften Nervengeflecht wie dem Gehirn sich selbst als etwas weniger als einen Gott erleben kann?	How is it possible that a being with such sensitive jewels as the eyes, such enchanted musical instruments as the ears, and such fabulous arabesque of nerves as the brain can experience itself anything less than a god?
Das Gerät lässt sich nicht mehr hochfahren, außer man hat vorher den Akku herausgenommen und wieder eingesetzt; dann fährt das Gerät manchmal doch kurz hoch, schaltet sich aber meist gleich beim Eingeben der Pinnummer oder spätestens nach drei Minuten von selbst wieder aus.	The device won't start until the battery has been reseated, at which point it sometimes starts up briefly, but mostly switches itself off just as you're entering the PIN or, at most, three minutes later.
Die humane Gesellschaft ist eine Aufgabe der gesamten Menschheit. Die, die am meisten von ihr profitieren, sollten am meisten für den Gewinn bezahlen, den sie erzielen. Aber da sie natürlich gierig sind, wollen sie einfach mehr.	Human society is a function of all humanity, those who profit most from it should pay the most for the benefit they gain, of course being greedy, they just want more.
"Die Vorstellung, dass Gott ein übergroßer weißer Mann mit Rauschebart ist, der im Himmel sitzt und jeden heruntergefallenen Spatz zählt, ist lächerlich. Aber wenn man mit ""Gott"" die physikalischen Gesetze meint, die das Universum regieren, dann gibt es natürlich einen solchen Gott."	The idea that God is an oversized white male with a flowing beard who sits in the sky and tallies the fall of every sparrow is ludicrous. But if by 'God' one means the set of physical laws that govern the universe, then clearly there is such a God.
Vom 26. bis 28. September 2015 trafen sich neun Personen aus fünf Ländern in Brünn in der Tschechischen Republik, um beim Erlernen und Benutzen der Sprache Toki Pona zusammen Spaß zu haben. In diesem Video sind sie in einem botanischen Garten der Universität und sprechen über das, was sie sehen.	From the 26th to the 28th of September 2015, nine people from five countries gathered in Brno (Czech Republic) to have fun together learning and using the Toki Pona language. In this video they are in a university botanical garden and talk about what they see.
Wer Verstand hat, passt sich der Welt an; wer keinen Verstand hat, will die Welt an sich anpassen. Deshalb hängt aller Fortschritt von Menschen ohne Verstand ab.	Those who understand adapt to the world; those who don't understand want the world to adapt to them. This is why all human progress depends on people who don't understand.
Sie wurde gerade eine Generation nach der Sklaverei geboren, in einer Zeit, als es keine Autos auf der Straße und keine Flugzeuge am Himmel gab, als jemand wie sie aus zwei Gründen nicht wählen durfte, nämlich aufgrund des Geschlechts und der Hautfarbe.	She was born just a generation past slavery; a time when there were no cars on the road or planes in the sky; when someone like her couldn't vote for two reasons — because she was a woman and because of the color of her skin.
Gäbe es in der Welt nicht so etwas wie Zurschaustellung, dann — das ist meine Privatmeinung, und ich hoffe, sie stimmen mir zu — würden wir beträchtlich besser mit einander auskommen, als wir es derzeit tun, und könnten eine unendlich liebenswürdigere Gesellschaft sein, als wir es derzeit sind.	If there were no such thing as display in the world, my private opinion is, and I hope you agree with me, that we might get on a great deal better than we do, and might be infinitely more agreeable company than we are.
Ich habe auf dem Flohmarkt für läppische zweihundert Euro eine handsignierte Gesamtausgabe der Werke Tom Müllers erstanden. Oh, ich habe diesen ahnungslosen Verkäufer beraubt! Ich sollte Abbitte in der Kirche leisten!	I bought an autographed collected edition of the works of Tom Miller for a laughable two hundred euros at a flea market. Oh, I robbed that clueless seller! I should confess in church!
„Sie sind unser neuer Gast, stimmt’s? Ich habe Sie gar nicht so früh erwartet.“ – „Der Mann mit dem Versorgungsschiff, Ole Jansen, hat mich übergesetzt. Der redet nicht viel, der Herr Jansen, oder?“ – „Ja, so sind wir hier oben auf der Hallig.“	"You're our new guest, are you? I wasn't expecting you so soon. ""The man with the supply ship, Ole Jansen, ferried me over. He doesn't say much, does he, that Mr Jansen?"" ""Yes, well, that's what we're like up here, us islanders."""
Tom stieg aus dem Wagen und ging so unauffällig wie möglich ins Tankstellengebäude. Obwohl er es schon einige Male gemacht hatte, konnte er sich eines Anfluges von schlechtem Gewissen ob der Tat dennoch nicht erwehren. Er versuchte, dieses Gefühl irgendwie loszuwerden, als er sich einige eisgekühlte Sechserpacks und eine Tüte Brezeln nahm und sich in die Warteschlange stellte.	Tom got out of the car and went into the gas station as inconspicuously as possible. Even though he had done this several times before, he still couldn’t help but feel a pang of guilt at what he was doing. He tried to brush that feeling aside as he grabbed a couple of ice cold six-packs and a bag of pretzels and waited in line.
Jeden Freitag stehe ich früh auf, gehe zu Fuß von hier bis zum Bahnhof, kaufe eine Fahrkarte nach New York und verbringe das Wochenende bei meinen Eltern. Dann fahre ich heim.	Every Friday I get up early, walk from here to the train station, buy a ticket to New York, and spend the weekend with my parents. Then I go home.
Und heute Abend denke ich an alles, was sie im Laufe ihres Jahrhunderts in Amerika gesehen hat - den Kummer und die Hoffnung, den Kampf und den Fortschritt, die Zeit, in der wir gesagt bekamen, dass wir nicht können, und die Leute, die am amerikanischen Glauben festhielten: Ja, wir können.	And tonight, I think about all that she's seen throughout her century in America — the heartache and the hope; the struggle and the progress; the times we were told that we can't, and the people who pressed on with that American creed: Yes we can.
Eines Nachts im Jahre 1572 sah der dänische Astronom Tycho Brahe etwas, was er für einen strahlenden neuen Stern im Sternbild der Kassiopeia hielt. Wir wissen heute, dass er eine Supernova beobachtete. 1604 wurde eine zweite Supernova beobachtet. Diese Entdeckungen führten dazu, dass Wissenschaftler die Theorie des Ptolemäos, dass alle Sterne in einer unveränderlichen äußeren Schale des Universums enthalten wären, stark in Zweifel zogen.	One night in 1572, Danish astronomer Tycho Brahe saw what he thought was a brilliant new star in the constellation Cassiopeia. (We now know he was observing a supernova.) In 1604, a second supernova was observed. These discoveries caused scientists to seriously question Ptolemy's theory that all stars were contained in an outermost sphere of the universe that never changed.
Dr. Ride führt den Titel einer Baccalaurea Artium in Englisch und einer Bakkalaurea Scientiarum in Physik. Außerdem hat sie einen Magister- und einen Doktortitel in Physik.	Dr. Ride has a Bachelor of Arts degree in English and a Bachelor of Science degree in Physics. She also has a Masters degree in Physics and a Ph.D. in Physics.
Da sie kein Gefühl für die fremde Währung hatten, rechneten Tom und Maria die Beträge in Tafeln Schokolade um. So kostete zum Beispiel eine Busfahrt umgerechnet 2⅓ Tafeln Schokolade. Tom fand das ziemlich teuer.	Tom and Mary didn't have a feel for the foreign currency, so they counted the cost of things in bars of chocolate: for example, the cost of a bus journey translated to about two-and-a-third bars of chocolate, which was rather expensive, Tom thought.
Ist es möglich zu glauben, dass die subatomaren Teilchen sowie die sehr eigentümlichen Kräfte, die sie dazu bringen, sich zu verbinden, um Materie zu erzeugen, nicht das Werk einer übernatürlichen Intelligenz sind?	Is it possible to believe that subatomic particles, as well as the very peculiar forces that lead them to combine to generate matter, are not the work of a Supernatural Intelligence?
Sie soll Besitzerin der größten Pinguinsammlung im ganzen Lande sein. Plüschtiere, Porzellanfiguren, Bilder, Bücher, Postkarten – alles ist dabei. Nur einen echten Pinguin, den hat sie noch nicht.	They say she's the owner of the largest collection of penguins in the land. Cuddly toys, porcelain figurines, pictures, books, postcards – it's all there. Only, she doesn't have an actual penguin yet.
Und heute Abend denke ich an alles, was sie im Laufe ihres Jahrhunderts in Amerika gesehen hat - den Kummer und die Hoffnung, den Kampf und den Fortschritt, die Zeit, in der wir gesagt bekamen, dass wir nicht können, und die Leute, die am amerikanischen Glauben festhielten: Ja, wir können.	And tonight, I think about all that she's seen throughout her century in the United States — the heartache and the hope; the struggle and the progress; the times we were told that we can't, and the people who pressed on with that American creed: Yes we can.
In den wilden letzten Minuten des Spiels schoss Max eine wunderschöne Flanke zum langen Pfosten, wo seine Katze auf das gleißende, ins Flutlicht getauchte Spielfeld huschte, mit den Hinterbeinen hoch empor über alle Verteidiger und Angreifer in die Luft sprang und mit einem Kopfball den Siegestreffer versenkte, worüber die Menge in Begeisterung ausbrach und womit sie Fußballgeschichte schrieb.	In the final raucous minutes of the match, Max whipped in a delicious cross to the far post, where his cat, scampering on to the gleaming floodlit pitch, using her hind legs to leap high into the air, higher than all the defenders and attackers, headed in the winning goal, sending the crowd into raptures and ensuring her place in football folklore.
Das Kornische gleicht dem Walisischen und sogar noch mehr dem Bretonischen, welches eigentlich von der Sprache der alten Briten abstammt, die während des frühen Mittelalters nach dem französischen Festland auswichen, der heutigen Bretagne.	Cornish is similar to Welsh, and is closer still to Breton, a language which derives from that of the ancient Britons who, during the early Middle Ages, migrated across to today's Brittany on the French mainland.
In den Geschichtsbüchern steht, dass nach der Mongoleninvasion Bagdads viele Bücher in den Fluss Tigris geworfen wurden und die Farbe des Flusses durch die Tinte der Bücher so blau wurde.	History books write that after the Mongol invasion of Baghdad, many books were thrown into the Tigris River and therefore the colour of the river turned blue with the ink of books.
In einer Go-Partie macht Schwarz den ersten Zug, dh legt den ersten Stein auf das Brett. In einer Handicap-Partie spielt Weiß jedoch zuerst.	In a game of Go, it is up to Black to make the first move, that is, to place the first stone on the board. In a handicap game, however, White plays first.
Die sieben Weltwunder der Antike sind die Große Pyramide von Gizeh, die Hängenden Gärten zu Babylon, der Tempel der Artemis, die Zeusstatue von Olympia, das Grabmal zu Halicarnassus, der Koloss von Rhodos und der Leuchtturm von Alexandria.	The Seven Wonders of the Ancient World are the Great Pyramid of Giza, the Hanging Gardens of Babylon, the Temple of Artemis, the Statue of Zeus at Olympia, the Mausoleum at Halicarnassus, the Colossus of Rhodes, and the Lighthouse of Alexandria.
Der Herr hat zu uns deutlich gesprochen: „Seid fruchtbar und mehrt euch und bevölkert die Erde”. Das ist ein heiliges Gebot, das ich nicht ablehnen kann, denn Gott arbeitet auf geheimnisvolle Weise. Deshalb muss ich so oft wie möglich versuchen, mit jeder Frau Kinder zu zeugen. Ich würde es nicht wagen, der Stimme des Herrn nicht zu gehorchen.	"Thus spoke the Lord: ""Be fruitful, and multiply, and replenish the earth"". That's a holy commandment that I cannot reject, since God works in mysterious ways. That's why I must try to procreate kids with any woman as often as possible. I wouldn't dare to disobey the Lord's will."
Im Zusammenhang mit der von Angela Merkel geäußerten Besorgnis angesichts der Ereignisse auf der Krim und in der Ukraine insgesamt verwies Wladimir Putin auf die nicht nachlassende Androhung von Gewalt durch ultranationalistische Kräfte, welche das Leben und die legitimen Interessen der russischen Bürger und der gesamten russischsprachigen Bevölkerung gefährden.	In response to Angela Merkel's concern regarding the developments in Crimea and Ukraine as a whole, Vladimir Putin drew the attention to the unrelenting threat of violence by ultra-nationalist forces, endangering the lives and legitimate interests of Russian citizens and the entire Russian-speaking population.
Während der zwölf Monate von November 2018 bis Oktober 2019 war es auf der Welt 0,56 °C wärmer als durchschnittlich von 1981 bis 2010. Der wärmste Zwölfmonatszeitraum erstreckte sich von Oktober 2015 bis September 2016. Die Temperatur lag da 0,66 °C über dem Durchschnitt. 2016 war das wärmste Kalenderjahr seit Beginn der Aufzeichnungen. Die Temperatur auf der Welt lag da 0,63 °C über der von 1981 bis 2010.	Globally, the twelve-month period from November 2018 to October 2019 was 0.56°C warmer than the 1981-2010 average. The warmest twelve-month period was from October 2015 to September 2016, with a temperature 0.66°C above average. 2016 is the warmest calendar year on record, with a global temperature 0.63°C above that for 1981-2010.
Einmal sperrten einige Schüler Tom nach Schulschluss im Klassenschrank ein. Darin musste er dann fünf Stunden bleiben, bis endlich der Hausmeister seine Schreie hörte und ihn befreite.	On one occasion some pupils locked Tom in the classroom cupboard where he had to remain for five hours until the school caretaker finally heard his cries and let him out.
Meine Nerven sind recht robust, Watson, aber ich muss gestehen, dass ich erschrak, als ich ebenjenen Mann, der mein Denken so okkupiert hatte, dort auf meiner Türschwelle stehen sah.	My nerves are fairly proof, Watson, but I must confess to a start when I saw the very man who had been so much in my thoughts standing there on my threshold.
Aus dem Ei schlüpft die Larve, Made oder Raupe, der es an Flügeln mangelt. Diese wird später zur Puppe oder Chrysalis, ganz von einer harten Schale oder festen Haut bedeckt, aus der das vollkommene oder geflügelte Insekt hervorbirst.	From the egg is hatched the larva, grub, or caterpillar, which is destitute of wings; this afterwards changes to a pupa, or crysalis, wholly covered with a hard shell, or strong skin, from which the perfect or winged insect, bursts forth.
