„He, Mann! Hättest du mal ’ne Sekunde Zeit für mich?“ – „Ja, gewiss, aber da die Sekunde jetzt vorüber ist, darf ich dich bitten, dich zu entfernen. Ich habe zu tun!“	"Hey mate! You got a second? ""Yes, certainly. But since that second is now up, I shall have to ask you to make yourself scarce. I have a lot to do!"""
"André Danican Philidor spielte drei Spiele gleichzeitig, zwei blind und eines auf dem Brett. Diderot und D'Alembert zitierten es in der Enzyklopädie als ""eine der phänomenalsten Manifestationen des menschlichen Geistes""."	"André Danican Philidor used to play three games at the same time, two blindly and one looking at the board. Diderot and D'Alembert cited it in the Encyclopedia as ""one of the most phenomenal manifestations of the human mind""."
Es gibt einige Probleme, für die die Karush-Kuhn-Tucker-Bedingungen nicht ausreichen, um die Optimalität zu garantieren, aber das ändert nichts daran, dass diese Bedingungen ein unverzichtbares Werkzeug bei der Optimierung sind.	There is a good number of problems for which the Karush-Kuhn-Tucker conditions are insufficient to guarantee optimality, but this doesn't change the fact that these conditions are an indispensable tool for doing optimization.
Und vernahm, ehe ich mich’s versah, wie die Huf’ trippelnd aufs Dach gedrungen. Vom Fenster mich wendend, ward ich’s gewahr: St. Nikolaus kam den Kamin herabgesprungen.	And then, in a twinkling, I heard on the roof The prancing and pawing of each little hoof. As I drew in my head, and was turning around, Down the chimney St. Nicholas came with a bound.
In einer Familie kann man finden: einen Großvater und eine Großmutter, einen Vater und eine Mutter, einen Sohn und eine Tochter, einen Enkelsohn und eine Enkeltochter, des Weiteren einen Bruder und eine Schwester, einen Onkel und eine Tante, einen Neffen und eine Nichte, einen Cousin und eine Cousine.	In a family you can find: a grandfather and a grandmother, a father and a mother, a son and a daughter, a grandson and a granddaughter, further a brother and a sister, an uncle and an aunt, a nephew and a niece, a boy cousin and a girl cousin.
„Das ging aber schnell!“ staunte Maria, als Tom nach kurzer Zeit mit der gewünschten Tüte voller Brötchen wieder durch die Tür kam. „Bist du zum Bäcker geflogen?“	"That was quick! gasped Mary, as Tom sailed back through the door in no time at all with the bagful of bread rolls as requested. ""Did you fly to the baker's?"""
In diesem unserem demokratischen Zeitalter fordern Männer lautstark nach dem, was allgemein das Beste, unabhängig von ihren Gefühlen. Sie wollen das Teure, nicht das Raffinierte, das Modische, nicht das Schöne.	In this democratic age of ours men clamour for what is popularly considered the best, regardless of their feelings. They want the costly, not the refined; the fashionable, not the beautiful.
Wenn sich das Schachbrett in der richtigen Position befindet, ist das Feld h1 rechts von Weiß ein weißes Feld. Folglich ist das Feld a8 rechts von Schwarz auch ein weißes Feld.	If the chessboard is in the right position, the square h1 to the right of White is a white square. Consequently, the square a8 to the right of Black is also a white square.
„Was versteckst du da hinter deinem Rücken?“ – „Nichts! Gar nichts!“ – „Zeig’s her!“ – „Mann, Maria! Das ist dein Geburtstagsgeschenk, das eigentlich eine Überraschung werden sollte. Warum musst du immer so ins Zimmer geplatzt kommen, ohne anzuklopfen?“	"What's that you've got behind your back? ""Nothing. Nothing at all."" ""Show me!"" ""For goodness sake, Mary! It's your birthday present. It was meant to be a surprise. Why do you always come bursting into the room like that without knocking?"""
Nutella ist in Japan nicht sehr verbreitet. In Amerika und Europa jedoch ist es ein bekannter Brotaufstrich und man kann Gläser in unterschiedlichen Größen in vielen Lebensmittelgeschäften und Supermärkten aufgereiht finden.	Nutella is not very well known in Japan. However in the United States and Europe, it's a popular spread and various sized jars of Nutella may be seen lined up inside many grocery stores and supermarkets.
Die Möwen balgten sich kreischend um ein kleines Stück Brot, das ein Wanderer in seiner Verzweiflung von sich geworfen hatte, nachdem er beim Versuch, unterwegs sein Käsebrot zu essen, von ihnen attackiert worden war.	The seagulls were fighting over a scrap of bread thrown to them in exasperation by a walker after they had attacked him as he tried to eat his cheese sandwich.
Auf einem selbst errichteten Hochsitz, gelegen in einem abgeschiedenen Waldstück fernab aller Straßen und Wege, wohin es kaum je einen Mensch verschlug, trafen sich Tom und Johannes oft, um die Tiere zu beobachten und über das Leben zu räsonieren.	In a self-built hide, situated in a secluded part of the woods far from any road or path, a place into which people had hardly ever strayed, Tom and John would often meet to watch the animals and put the world to rights.
Ich habe in der Küche einen Topf voll Wasser auf dem Herd stehen. Kannst du mal nachsehen, ob das schon kocht? Wenn dem so ist, kannst du die Nudeln, die abgewogen in einer Schüssel auf dem Tisch stehen, hineintun.	I've got a saucepan full of water on the hob. Can you just check to see if it's boiling? If it is, can you put the pasta in that's weighed out in a bowl on the table?
„Ich habe dir doch gesagt, du sollst vorsichtig sein, und jetzt hast du mir schon ein Eselsohr in das Buch gemacht!“ – „Tut mir leid, Maria! Du weißt doch, wie ungeschickt ich bin.“ – „Ja, Tom, das hast du mir hiermit erneut unter Beweis gestellt!“	"Didn't I tell you to be careful? You've gone and creased my book now! ""Sorry, Mary. You know how cack-handed I am."" ""Yes, Tom. You've proved it to me again!"""
„Wenn das noch lange so weitergeht“, sagte sie, „kann ich’s nicht mehr ertragen.“ Aber es ging weiter, und sie musste es ertragen, ohne dass sie etwas dagegen hätte tun können.	"If this lasts much longer, she said, ""I shall not be able to bear it."" But it did last, and she had to bear it, without being able to help herself."
Vor zwei Jahren entstand die Idee, ein Forschungssemester für besonders interessierte und engagierte Lehrkräfte anzubieten, mit dem Ziel, die Kommunikation zwischen Schulen und Universität zu verbessern. Da die Lehrer und Lehrerinnen die besten Multiplikatoren neu erworbenen Wissens sind, sollen sie die Gelegenheit erhalten für ein halbes Jahr in der Forschung an einer Universität mitzuarbeiten und ihre Erfahrungen dann später in den Schulunterricht einzubringen.	Two years ago, the idea of offering a research semester for particularly interested and committed teachers became reality. The aim is to improve communication between schools and universities. Since teachers are the best people for diffusing newly acquired knowledge, they will be given the opportunity to spend a research sabbatical at a university and to subsequently integrate this knowledge into classroom teaching.
Erst wenn der letzte Baum gerodet, der letzte Fluss vergiftet, der letzte Fisch gefangen ist, werdet ihr merken, dass man Geld nicht essen kann.	Only after the last tree has been cut down, the last river has been poisoned and the last fish has been caught will you realize that money cannot be eaten.
Gehen Sie links diese Straße hoch, am Pub vorbei und dann immer weiter. Wenn Sie oben auf dem Hügel ankommen, sehen Sie rechts die Kirche und dahinter das Meer.	Go left up this lane, past the pub, and keep going. When you reach the brow of the hill, you'll see the church on your right and the sea beyond that.
Plötzlich riss sich Bello von der Leine los, rannte und sprang in den Fluss. Den Grund für dieses unerwartete Verhalten erkannten wir erst jetzt in einem ertrinkenden Rehkitz, das der Hund ans Ufer zog und somit rettete.	Bello suddenly broke free from his lead, ran towards the river and jumped in. The reason the dog behaved in this surprising way, we only now realise, was so that he could rescue a drowning fawn which he fished out on to the riverbank.
Die Strategie ist zwar ein wichtiger, aber nicht der einzige Aspekt des Spiels: Go soll zur Meditation anregen und grundsätzliche Einsichten über Naturgesetze vermitteln können, stelle Herausforderungen an den Geist und biete manchem Spieler auch einen Spiegel der eigenen Persönlichkeit. Hinzu kommt, dass eine von beiden Spielern gut geführte Partie als Kunstwerk empfunden werden kann.	Strategy is an important, but not the only, aspect of the game of Go, which should encourage meditation and provide fundamental insights into the laws of nature, pose challenges to the mind, and reveal to players some aspects of their personality. Furthermore, a game well played by both parties can be considered a work of art.
Tom verkörpert den unfehlbaren Helden. Sein Begleiter, Björn Eriksson, der durch seine Fehler und seine Unvollkommenheit eine viel menschlichere, viel realistischere Figur ist, lässt ihn nur noch mehr erstrahlen.	Tom is the perfect hero incarnate; Björn Eriksson, his companion, whose mistakes and fallibility show him to be a far more human and realistic character, makes him shine all the more.
Die einzelnen Sterne eines Sternbildes scheinen einander zwar recht nahe; in Wirklichkeit liegen jedoch mitunter riesige Entfernungen dazwischen, und es besteht keinerlei tatsächliche Verbindung.	The individual stars in a constellation may appear to be very close to each other, but in fact they can be separated by huge distances in space and have no real connection to each other at all.
„Der Tom öffnet mir alle Türen.“ – „Der Tom? Der Tom, der dich in München in die Nobeldisko eingeladen hat und nach dem zweiten Cocktail schon pleite war? Der wird dir alle Türen öffnen, aber alle Falltüren! Wie kann man denn so naiv sein?“	"Tom opens doors for me. ""Tom? Tom, who took you to a posh nightclub in Munich and was skint after two cocktails? He'll open doors for you all right – trapdoors! How can you be so naive?"""
„O nein! Da klemmt ein Strafzettel unter meinem Scheibenwischer; dabei wollte ich doch nur schnell Brötchen kaufen gehen.“ – „Auch dafür muss man am Parkautomaten einen Parkschein ziehen, Maria.“	"Oh, no. There's a parking ticket under my windscreen wiper. I'd only nipped out to buy some bread rolls. ""You still have to get a ticket from the pay and display machine, Mary, even for that."""
Versuche, erst Sätze in Deiner Muttersprache zu bilden, dann übersetze sie ins Englische. So vermeidest du, eher sinnlose Sätze zu produzieren, die nicht korrigiert werden können.	Try forming sentences in your native language first, then translate them to English. That way, you'll avoid producing sentences that don't make too much sense and thus can't be fixed.
Ich möchte eine physikalische Theorie, die die Struktur des Universums erklärt, klarstellt, was ein Beobachter innerhalb eines Universums ist, keine Theorie, die das Universum davon abhängig macht, dass ich es beobachte.	I want a physical theory that explains the structure of the universe, clarifies what an observer within a universe is, not a theory that makes the universe dependent on me observing it.
Abends kamen sie an einen großen Wald und waren so müde von Jammer, Hunger und dem langen Weg, dass sie sich in einen hohlen Baum legten und einschliefen.	In the evening they came to a large forest, and they were so weary with sorrow and hunger and the long walk, that they lay down in a hollow tree and fell asleep.
Bei Temperaturen, die unter −30 °C fallen können, auf einer Strecke, die immer einmal wieder von windgepeitschten Eisdünen unterbrochen wird, 160 km in menschenleerer Einsamkeit wird ein von zwei NASA-Wissenschaftlern geführter Trupp in eine unerforschte Ausdehnung des antarktischen Eises vorstoßen.	In temperatures that can drop below -20 degrees Fahrenheit, along a route occasionally blocked by wind-driven ice dunes, a hundred miles from any other people, a team led by two NASA scientists will survey an unexplored stretch of Antarctic ice.
„Was hast du denn zu Weihnachten bekommen?“ – „Von meinem Vater habe ich ein Computerspiel bekommen, von meiner Mutter ein paar Pullover, von meinen Großeltern Holzspielzeuge und von meiner kleinen Schwester ein Bild, das sie für mich gemalt hat.“	"So, what did you get for Christmas? ""I got a computer game from my father, a couple of jumpers from my mother, some wooden toys from my grandparents, and from my little sister a picture she painted for me."""
Der Kater war der Herr des Hauses, und die Henne war die Herrin, und die beiden sagten stets: „Wir und die Welt“, denn sie wähnten sich die halbe Welt, und auch die bessere Hälfte. Das Entlein meinte, dass andere möglicherweise anderer Meinung diesbezüglich seien, doch die Henne schenkte solchen Zweifeln kein Gehör.	"The tom cat was the master of the house, and the hen was mistress, and they always said, ""We and the world,"" for they believed themselves to be half the world, and the better half too. The duckling thought that others might hold a different opinion on the subject, but the hen would not listen to such doubts."
„Ich habe Maria mitgeteilt, dass ich keine Zeit für eine Beziehung habe, weil ich mich auf die Schule konzentrieren muss“, erklärte Tom brav seinem Vater. – „Ich bin froh, das zu hören, mein Junge“, erwiderte dieser zufrieden und klopfte seinem Sohn auf die Schulter. „Für solche Sachen ist später noch genug Zeit.“	"I told Mary that I do not have time for a relationship because I have to focus on school, Tom said dutifully to his father. ""I'm glad to hear that, my boy,"" he replied contentedly, patting his son on the shoulder. ""There is enough time for such things later."""
In den sozialen Medien macht das Rautenschlagwort #coveryourmouth („die Hand vor den Mund“) die Runde, mit dem die Leute dazu aufgefordert werden sollen, sich an öffentlichen Orten in den Ellenbogen zu niesen oder in ein Taschentuch, damit sich die Keime nicht über die Luft verbreiten können.	Social media has been sharing hashtag #coveryourmouth, admonishing people to use the crook of their arm, a handkerchief or a tissue to block the spew of aerosolized germs in public places.
Der deutsche Wissenschaftler Erich von Woff, der den Anteil von Eisen (Fe) in verschiedenen Gemüsearten gemessen hat, machte einen Fehler beim Hinzufügen des Dezimalpunkts, als er die Daten von seinem Notizbuch kopierte.	The German scientist Erich von Wolff, who measured the rate of iron (Fe) in various vegetables, had a mistake in adding the decimal point when copying the data from his notebook.
„Gibt es denn keine Schlagsahne zu dem Kuchen? Ohne Schlagsahne schmeckt er doch nur halb so gut.“ – „Diesmal nicht. Die hat Opa vergessen, und wir haben es erst eben gemerkt.“ – „Wartet kurz! Ich gehe mal zu Meiers rüber. Die haben bestimmt welche, die sie uns geben können.“	"Isn't there any whipped cream for the cake? It tastes only half as good without whipped cream. ""Not this time. Grandad forgot it, and we've only just realised."" ""Wait a minute. I'll just pop over to the Meiers. They're bound to have some they can give us."""
Zwei Jahre sind seitdem vergangen, und bis vor kurzem war mein Leben einsamer denn je. Vor einem Monat aber hat ein lieber Freund, den ich seit vielen Jahren kenne, mir die Ehre erwiesen, um meine Hand anzuhalten.	Two years have passed since then, and my life has been until lately lonelier than ever. A month ago, however, a dear friend, whom I have known for many years, has done me the honour to ask my hand in marriage.
„Wann hast du das zum letzten Mal benutzt?“ fragte Tom. Maria überlegte. „Daran kann ich mich schon gar nicht mehr erinnern“, gab sie schließlich zur Antwort. Tom nickte und warf den Gegenstand, der er ihr gezeigt hatte, über die Schulter hinter sich in den Mülleimer.	"When was the last time you used this? asked Tom. Mary had a think. Finally she answered. ""No idea – I can't remember."" Tom nodded and chucked the object he'd just shown Mary over his shoulder into the rubbish bin."
Ich war an der Reihe zu spielen, und mein König wurde nicht angegriffen, das heißt, er stand nicht im Schach. Aber keine meiner Figuren konnte einen gültigen Zug machen. Es hatte sich ein Patt eingestellt. Die Partie endete remis.	"It was my turn to play and my king wasn't being attacked, that is, wasn't put in check. But, none of my pieces could make any valid move. Thus, what is called ""drowned king"" or ""draw by drowning"" was characterized. The match was a draw."
Einem Jungen, welcher eine Kuh auf dem Markte von Hereford veräußert hatte, wurde von einem Wegelagerer aufgelauert, welcher an einer geeigneten Stelle das Geld verlangte. Der Junge machte hierauf auf dem Absatz kehrt und lief davon; da ihn der Wegelagerer aber absattelnd einholte, nahm er das Geld aus der Tasche und streute es umher, und während der Wegelagerer es auflas, sprang der Junge auf das Pferd und ritt nach Hause.	A boy having sold a cow at the fair at Hereford, was way-laid by a highwayman, who at a convenient place demanded the money; on this the boy took to his heels and ran away but being overtaken by the highwayman, who dismounted, he pulled the money out of his pocket and strewed it about, and while the highwayman was picking it up, the boy jumped upon the horse and rode home.
Ein Schleier aus rosa Chiffon, großzügig mit riesigen schwarzen Punkten besprenkelt, hing wie ein Volant von der Hutkrempe auf ihre Schultern und schwebte in zwei graziösen Bändern hinter ihr.	A veil of pink chiffon, lavishly sprinkled with huge black dots, hung like a flounce from the hat brim to her shoulders and floated off in two airy streamers behind her.
Unsere Atmosphäre besteht zu 21 % aus Sauerstoff, den wir zum Atmen brauchen, zu 78 % aus Stickstoff und zu 0,9 % aus Argon. Die übrigen 0,1 % bestehen aus Wasserdampf, Kohlendioxid, Neon, Methan, Krypton, Helium, Xenon, Wasserstoff, Distickstoffoxid, Kohlenmonoxid, Stickstoffdioxid, Schwefeldioxid und Ozon.	Our atmosphere contains 21% oxygen, which is necessary for us to breathe, 78% nitrogen, and 0.9% argon. The other 0.1% consists of water vapor, carbon dioxide, neon, methane, krypton, helium, xenon, hydrogen, nitrous oxide, carbon monoxide, nitrogen dioxide, sulfur dioxide, and ozone.
Streusand in einem empfindlichen Gerät oder ein Riss in einer seiner Hochleistungslinsen würde nicht mehr stören als eine starke Emotion in einem Gemüt wie dem seinen.	Grit in a sensitive instrument, or a crack in one of his own high-power lenses, would not be more disturbing than a strong emotion in a nature such as his.
Die ganze wirklich heimische Kultur dreht sich um Dinge, die von allen geteilt werden, aber doch nicht offiziell sind, nämlich den Pub, das Fußballspiel, den Garten hinter dem Haus, den Kamin und die „schöne Tasse Tee“.	All the culture that is most truly native centres round things which even when they are communal are not official – the pub, the football match, the back garden, the fireside and the 'nice cup of tea'.
Als ich durch die schmalen Straßen meiner Heimatstadt - die ich seit Jahren nicht mehr besucht hatte - ging, warfen mir viele Leute spöttische Blicke zu, als ob sie einfach lachen und sich über mich lustig machen wollten - andererseits, ich bin ja auch ein Clown.	As I walked through the narrow streets of my hometown — which I hadn't visited for years — many people gave me quizzacious stares, as if they wanted to just burst out and laugh at me — then again, I am a clown, after all.
Werden wir eine Wirtschaft hinnehmen, in der nur einige wenige von uns herausragende Leistungen erbringen? Oder werden wir eine Wirtschaft aufbauen, in der alle, die hart arbeiten, eine Chance haben, Karriere zu machen?	Will we accept an economy where only a few of us do spectacularly well? Or will we build an economy where everyone who works hard has a chance to get ahead?
Wenn eine normaler Mensch eine Flaschenpost verschickt, so nur aus einer kindlichen Träumerei heraus. Wenn Christoph Kolumbus eine verschickt, so steht das Schicksal eines ganzen Landes auf dem Spiel.	When an average person sends a message in a bottle, it's just a childish fantasy. When Christopher Columbus sends a message in a bottle, the fate of an entire country is at stake.
„Ich habe es endlich gelernt. Ich kann endlich Fahrrad fahren!“ – „Spät, aber besser spät als nie, nicht wahr? Dann lass mal sehen, Tom! Setz dich auf den Sattel und dreh eine Runde!“	"I've finally learnt. I can finally ride a bike! ""Late, but better late than never, eh? Let's see then, Tom! Hop on the saddle and take it for a spin!"""
Voyager 2 flog bis auf 81 400 km an die Wolkendecke des Uranus heran und sammelte Daten, die zwei neue Ringe, elf neue Monde und Temperaturen von −214 °C zeigten.	Voyager 2 flew within 50,600 miles (81,433 kilometers) of Uranus’ cloud tops, collecting data that revealed two new rings, 11 new moons and temperatures below minus 353 degrees Fahrenheit (minus 214 degrees Celsius).
Wenn beim Bau eines Hauses der höchste Punkt erreicht ist und die Dachpfannen gelegt werden können, ist es in den Niederlanden üblich, dass der Bauherr den Bauarbeitern ein sogenanntes Pfannenbier spendiert, um das zu feiern. Es wird dabei eine Fahne am First des Hauses befestigt. Ist der Bauherr zum Spendieren zu geizig, dann wird keine Fahne, sondern ein Besen angebracht.	"In the Netherlands, it is the custom that, when during the construction of a house the highest point has been reached and the roof is ready for tiling, the client treats the construction workers to so-called ""tile beer"" to celebrate this. A flag is then placed on the ridge of the house. If the client is too stingy to treat, not a flag, but a broom is placed."
Ich habe Chewbacca noch nie Englisch sprechen hören, aber in jener weit, weit entfernten Galaxie versteht seltsamerweise jeder die Laute und das Kauderwelsch jedes anderen, so dass es eigentlich egal ist, welche Sprache man spricht.	I've never yet heard Chewbacca speak English, but, oddly enough, everyone in the galaxy far, far away understands everyone else's accent and gobbledygook, so it doesn't really matter what language you speak.
Ich war auf einem Schiff, das strandete; die Wellen trieben mich an Land bei einem heiligen Tempel, wo mehrere junge Mädchen Dienst taten; die Jüngste dort fand mich am Strand and rettete mein Leben; ich sah sie nur zweimal; sie war die einzige, die ich in dieser Welt lieben könnte, aber du ähnelst ihr; du verdrängst beinahe ihr Bild in meiner Seele.	I was on board a ship which was wrecked; I was driven on shore by the waves close to a holy Temple where several young girls were ministering at a service; the youngest of them found me on the beach and saved my life; I saw her but twice. She was the only person I could love in this world, but you are like her, you almost drive her image out of my heart.
"Kommentatoren haben das Geräusch der Vuvuzelas abwechselnd als ""nervtötend"" und ""satanisch"" beschrieben und es mit ""einer Stampede von wütenden Elefanten"", ""einem ohrenbetäubenden Schwarm von Heuschrecken"" , ""einer Ziege auf dem Weg zur Schlachtbank"", "" einem gigantischen Stock voll sehr wütender Bienen"" und ""einer Ente auf Drogen"" verglichen."	"Commentators have variously described the sound of vuvuzelas as ""annoying"" and ""satanic"" and compared it with ""a stampede of noisy elephants"", ""a deafening swarm of locusts"", ""a goat on the way to slaughter"", ""a giant hive full of very angry bees"", and ""a duck on speed""."
Dadurch, dass man unsere ohnehin ausgelasteten Entwickler und Administratoren (oder andere Gemeinschaftsmitglieder) anweist, in welcher Reihenfolge Probleme anzugehen sind oder wie lange es dauern darf, dieselben zu beheben, kann man nicht erreichen, dass diese an die Spitze der Warteliste vorrücken, und Freunde macht man sich so auch nicht.	Telling our busy developers and admins (or any other members of the community) the order in which they should tackle issues, or how long it should take to fix them, is not the way to get them to the front of the queue, or to make friends.
Hunde hatten ein Loch unter dem Lattenzaun hindurchgegraben, und durch dieses gelangte Tom auf das Baustellengrundstück, von wo aus er den Ball zurück auf die Straße zu seinen Freunden warf.	Tom managed to get on to the building site through a hole that some dogs had dug under the fence. From there, he threw the ball back to his friends in the street.
Mathematiker sind wie die Franzosen: Sie nehmen alles, was man ihnen sagt, übersetzen es sich in ihre eigene Sprache und verwandeln es dabei in etwas völlig Verschiedenes.	Mathematicians have this in common with the French: whatever you're trying to say to them, they take it and translate it in their own way and turn it around into something completely different.
Siobhan sitzt da und liest ein Buch. Die Tür geht auf, und Terry betritt japsend das Zimmer, so außer Atem, dass er beim Versuch, etwas zu sagen, kaum ein Wort hervorbringen kann, ehe er wieder nach Luft schnappen muss. Schließlich hebt Siobhan den Blick und nimmt Terry die Mühe ab, indem sie spricht. „Du bist gerannt“, sagt sie. – „Ja“, erwidert er keuchend.	"Siobhan is sitting reading a book. The door is pushed open, and Terry comes panting into the room, so out of breath that his attempts to speak hardly produce a word between gasps. A moment or two passes before Siobhan looks up and speaks, saving Terry the trouble. ""You've been running,"" she says. ""Yes,"" he wheezes."
