„Ich brauche deine Hilfe, Maria.“ – „Du brauchst immer Hilfe. Nichts kannst du allein. Lerne, auf eigenen Beinen zu stehen!“ – „Nur noch dieses eine Mal! Bitte!“ – „Na gut, weil du es bist.“	"I need your help, Mary. ""You always need help. You can't do a thing yourself. Learn to stand on your own two feet!"" ""Just this once. Please!"" ""All right then, since it's you."""
Da sie Schnäppchen jagt und bei den Dingen des täglichen Bedarfs ein wenig knausert, kann Maria es sich leisten, ein- oder zweimal im Jahr unbekümmert Geld für eine Badekur oder den Besuch eines Schönheitssalons auszugeben.	By looking for bargains and scrimping a little on many everyday items, Mary can afford to splurge once or twice a year on a spa treatment or going to a beauty salon.
Im Winter waren die Fenster manchmal ganz zugefroren. Doch dann machten der Junge und das Mädchen immer Kupferpfennige am Ofen warm und hielten die warmen Pfennige gegen die gefrorenen Scheiben. Und es entstand alsbald ein rundes Guckloch, durch welches sie blicken konnten, und die sanften, strahlenden Augen des kleinen Jungen und des kleinen Mädchens glänzten dann durch das Guckloch in jedem der Fenster, als sie einander anschauten.	In winter, the windows were sometimes quite frozen over. But then the boy and the girl would warm copper pennies on the stove, and hold the warm pennies against the frozen pane; there would be very soon a little round hole through which they could peep, and the soft bright eyes of the little boy and girl would beam through the hole at each window as they looked at each other.
Wir wollen Sprachwerkzeuge auf ein neues Niveau bringen. Wir wollen Neuerungen in der Landschaft des Sprachenlernens sehen. Und das kann nicht ohne offene Sprachquellen stattfinden, die nicht ohne eine Gemeinschaft aufgebaut werden können, die ohne gute Plattformen nichts beitragen kann.	We want to bring language tools to the next level. We want to see innovation in the language learning landscape. And this cannot happen without open language resources which cannot be built without a community which cannot contribute without efficient platforms.
Als Tom vom Stammtischabend mit seinen Freunden nach Hause kam, fand er einen Zettel, der an der Haustür klebte; darauf stand in der Handschrift seiner Frau: „Hoffe nicht auf meine Wiederkehr – ich habe dich verlassen!“	"Returning home from an evening down the pub with his mates, Tom found a handwritten note stuck to the front door; the handwriting was his wife's. It read: ""You can forget any idea that I might come back – I've left you!"""
Zu meiner Zeit wurde mündliche Sprachkompetenz vernachlässigt, weil Professoren behaupteten, dass das Erlernen einer Fremdsprache als Einführung in die Literatur dient, und nicht um Gespräche mit jenen Analphabeten zu führen, deren Muttersprache es zufällig sei, was alles darauf hinausgeht, dass was ein natürlich klingender Satz darstellt sehr subjektiv sein kann.	In my day oral proficiency was neglected because professors maintained that the purpose of studying a foreign language was to become acquainted with its literature, and not to strike up a conversation with the illiterates who happened to be its native speakers, which leads us to the conclusion that what constitutes a natural sounding sentence may be quite subjective.
Morgens steh' ich auf und lese meine Lokalzeitung, dann bin ich informiert. Vormittags lese ich die überregionalen Zeitungen, dann bin ich elektrisiert. Und abends lese ich den Bayernkurier, dann bin ich narkotisiert.	"In the morning I get up and read my local newspaper; then I am informed. Before noon I read the national newspapers; then I am energized. And in the evening I read the ""Bayernkurier""; then I am anaesthetized."
Zum Abschluss eines virtuellen Gipfels zum Klimawandel, der vom Weißen Haus ausgerichtet worden war, ließ der Präsident der Vereinigten Staaten, Joe Biden, Lob ergehen an die Führer der Welt, dass sie anlässlich dieses Themas zusammengekommen waren, und ermahnte sie, dass sie die Versprechen halten mögen.	U.S. President Joe Biden praised world leaders for coming together on climate change and urged them to make good on promises as he closed a virtual climate change summit hosted from the White House.
Im Laufe des Morgens des 20. März 2015 wird von den Färöern nordwestlich von Schottland sowie von Spitzbergen östlich von Grönland aus eine totale Sonnenfinsternis zu beobachten sein.	During the morning of March 20, 2015, a total solar eclipse will be visible from the Faroe Islands, located northwest of Scotland, and the Svalbard Islands, located east of Greenland.
„Hat dein Vater denn inzwischen wieder geheiratet, oder hat er eine Freundin?“ – „Nein! Ich habe alle Anwärterinnen erfolgreich weggeekelt! Ich will, dass Papa wieder mit Mama zusammenkommt!“	"Has your dad remarried since then, or does he have a girlfriend? ""No. I've managed to drive away all the hopefuls. I want Mum and Dad to get back together!"""
Toms Mutter war so in Gedanken vertieft, dass sie gar nicht den riesigen Teddybären bemerkte, den Tom in den Einkaufswagen gesetzt hatte, oder zumindest nichts Ungewöhnliches in ihm sah.	Tom's mother was so lost in thought that she didn't notice the huge teddy bear Tom had put in the shopping trolley – or at least, she saw nothing odd about it being there.
So jemand spricht: „Ich liebe Gott“ und hasst seinen Bruder, der ist ein Lügner. Denn wer seinen Bruder nicht liebt, den er sieht, wie kann er Gott lieben, den er nicht sieht?	Whoever claims to love God yet hates a brother or sister is a liar. For whoever does not love their brother and sister, whom they have seen, cannot love God, whom they have not seen.
Eine am Mittwoch veröffentlichte Studie zeigt, dass nahezu alle Gletscher der Welt in den letzten Jahren immer schneller dahinschmelzen, was für den Anstieg des Meerespiegels in den letzten beiden Jahrzehnten verantwortlich ist.	A study published Wednesday shows nearly all the world’s glaciers have been melting at an accelerated pace in recent years, accounting for rises in sea level over the last two decades.
"Boeings Sicherheitsexperten haben sich mit anderen Fachleuten aus der Industrie zusammengeschlossen, um eine internationale Arbeitsgruppe zu bilden, mit dem Ziel, eine bestimmte Art von Flugzeugabstürzen zu eliminieren, die als „controlled flight into terrain (CFIT)“, auf deutsch „gesteuerter Flug ins Gelände"", bezeichnet wird."	Boeing's safety experts have joined others in the industry to form an international task force to try to eliminate one particular kind of air crash known as controlled flight into terrain, CFIT.
Als Faustregel bei allen zur Zeit noch nicht vorhandenen Funktionen gilt, dass es entweder ein sehr weiter Weg bis zur Implementation ist oder überhaupt nie dazu kommt. Es gibt nur wenige Entwickler, zu beheben ist viel, und wie ratsam eine Maßnahme jeweils ist, da gehen die Meinungen immer auseinander, so dass viel hin- und herdiskutiert wird, oft aber nichts dabei herauskommt.	The rule of thumb is that whatever functionality does not currently exist will either take a very long time to be implemented or never appear. The number of developers is small, the number of things that need to be fixed is huge, and the number of divergent opinions on the advisability of any particular measure is also large, meaning that discussion will take a long time and often not lead to a result.
Ein Naturfreund ist, dessen innere und äußere Sinne noch aufeinander abgestimmt, der sich selbst im Erwachsenenalter noch ein kindlich Gemüt bewahrt. Mit dem Himmel und der Erde zu verkehren wird Teil seines täglich Brot.	The lover of nature is he whose inward and outward senses are still truly adjusted to each other; who has retained the spirit of infancy even into the era of manhood. His intercourse with heaven and earth, becomes part of his daily food.
Wenn du mit hoher Geschwindigkeit Auto fährst und du fühlst, du musst gleich niesen, empfehle ich dir, die Geschwindigkeit zu drosseln, und notfalls sogar anzuhalten, denn es ist nicht möglich, gleichzeitig zu niesen und die Augen geöffnet zu halten.	If you are driving a car at high speed and feel that you are about to sneeze, I recommend that you slow down and, if necessary, even stop the car, because it is not possible to sneeze with your eyes open.
Eine wichtige Funktion der Weltraumlaborstation bestand darin, mit Hilfe spezieller Infrarotkameras Bilder von der Erde aufzunehmen. Eines dieser Bilder ermöglichte es den Wissenschaftlern, den Opfern einer Hungersnot in Afrika bei der Wassersuche zu helfen.	An important function of the Skylab space station was to take photographs of the Earth using special infrared cameras. One of the pictures enabled scientists to help famine victims in Africa find water.
Es ist wohl unmöglich, einen vollkommen fehlerfreien Korpus zu erreichen — das liegt in der Natur eines solchen Gemeinschaftsprojekts. Doch wenn wir unsere Mitglieder dazu bringen können, nicht mit Sprachen herumzuexperimentieren, die sie gerade lernen, sondern Sätze in ihrer eigenen Muttersprache beizutragen, dann gelingt es uns vielleicht, die Zahl der Fehler klein zu halten.	It may be impossible to get a completely error-free corpus due to the nature of this kind of collaborative effort. However, if we encourage members to contribute sentences in their own languages rather than experiment in languages they are learning, we might be able to minimize errors.
Die vier klassischen Romane Chinas sind „Die Reise nach Westen“ (西遊記, Xī Yóu Jì), „Die Geschichte der drei Reiche“ (三國演義, Sānguó Yǎnyì), „Die Räuber vom Liang-Schan-Moor“ (水滸傳, Shuǐhǔ Zhuàn) und „Der Traum der Roten Kammer“ (紅樓夢, Hóng Lóu Mèng).	The Four Great Classical Novels of China are Journey to the West (西遊記, Xī Yóu Jì), Romance of the Three Kingdoms (三國演義, Sānguó Yǎnyì), Water Margin (水滸傳, Shuǐhǔ Zhuàn), and Dream of the Red Chamber (紅樓夢, Hóng Lóu Mèng).
Jeder, der wegen einer strafbaren Handlung beschuldigt wird, hat das Recht, als unschuldig zu gelten, solange seine Schuld nicht in einem öffentlichen Verfahren, in dem er alle für seine Verteidigung notwendigen Garantien gehabt hat, gemäß dem Gesetz nachgewiesen ist.	Everyone charged with a penal offence has the right to be presumed innocent until proved guilty according to law in a public trial at which he has had all the guarantees necessary for his defence.
Umgeben von Vampirhorden, führte Christoph Kolumbus einmal einen epischen Schwertkampf gegen den Grafen Dracula auf dessen Schloss, wobei ihm der Graf die Hand abschlug, Kolumbus sie daraufhin jedoch gelassen aufhob, sie sich wiederansetzte und sich anschickte, den Grafen zu übermannen.	Surrounded by hordes of vampires, Christopher Columbus once had an epic sword duel with Count Dracula in the latter's castle. After the Count cut off Columbus's hand, Columbus calmly picked it up, put it back in place, and proceeded to best the Count.
Ich habe Ihnen jetzt die gesamte Wahrheit gesagt, und wenn ich diese der Polizei vorenthielt, so lag das darin begründet, dass ich die Gefahr, in der sich mein lieber Freund befand, nicht erkannte.	I have told you now the whole truth, and if I withheld it from the police it is because I did not realise then the danger in which my dear friend stood.
Christoph Kolumbus wollte einmal, weil man ihm seinen Papagei gestohlen hatte, ein ganzes Dorf vollständig niederbrennen. Aus Enttäuschung, das Wasser im Dorf nicht entzünden zu können, erfand er Fluor.	Christopher Columbus once decided to burn absolutely everything in an entire village after one of the natives stole his parrot. He was disappointed that he couldn't burn their water. So he invented fluorine.
„Kannst du mir mal sagen, was du in meinem Zimmer zu suchen hast?“ – „Nichts. Ich wollte nur mal nachsehen, wie es deinen Blümchen geht. Die sind dir doch so wichtig.“ – „Das kannst du deiner Großmutter erzählen! Raus hier! Aber schnell!“	"Can you tell me what you're doing in my room? ""Nothing. I just wanted to see how your flowers were. I know how important they are to you."" ""And I'm the Queen of Sheba. Out! Now!"""
Es lebte einmal im Lande Erin ein Jüngling, der suchte eine Frau, und von allen Maiden ringsumher gefiel ihm keine so sehr wie die einzige Tochter eines Bauern.	Once upon a time there dwelt in the land of Erin a young man who was seeking a wife, and of all the maidens round about none pleased him as well as the only daughter of a farmer.
Ein Konsortium von Astronomen gab am Donnerstag bekannt, daß man durch Beobachtung der Gravitationswirkung eines supermassiven Schwarzen Loches auf einen vorüberziehenden Stern erstmals eine Vorhersage der Allgemeinen Relativitätstheorie Albert Einsteins habe bestätigen können.	A consortium of astronomers said Thursday they had for the first time confirmed a prediction of Albert Einstein's theory of general relativity by observing the gravitational effects of a supermassive black hole on a star zipping by it.
"Ein neuer Bericht von 11.258 Wissenschaftlern in 153 Ländern aus den verschiedensten Disziplinen warnt davor, dass der Planet ""klar und unmissverständlich vor einer Klimakrise steht"", und enthält sechs allgemeine politische Ziele, die erreicht werden müssen, um sie anzugehen."	A new report by 11,258 scientists in 153 countries from a broad range of disciplines warns that the planet “clearly and unequivocally faces a climate emergency,” and provides six broad policy goals that must be met to address it.
Um Ko zurückzugewinnen, zwingt Schwarz Weiß nun, woanders auf dem Brett zu spielen, und wiederholt im nächsten Zug den vorherigen Angriff. Und der Kampf geht so weiter, in der sogenannten Schlacht von Ko.	In order to recapture the Ko, Black now forces White to play elsewhere on the board and, on the next move, repeats the previous attack. And the fight goes on like this, in what is called the battle of Ko.
Vor 10 000 Jahren reisten die Tommarianer mit ihren Raumschiffen durch die Galaxis und kolonisierten Planeten. Heute leben sie wieder als Jäger und Sammler von dem, was die Natur hier in ihrer erwählten Heimat ihnen gibt. Das alte Wissen wurde der Vergessenheit anheimgegeben. Man ist zu einem einfacheren, erfüllteren Leben zurückgekehrt.	Ten thousand years ago, the Tomarians travelled through the galaxy in their spaceships, colonising planets. Today, they live again as hunter-gatherers, surviving on what nature provides them here in their adopted home. The old knowledge is lost in the mists of time. They have returned to a simpler, more fulfilling way of life.
Einer in diesem Jahr veröffentlichten Studie der Universität Minnesota zufolge leben 18 Millionen Frauen im gebährfähigen Alter in den ländlichen amerikanischen Verwaltungsbezirken, in denen es in über der Hälfte der Fälle jedoch kein Krankenhaus mit Entbindungsstation gebe.	According to a University of Minnesota study published earlier this year, 18 million reproductive-age women live in America’s rural counties, but over half of these counties have no hospital where a woman can give birth.
„Warum klingt dieses Einsteinzitat wie eine wörtliche Übersetzung aus dem Englischen? Das kann der doch unmöglich so gesagt haben.“ – „Wahrscheinlich, weil es tatsächlich eine Übersetzung aus dem Englischen ist.“	"Why does this quote from Einstein sound like a word-for-word translation from the English? He can't have said it like that. ""Probably because it is in fact a translation from the English."""
Man sollte alle Tage wenigstens ein kleines Lied hören, ein gutes Gedicht lesen, ein treffliches Gemälde sehen und, wenn es möglich zu machen wäre, einige vernünftige Worte sprechen.	Every day one should at least hear one little song, read one good poem, see one fine painting and – if at all possible – speak a few reasonable words.
„Du rufst sonntags morgens um sieben Uhr bei mir an, nur um zu fragen, wie es mir geht? Ich dachte schon, es wäre was passiert!“ – „Ich weiß doch, dass du Frühaufsteherin bist, und nachmittags oder abends kriege ich dich nie.“	"You're ringing me at seven in the morning on a Sunday just to ask how I am? I thought that something had happened! ""It's just I know you're an early riser, and I can never get hold of you in the afternoon or evening."""
Die Studie führt als Beispiel das beliebte französische Kinderspielzeug „Sophie die Giraffe“ an. Im Jahre 2010 wurden in Frankreich 800 000 Exemplare davon verkauft – über achtmal so viel, wie es in Afrika echte Giraffen gibt.	"The study uses the popular French baby toy ""Sophie the Giraffe"" as an example. Eight hundred thousand Sophie toys were sold in France in 2010—more than eight times the number of real giraffes living in Africa."
„Seid Tom und du denn nun ...?“ – „Was?“ – „Ach, du weißt schon!“ – „Nein, das weiß ich nicht. Sprich dich aus!“ – „Na, zusammen!“ – „Wie? Tom und ich? Quatsch! Wie kommst du denn darauf?“	"So, are you and Tom...? ""Are we what?"" ""Oh, you know!"" ""No, I don't know. Spit it out!"" ""Well, an item."" ""What? Me and Tom? Don't be daft! What makes you think that?"""
2019 verlor Brasilien 1,4 Millionen Hektar alter Wälder, über ein Drittel des weltweiten Verlustes und fast dreimal so viel wie das Land mit dem nächstgrößten Verlust, die Demokratische Republik Kongo.	Brazil lost 1.4 million hectares of mature forest in 2019, more than one-third of the world total and nearly three times more than the country with the next-largest loss, the Democratic Republic of Congo.
Als Streich ließen einige Schüler drei Ziegen in ihrer Schule los, nachdem sie die Nummern 1, 2 und 4 auf die Seiten der Ziegen gemalt hatten. Die Lehrer brachten den Großteil des Tages damit zu, nach Ziege Nummer 3 zu suchen.	As a prank, some students let three goats loose inside their school after painting the numbers 1, 2 and 4 on the sides of the goats. The teachers spent most of the day looking for goat number 3.
Der arme Fuchs hatte Räude. Das war daran zu erkennen, dass er gar keine Haare mehr an seinem normalerweise buschigen Schwanz hatte und überhaupt schlimm aussah. Wir legten daher Futter mit einem Impfstoff aus, der ihm helfen sollte, wieder gesund zu werden.	The poor fox had mange. You could tell by the fact that he had no hair at all on his normally bushy tail and looked awful in general. We therefore put out feed with a vaccine to help him get well again.
Wer gestohlen hat der stehle nicht mehr, sondern arbeite und schaffe mit den Händen etwas Gutes, auf dass er habe, zu geben dem Dürftigen.	Let him that stole steal no more: but rather let him labour, working with his hands the thing which is good, that he may have to give to him that needeth.
Als ich jünger war, hasste ich es, auf Hochzeiten zu gehen. Meine Großmütter und Tanten drängten sich jedes Mal um mich, stupsten mich in die Seite und kicherten: „Du bist die Nächste! Du bist die Nächste!“ Sie haben mit diesem Unsinn erst aufgehört, als ich begann, bei Beerdigungen dasselbe zu tun.	"When I was younger, I hated going to weddings. My grandmothers and aunts would huddle around me, poke me in the side, and giggle ""You're next! You're next!"" They only stopped this nonsense when I began to do the same thing at funerals."
Ja, man kann das Schulfach hier groß schreiben. Manche Stilleitfäden bestehen darauf, andere nicht. Ich schwanke oft: manchmal empfinde ich es als nötig, manchmal nicht.	Yes, you can capitalise the school subject here. Some style guides insist on it, others don't. I'm often inconsistent about it, though: sometimes I feel the need to do it, and sometimes I don't.
"Hallo, ich hätte gerne eine, öh... Fahrkarte, oder? ""Ja, genau so heißt es!"" ""Muss ich ins Loch rammen, oder?"" ""Ja, Sie müssen sie in den Apparat stecken."" ""Ah, super, danke!"""	"Hello, I'd like a, um, ticket, is it? ""That's right, that's what it's called."" ""I have to push it in the hole, don't I?"" ""Yes, you have to put it into the machine."" ""Ah, great. Thank you!"""
So also hielten der Zar und die schöne Vasilissa Hochzeit, und Vasilissas Vater kehrte aus dem weit entlegenen Zarenreich zurück, und er und die alte Frau lebten glücklich und zufrieden bei Vasilissa in dem prächtigen Palast. Was nun aber die kleine hölzerne Puppe anging, so trug Vasilissa diese, so lange sie lebte, in der Tasche immer bei sich.	So the Tsar and Vasilissa the Beautiful were married, and her father returned from the far-distant Tsardom, and he and the old woman lived always with her in the splendid Palace, in all joy and contentment. And as for the little wooden doll, she carried it about with her in her pocket all her life long.
Dieses Lied ist geschrieben mit Blut und nicht mit Blei. Es ist kein Lied eines Vogels frei. Es hat ein Volk, zwischen fallenden Wänden, dieses Lied gesungen mit Pistolen in den Händen.	This song is written with blood, and not with lead. It's not a song of a bird that's free. A people, between falling walls, sang this song with pistols in their hands.
Einer der Makel des Sherlock Holmes – wenn man es denn als einen Makel bezeichnen will – bestand darin, dass es ihm über alle Maßen widerstrebte, auch nur irgendjemandem seine Pläne mitzuteilen, eben bis zu dem Augenblick, da sie in Erfüllung gingen.	One of Sherlock Holmes’s defects—if, indeed, one may call it a defect—was that he was exceedingly loth to communicate his full plans to any other person until the instant of their fulfilment.
Der Halleysche Komet hat eine sehr ausgedehnte Bahn, auf welcher er erst der Sonne sehr nahe kommt und dann ins äußere Sonnensystem, noch weit hinter die Umlaufbahn des Pluto, geschleudert wird.	Halley has a highly elongated orbit that takes it very close to the Sun and then flings it out into the outer solar system, well past the orbit of Pluto.
In den Chroniken ist über die Flut von 1342 zu lesen, dass im Mainzer Dom einem Mann das Wasser bis zur Brust gestanden habe und dass man in Köln mit Booten über die Stadtmauern habe fahren können.	The chronicles of the flood of 1342 say that the water in the Mainz Cathedral came up to a man's chest, while in Cologne, one could ride in a boat over the city walls.
Selbst der König, so alt er auch war, konnte nicht die Augen von ihr lassen und flüsterte der Königin zu, dass er schon lange kein so wunderschönes und liebliches Wesen mehr gesehen habe.	The King himself, old as he was, could not keep his eyes off her, and he told the Queen under his breath that it was a long time since he had seen so beautiful and lovely a creature.
Es kostet nichts, genau zu sein, und das bietet sich im Umfeld von Tatoeba ja auch an, dessen Grundbaustein ein Satz ist, der sich selbst genügen und keine gedankliche Verrenkungen erfordern sollte, um aus etwas eigentlich Bedeutungslosem noch einen möglichen Sinn herauszupressen. Meiden wir das Seltsame und erleichtern wir denen, die Sprachen lernen wollen, das Leben!	It costs nothing to be specific, and doing so works better in the Tatoeba context, where the basic unit is a sentence that should be able to stand on its own without mental contortions to screw out a possible meaning from an otherwise meaningless sentence. Let's eschew the baroque and make things easy for language learners.
Um Astronaut zu werden, muss man gut mit Leuten umgehen und kommunizieren können, begierig auf die Arbeit sein und Arbeitserfahrung, gute Noten sowie einen Universitätsabschluss vorzuweisen haben.	In order to become an astronaut, a person must work well with people, be able to communicate well, be eager to do the job, have work experience, have good grades, and have a college degree.
„Aufgrund dessen, dass die Schulen dieses Jahr wegen des Coronavirus eher die Pforten schließen, gibt es für 22 Millionen Kinder, die darauf angewiesen gewesen wären, in der Schule Frühstück und Mittagessen zu bekommen, jetzt eine Lücke, die wir schließen müssen“, sagte Lisa Davis, geschäftsführende Direktorin der Aktion „Kein Kind soll hungern“ (engl. “No Kid Hungry”).	With schools closing early this year because of COVID-19, “22 million kids that relied on getting breakfast and lunch at school now have a gap we need to fill,” said Lisa Davis, senior vice president of the No Kid Hungry campaign.
Maria ahnte nicht, dass sich hinter „Tom“, ihrem Brieffreund, mit dem sie schon seit Monaten über das Internet kommunizierte und in den sie sich, ohne ihm je begegnet zu sein, heimlich verliebt hatte, in Wirklichkeit ein hyperintelligentes Eichhörnchen versteckte.	"Maria didn't suspect that ""Tom"", her pen-friend, with whom she had been corresponding for months over the Internet and whom she secretly loved, without ever having met him, was actually a super-intelligent squirrel."
Nach acht Kriegsjahren, die keinem anderen Zwecke dienten, als ein Land zu zerstören, das seinen eigenen Krieg gegen den Iran ausfocht, ziehen sich die Vereinigten Staaten aus dem Irak zurück, und da die Natur nun einmal Vakuen hasst, hat nun der Iran den Platz der Vereinigten Staaten als vorherrschende Supermacht in der Region eingenommen. Von dem Spruch „Der Feind meines Feines ist mein Freund“ hat man jenseits des Atlantik wohl noch nie was gehört.	"The United States is retreating from Iraq after eight years of a war that has served no purpose other than destroying a country fighting its own war against Iran. Since nature hates vacuums, Iran has now taken the United States' place as predominant superpower in the region. Guess they've never heard of the phrase ""the enemy of my enemy is my friend"" on the other side of the Atlantic."
