translated	origin_language
The researchers are quick to point out that genes are not necessarily destiny and that devoted parents can still influence their children in positive ways, even if they are only working on a small percentage of the total variation.	ru
Mary couldn't sleep, while her husband Tom had slipped blissfully into the land of Nod. It's true, she thought, that you're nowhere more alone than next to someone who's asleep, although where she had heard that she no longer remembered.	de
According to many experts, locusts and mealworms, among other insects, are the food of the future because they are rich in proteins and much less environmentally harmful than, for example, cattle. But, do they also taste good?	es
I've never gotten married, because I've got three pets at home who serve the same purpose as a husband. I've got a dog who snarls every morning, a parrot who curses all afternoon, and a cat who comes home late at night.	de
In the act of offering up his last prayer ere he made up his mind to float and be eaten, he saw a man look over the quarter of the brig : he raised both his hands ; he jumped himself up in the water, and, by the singularity of his motions fortunately attracted notice.	fr
It is high time that communists should openly, in the face of the whole world, publish their views, their aims, their tendencies, and meet this nursery tale of the Specter of Communism with a manifesto of the party itself.	fr
Angry at Leif Ericson for stealing his thunder 500 years before, Christopher Columbus once wrote a rigorous mathematical proof that showed how Ericson had never actually been to North America. Unfortunately, the proof was too difficult for even the brightest mathematicians to understand.	es
All cetaceans (whales, dolphins, and porpoises), all sirenians (manatees and dugongs) and several marine carnivores (seals, otters, walrus, and polar bears) are protected under the Convention on International Trade in Endangered Species of Wild Fauna and Flora (CITES).	ru
There were three beautiful sisters, fair and delicate. The dress of one was red, of the second blue, and of the third pure white. Hand in hand they danced in the bright moonlight, by the calm lake.	de
At a moment when our economy is growing, our businesses are creating jobs at the fastest pace since the 1990s, and wages are starting to rise again, we have to make some choices about the kind of country we want to be.	de
A truly incredible queen sacrifice was made by Kevin Spragett against Fred South in Ontario 1976: 1.e4 Nc6 2.Nf3 d6 3.d4 Bg4 4.d5 Ne5 5.Nxe5 Bxd1. Black gave up on the nineteenth move.	es
We are always getting away from the present moment. Our mental existences, which are immaterial and have no dimensions, are passing along the Time-Dimension with a uniform velocity from the cradle to the grave.	fr
How is it possible that a being with such sensitive jewels as the eyes, such enchanted musical instruments as the ears, and such fabulous arabesque of nerves as the brain can experience itself anything less than a god?	de
The opinions that are held with passion are always those for which no good ground exists; indeed the passion is the measure of the holder's lack of rational conviction. Opinions in politics and religion are almost always held passionately.	es
To go on. No. It's enough. To go on weighted down with worlds countries cities. Crowds howling. Covered with climates hemispheres ideas memories. Among the spiderwebs of tombs and the conscious planets.	es
"By Jove! I cried; ""if he really wants some one to share the rooms and the expense, I am the very man for him. I should prefer having a partner to being alone."""	de
Palestine should be the country of all those who wish to live there peacefully, not a land destined to a religious or ethnic group at the expense of indigenous groups.	fr
People crushed by law, have no hopes but from power. If laws are their enemies, they will be enemies to laws; and those who have much to hope and nothing to lose, will always be dangerous.	ru
A lot of Finnish cities and villages have Swedish names that differ more or less strongly from the Finnish ones, and in some cases are completely different, even in meaning.	ru
If the chessboard is in the right position, the square h1 to the right of White is a white square. Consequently, the square a8 to the right of Black is also a white square.	ru
The attacks of September 11th, 2001 and the continued efforts of these extremists to engage in violence against civilians has led some in my country to view Islam as inevitably hostile not only to America and Western countries, but also to human rights.	fr
"I can speak a bit of German. 'Das ist fantastisch!' ""Haha, wunderbar."" ""Wunderbar."" ""Even the locals sound better when they speak German, okay?"" ""Haha, is nobody gonna get my accent?"" ""No, not really, 'cause, you know..."" ""To be honest, I only learned my German from watching DVDs when I was younger."" ""Hahaha, be sure to send me those DVDs!"""	fr
And the hail destroyed through all the land of Egypt all things that were in the fields, both man and beast: and the hail smote every herb of the field, and it broke every tree of the country.	fr
My biggest dream is to be a teacher. I do not want to be rich. I just want to give a good life to the person I love. Is that asking too much?	es
"Look, Tom – I've picked some raspberries. Do you want some? asked Mary, shoving a few into her raspberry-smeared mouth. Tom grimaced. ""It's nice of you to ask,"" he said, ""but I can't stand raspberries. Really sorry, Mary!"""	de
Triangulation is a sequence of three moves performed by one of the kings in order to return to the same position with the advantage of the opposition, which leaves the other king in zugzwang.	ru
We recommend adding sentences and translations in your strongest language. If you are interested primarily in having your sentences corrected, you should try a site like Lang-8.com, where that's the focus.	ru
"We came here, they said, ""to hunt, and having fastened our boat to the shore with a withfe of osiers, we roamed about with our dogs in search of game. In the meantime this young man's goats came to the shore and ate the osiers that secured our boat, whereby it was lost."""	ru
It is the wilderness in the mind, the desert wastes in the heart through which one wanders lost and a stranger. When one is a stranger to oneself then one is estranged from others too. If one is out of touch with oneself, then one cannot touch others.	es
Much of the Iberian Peninsula is experiencing the year's first heatwave, with the mercury expected to soar before peaking at 47 degrees Celsius in some areas of southern Portugal this weekend.	es
You say that you're afraid of being disliked by other people, but you have some people that you dislike yourself, don't you? Arithmetically speaking, there are an equal number of people who you don't like that don't like you back. I'm not saying that if you end your dislike of someone, someone else will stop disliking you as well; it's just that you can't change the fact that if you dislike someone, then someone else dislikes you as well. Your life will go much smoother if you just give up and accept that truth.	ru
Mrs Lynde looked upon all people who had the misfortune to be born or brought up elsewhere than in Prince Edward Island with a decided can-any-good-thing-come-out-of-Nazareth air. They might be good people, of course; but you were on the safe side in doubting it.	de
"The overwhelming majority of species that have existed throughout the biological history of planet Earth have already gone extinct; there aren't many reasons to believe ""Homo sapiens"" is going to be exceptional at this point."	es
"Thousands of major government data resources have been posted in ""machine-readable"" form for free public access on the Data.gov website, and range from weather data to car safety ratings to the cost of healthcare procedures."	ru
It drew strength from the not-so-young people who braved the bitter cold and scorching heat to knock on doors of perfect strangers, and from the millions of Americans who volunteered and organized and proved that more than two centuries later a government of the people, by the people, and for the people has not perished from the Earth.	es
Researchers from Thailand’s Mahidol University and Britain’s Oxford University say parasites that carry malaria are developing resistance to a key drug combination across multiple regions of Cambodia, Laos, Thailand and Vietnam.	es
"Why don't you move to an area where there's more going on? ""It's not that simple. I'm married with kids—"" ""And your husband comes from round here."" ""My wife, actually. No, she's from Middlesbrough."""	de
He is also credited with banishing all the snakes from Ireland, and it is to this accomplishment that I would like to share this allegory and join with St. Patrick in banishing the snakes from all of Babylon, everywhere.	es
"On this day in 1887 appeared in Warsaw a booklet by Ludwik Lejzer Zamenhof about the ""International Language"". Its size was modest, its motto ambitious: ""For a language to be international, it is not enough simply to declare it so."" The name of the author was given as ""Dr. Esperanto""."	de
Today, information moves around us in many forms, every hour of every day. Even if we do not seek out news on our own, we often receive it anyway, instantly, on our phones.	ru
In the Rue de Seine he met Planchet, who had stopped before the house of a pastry cook, and was contemplating with ecstasy a cake of the most appetizing appearance.	fr
"If thou wilt allow me, grandmother, I wish to ask thee some questions. ""Well,"" said the old witch, ""only remember that every question does not lead to good. If thou knowest overmuch, thou wilt grow old too soon. What wilt thou ask?"""	de
The dream of opportunity for all people has not come true for everyone in America, but its promise exists for all who come to our shores – that includes nearly seven million American Muslims in our country today who enjoy incomes and education that are higher than average.	es
The UN has made November 20 Universal Children's Day. On this date, we celebrate the adoption of the Declaration on the Rights of the Child. In Brazil, Children's Day is October 12.	fr
"In signing the Treaty of Tripoli in 1796, our second President John Adams wrote, ""The United States has in itself no character of enmity against the laws, religion or tranquility of Muslims."""	fr
"Three hours later, the King was loitering around the castle, looking for something to busy himself with. ""Fuck, I'm so bored,"" he grumbled in exasperation. ""The kids are at school. Gwo's at work. Impa's at the hospital. Ganon—"" Suddenly the King heard an incomprehensible cry and turned around to see Fari rush past him. ""Damn, Fari, what was that?!"" ""Piss off, Your Majesty!"" Fari yelled at the top of his lungs. ""My... PMSing as usual, I see,"" the King continued to mutter dejectedly. ""Shit, I'm so fucking bored. Nothing good on TV. Nothing good online. Nothing good to eat."" As he was about to leave the dining hall, his eyes were drawn to a cinnamon jar standing lonely on the table. A spoon of cinnamon was placed conveniently next to it. In a saner state the King may have been reasonably suspicious about it, but now he was so exhausted from boredom that any opportunity to relieve it for a minute felt like a blessing. ""I wonder what ground cinnamon tastes like,"" said he nonchalantly and put the spoon in his mouth."	es
According to a University of Minnesota study published earlier this year, 18 million reproductive-age women live in America’s rural counties, but over half of these counties have no hospital where a woman can give birth.	de
The algorithm a cell follows when making a protein is extremely complex. Roughly speaking, the coded information – four-letter words – stored in the DNA is copied, translated into a language whose alphabet has twenty letters, edited, and transmitted to the area where the protein is assembled.	fr
Once, Zhuangzi dreamed he was a butterfly, but when he woke up, he wasn't sure whether he was Zhuangzi who had dreamt being a butterfly or if he was a butterfly now dreaming he was Zhuangzi.	ru
Mathematics would certainly not have come into existence if one had known from the beginning that there was in nature no exactly straight line, no actual circle, no absolute magnitude.	de
"So the baker said, ""Look in the oven."" The old witch went to look, and the oven said, ""Get in and look in the furthest corner."" The witch did so, and when she was inside the oven shut her door, and the witch was kept there for a very long time."	de
"Tom told me that the Russian government has a 70% approval rate, so Russians must be happy with their authoritarian government. ""How do you know those numbers weren't made up, though? It's definitely happened before."""	es
Tsunamis are deadly waves capable of razing entire cities in a matter of moments. To better understand them, researchers travel to disaster sites as soon as possible to investigate the causes of these devastating waves.	fr
Watch your thoughts, for they become words. Watch your words, for they become actions. Watch your actions, for they become habits. Watch your habits, for they become character. Watch your character, for it becomes your destiny.	es
There is a big difference between learning a language in order to understand or to say something if needed, and wanting to acquire a second language in order to command it freely, almost like you command your first language, your mother tongue.	de
The economy has opened up a faultline in the Atlantic, announces La Stampa, reporting on the impact of recent remarks by Barack Obama which imply that the poor management of the Eurozone crisis is to blame for the feeble outlook for growth in the US.	ru
Donald Trump inherited at least 413 million dollars from his father. His businesses have all been enormous failures. It's unknown how much of daddy's money, if any, he has left.	ru
"When Socrates was asked whether it was better to marry or stay single, the philosopher answered, ""It doesn't matter which one you pick, since ten years later you'll regret it either way."""	es
One reason to avoid cars and public transportation is that, with the costs mentioned above, some of you could not afford all the expenses, so they must be reduced when possible.	ru
When I say that this spider is harmless, I don't mean that you can catch it with your hands and handle it as you like. Big spiders don't attack people unless they are provoked, and they should not be taken for toys.	fr
If you read ten pages every day, by the end of the year you'll have read eighteen books of two hundred pages each. How would those books change your life?	fr
I found a French friend in Morocco. She told me that the atmosphere in Paris is not that of the rest of France, and that other cities and provinces are very beautiful.	fr
An interpreter needs to be able to communicate the ideas of the speaker to the listeners fast. The preciseness of the translation does not need to be perfect. There is not enough time to consider all details.	ru
The birds' home is in the forest, the fish's home is in the river, the bees' home is in the flowers, and the little children's is in China. We love our motherland from the time we're little, as the birds love the forest, the fish love the river, and the bees love the flowers.	ru
This implies a fun and relaxed working atmosphere where team achievement is highly valued, communication is extremely important and traditional 3-hour meetings have been replaced by informal chats in the queue for coffee.	ru
Here in Africa, we say that if you never forget a woman, it's because she's cast a spell on you. But is it possible that Marika cast a spell on me while I was with her in Finland?	fr
From the 26th to the 28th of September 2015, nine people from five countries gathered in Brno (Czech Republic) to have fun together learning and using the Toki Pona language. In this video they are in a university botanical garden and talk about what they see.	fr
My method of learning new words is simple: every morning I learn five new words. At first I review them before going to bed, then in three days, then in a week, in a month, in three months, and finally in six months.	fr
Two cells (a sperm and an egg) come together to form a new cell (the embryo), which replicates by division in geometric progression to form a human being, which has about 37 trillion cells.	fr
I contend that we are both atheists. I just believe in one fewer god than you do. When you understand why you dismiss all the other possible gods, you will understand why I dismiss yours.	fr
The doctor performing the operation seemed to be concentrating more on his conversation with his assistant than on the operation he was performing. Tom has suffered from the consequences to this day.	de
"Viswanathan (Vishy) Anand (Chennai, December 11, 1969) is an Indian Grand Master. He was named ""Indian Sportsman of the Millennium"" and got 11 million children in his state, Tamil Nadhu, to study chess at school."	ru
To move forward, you should choose which of these doors really reflects your intention. Each of these will lead to a different path, but just one leads to the truth.	es
At first the King would not believe it, but the old woman urged this so long, and accused her of so many evil things, that at last the King let himself be persuaded and sentenced her to death.	de
And so let freedom ring from the prodigious hilltops of New Hampshire. Let freedom ring from the mighty mountains of New York. Let freedom ring from the heightening Alleghenies of Pennsylvania. Let freedom ring from the snow-capped Rockies of Colorado. Let freedom ring from the curvaceous slopes of California.	de
Poland is located in Central Europe and shares its borders with Germany on the west, the Czech Republic and Slovakia in the south, and Ukraine, Belarus, Lithuania, and a bit of Russia on the east.	fr
"Can you tell me what you're doing in my room? ""Nothing. I just wanted to see how your flowers were. I know how important they are to you."" ""And I'm the Queen of Sheba. Out! Now!"""	de
The interchange between Tom and Mary was so fast-paced that I just couldn't get a word in edgeways. In the end I gave up the attempt and just stood there, smiling.	de
For one human being to love another, that is perhaps the most difficult of all tasks that has been given to us, the ultimate, the last test and proof, the work for which all other work is but preparation.	de
My goal as a language teacher isn't to get my students to only say grammatically perfect phrases. It's to help them build the confidence to express themselves in another language, however that may be.	es
I knew Bratislav, of Croatian descent, personally since 2012, but I had seen him walking his two small dogs in the Lulu Island neighbourhood park in previous years without talking to him. Bratislav was unique in my opinion, as he had a really different reality view than everyone else, it seemed. He recounted stories of farm cows, whose bodies were sapped of blood by UFO aliens and engraved with circles. Ghost-like aliens could phase out of this material world, as they could pass through walls, he said. He said that there were secret space missions about which the public did not know. He was like no other person that I had met.	ru
The Wind Power Center obtains most of its operating power from a wind turbine atop a 50-meter-tall tower in its windmill park. On good, windy days the turbine often produces more electricity than the center needs, so the excess is sold to the local power company. On days when the turbine is not producing enough power, the center draws electricity from the local grid.	de
Now listen to me, children. You must be civil and kind to everyone, and never say a cross word to anyone, and never touch a crumb belonging to anyone else.	de
"What are you drinking there? ""It's sort of like a health drink Mary has concocted from all kinds of natural ingredients. Tastes quite good. Do you want a cup?"" ""Er, nah, I'll leave it, thanks."""	de
Aliens came to Earth many years ago to share all their knowledge with the earthlings, but at a certain point they decided to go away and didn't come back again.	ru
If you need instructions, check out the enclosed instruction book. If you need instructions on how to check out the enclosed instruction book, check out the enclosed instructions on how to get instructions on how to check out the enclosed instruction book. If you need instructions on how to check out the enclosed instructions, check out the instructions on how to get instructions on how to check out the enclosed instructions on how to get instructions on how to check out the enclosed instruction book. Thank you.	es
I am your father's spirit, doomed for a certain time to walk the night, and during the day I am confined to burn in fires, until the evil crimes I had done in my life are burnt and purged away.	fr
You need not fear, because the god they are talking about does not exist, and if they tell you that it does, they are either wrong or they are using the word “exist” with a different meaning and thus are just making a statement about themselves.	de
"Hey, said Mary, stopping to speak as she passed Tom's table, ""would you like to come and sit with us?"" ""That's very kind of you,"" replied Tom, getting up from his seat to join them."	fr
The knower and the known are one. Simple people imagine that they should see God as if he stood there and they here. This is not so. God and I, we are one in knowledge.	es
Charon is considered to be a satellite of the (dwarf) planet Pluto. However, because its diameter is more than half as large as that of Pluto itself, it can be considered an equal partner; and Pluto and Charon can be considered a double planet.	de
But so that we may not cause offense, go to the lake and throw out your line. Take the first fish you catch; open its mouth and you will find a four-drachma coin. Take it and give it to them for my tax and yours.	de
I know that adding sentences only in your native or strongest language is probably not as much fun as practicing writing foreign languages, but please don't add sentences to the Tatoeba Corpus if you are not absolutely sure they are correct. If you want to practice languages that you are studying, please do so by using a website designed for that purpose such as www.lang-8.com.	ru
I don't give myself any concrete objective, neither in chess nor in life. Because if I set myself towards it and I reached it, what kind of stimulus would I have then?	de
Everyone is entitled in full equality to a fair and public hearing by an independent and impartial tribunal, in the determination of his rights and obligations and of any criminal charge against him.	ru
Leading a fulfilling life really comes down to a simple question: When you turn off the lights at night and your head is on the pillow, what do you hear? Your soul singing or Satan laughing?	ru
Translating sentences one by one is too slow for you? You want to increase your rank in Tatoeba, or the rank of your language, at the speed of light? So this is for you!	es
One way to lower the number of errors in the Tatoeba Corpus would be to encourage people to only translate into their native languages instead of the other way around.	ru
In order to cross from one sentence to the other, Tom was stretching out his arm. Mary clung firmly onto it and jumped over the dot, avoiding to fall into the space.	fr
They promote authoritarian leaders, and they fan the flames of political violence that are a threat to our personal rights, to the pursuit of justice, to the rule of law, to the very soul of this country.	ru
A half moon broke through the rifts of racing clouds. In its cold light I saw beyond the trees a broken fringe of rocks and the long, low curve of the melancholy moor.	de
I worry that, because the Japanese lines in this site are written with furigana, they take up a lot of space, and the people who don't even care about them in the first place might find them annoying.	ru
Echo was brought up by the Nymphs, and the Muses taught her to play upon the pipe, the flute, the lyre, and the harp, in fact, to excel in every kind of music.	es
One way to lower the number of errors in the Tatoeba Corpus would be to encourage people to only translate into their native languages instead of the other way around.	ru
"And besides, Dima made sure to add, taking out his calculator and dividing 0.99 by 3,000,000, before multiplying by 100. ""You do realize that you would only lose 0.0033%, right?"""	de
“The Milky Way is a river of stars that don’t twinkle because there’s no air,” Drew said, and the Earth looks like a ‘blue beachball” with mountain ranges and continents flying by at high speed.	es
"I remember the time when the Germans called the Euro ""Esperantogeld"" to mean that it would never happen. Of course, none of the people who said that would admit it today. It's the peculiarity of paradigms to seem so natural that one cannot imagine having lived in a different paradigm, even an opposite one, in the past."	fr
Although there was once believed to be a causative relationship between syphilis and artistic genius, I would hope that the vast majority of modern artists and writers are reasonable enough to avoid becoming infected just on the off chance that neurosyphilis dementia might improve the quality of their work.	de
Human ingenuity now gives us the capacity to feed the hungry and give all of our children -- including our girls -- the education that is the foundation for opportunity in our world. But we have to put our money where our mouths are.	es
