translated	origin_language
I have come here to seek a new beginning between the United States and Muslims around the world; one based upon mutual interest and mutual respect; and one based upon the truth that America and Islam are not exclusive, and need not be in competition. Instead, they overlap, and share common principles – principles of justice and progress; tolerance and the dignity of all human beings.	ru
In the human torso are two pairs of floating ribs. These ribs do not actually drift freely in the chest, but, unlike the other ribs, they are attached only at one end.	fr
And Pilate having seen that it profiteth nothing, but rather a tumult is made, having taken water, he did wash the hands before the multitude, saying, 'I am innocent from the blood of this righteous one.'	ru
"PARENTAL ADVISORY: If your children use TATOEBA to study languages, please take the time to search any choice words you wouldn't want them to read - and don't be shy! You won't believe some of the uncensored filth they allow on here, since they feel ""language is language."""	fr
He has already learnt more languages than I will have learnt, if I should reach the age of ninety. And there is still a long way to go! I still don't know what will be more difficult: learning or surviving.	es
One of the bittersweet experiences in language learning is that, eventually, you find out that the lyrics of some of the songs you used to love so much are plain silly or offensive.	es
A common misconception about Christopher Columbus is that he once impressed a tribe of natives by predicting the lunar eclipse. The truth of the matter is that he CAUSED it.	fr
As a prank, some students let three goats loose inside their school after painting the numbers 1, 2 and 4 on the sides of the goats. The teachers spent most of the day looking for goat number 3.	de
China's the only country where three people can eat at a mid-range hotpot buffet for only 5 RMB, but a hamburger costs five times as much. Figure that one out!	ru
When an average person sends a message in a bottle, it's just a childish fantasy. When Christopher Columbus sends a message in a bottle, the fate of an entire country is at stake.	ru
Even if all countries of the world and all the news media were to recognize the legitimacy of this racist regime, on the moral level it would always remain racist.	fr
Hot dogs, nuts and seeds, chunks of meat or cheese, whole grapes, hard/gooey or sticky candy, popcorn, chunks of peanut butter, raw vegetables, raisins, chewing gum, and marshmallows are known choking hazards for children.	es
"According to Eugene Wigner, a Nobel laureate in Physics, human conscious awareness might actually ""reach out"" – in some unexplained way – and change the physical state of a system."	de
My Latin teacher used to look down sternly on me over the rim of her glasses, but now I know it only had to do with the fact that she was wearing reading glasses and that she will have found it a nuisance taking them off all the time, so what looked like contempt towards us students might well and truly have been kindness.	ru
Is it possible to believe that subatomic particles, as well as the very peculiar forces that lead them to combine to generate matter, are not the work of a Supernatural Intelligence?	de
One of the reasons Twitter is popular in Japan is a characteristic of Japanese itself: Japanese uses ideograms which enable it to convey more information in just 140 characters than other languages, not counting Chinese. Incidentally, the Japanese version of this sentence is written with exactly 140 characters. How many characters does it take in other languages?	es
German Health Minister Jens Spahn said Thursday the nation has vaccinated millions more people than previously thought, thanks to some unreported vaccination numbers discovered by the Robert Koch Institute for Disease Control.	de
It's easy enough to find elsewhere (Wiktionary, for instance) how to conjugate a verb. It's much harder to find the meaning of a word captured in a realistic sentence. This is Tatoeba's key mission, the thing that makes it unique, and I believe we should focus on it.	fr
The individual stars in a constellation may appear to be very close to each other, but in fact they can be separated by huge distances in space and have no real connection to each other at all.	de
Strasbourg is also an ideal starting point for excursions across the Rhine, to châteaux nestling in the heart of vineyards, villages perching on the mountainside between lakes and forests, and other delights.	es
If a black stone occupies the last freedom of a white stone, the latter is captured and removed from the board. That capture will be a point to be deducted from White's final count.	fr
Understood in its totality, the spectacle is both the result and the goal of the dominant mode of production. It is not a mere decoration added to the real world. It is the very heart of this real society's unreality. In all of its particular manifestations — news, propaganda, advertising, entertainment — the spectacle represents the dominant model of life. It is the omnipresent affirmation of the choices that have already been made in the sphere of production and in the consumption implied by that production. In both form and content the spectacle serves as a total justification of the conditions and goals of the existing system. The spectacle also represents the constant presence of this justification since it monopolizes the majority of the time spent outside the production process.	fr
Hot dogs, nuts and seeds, chunks of meat or cheese, whole grapes, hard/gooey or sticky candy, popcorn, chunks of peanut butter, raw vegetables, raisins, chewing gum, and marshmallows are known choking hazards for children.	fr
Every Friday I get up early, walk from here to the train station, buy a ticket to New York, and spend the weekend with my parents. Then I go home.	de
A carbon footprint is the amount of carbon dioxide pollution that we produce as a result of our activities. Some people try to reduce their carbon footprint because they are concerned about climate change.	es
Why do so many people study Japanese? The kanjis aren't logical, there are two alphabets, there aren't spaces between words, the adjectives change with the tense of the sentence, there are various grammatical constructions for the different levels of formality.	es
In a game of Go, it is up to Black to make the first move, that is, to place the first stone on the board. In a handicap game, however, White plays first.	de
The EU has 24 official languages: English, Bulgarian, Czech, Danish, Estonian, Finnish, French, Greek, Dutch, Croatian, Irish, Lithuanian, Latvian, Hungarian, Maltese, German, Polish, Portuguese, Romanian, Slovak, Slovenian, Spanish, Swedish and Italian.	es
When they spoke English to me, it was because they wanted to sell me something. When they spoke Esperanto to me, it was because they wanted to be my friends. Heard from American Esperanto speakers returning from trips abroad.	de
My Latin teacher used to look down sternly on me over the rim of her glasses, but now I know it only had to do with the fact that she was wearing reading glasses and that she will have found it a nuisance taking them off all the time, so what looked like contempt towards us students might well and truly have been kindness.	ru
Microplastics — the remnants of plastic bags, takeout containers and straws that almost-but-not-quite disintegrate in the oceans — are found in 3 out of 4 fish, such as squid, cuttlefish and swordfish in markets around the world.	fr
I wouldn't push him too far. You don't know what he might do. I'd say you can't be too careful. They say even a doomed mouse will bite a cat if he has no choice.	fr
You're mistaken. With all due respect, Your Holiness is mistaken. Christ didn't come here with Columbus. It was the Antichrist who came. The indigenous holocaust was worse than the Holocaust of WWII, not even the pope can deny that.	ru
"In the shadow of the Leaning Tower of Pisa sits the town storyteller, eating a bowl of pea soup. After that he tells some children the fairy tale ""The Princess and the Pea""."	ru
"In the amusement park Mary found a boy on his own weeping, and spoke to him gently. ""Hey, sonny, what is it? Are you lost? Would you like me to take you to the Lost Children Department?"""	es
I am as light as a feather, I am as happy as an angel, I am as merry as a school-boy. I am as giddy as a drunken man. A merry Christmas to everybody! A happy New Year to all the world.	de
Among some who have read Blackstone and more who have not an opinion prevails that a husband may chastise his wife provided the weapon be not thicker than his little finger.	de
"In middle school, I was talking with my therapist, and seeing as we were having such a great talk, I suddenly thought ""There's my chance"", and I tried to get a kiss. But she told me to stop. Then, as I headed to my next class, I felt so embarrassed."	es
During repression of the protests in Paris on October 17, 1961, the police killed dozens of people. The exact count is unknown, but most likely between one hundred and two hundred were killed. The slaughter was silenced and censored while the communications media repeated the official version giving the death count of five people. Nevertheless, bodies continued to appear in the Seine for weeks afterward.	es
Everyone has a house to go to, a home where they can find shelter. My house is the desert, my home the barren heath. The north wind is my fire, the rain my only bath.	de
Everyone has the right to education. Education shall be free, at least in the elementary and fundamental stages. Elementary education shall be compulsory. Technical and professional education shall be made generally available and higher education shall be equally accessible to all on the basis of merit.	es
Do you think a peasant girl living a more organic life than you in a forsaken country, as she uses cow dung to make fire, is in a way richer than you?	fr
Eugenio didn't like lifting weights or doing sit-ups, or get tired at all, so it was a struggle for his personal trainer to find a way to make him lose weight.	es
"Take all the land you want, said the Aborigine chief. ""Oh no,"" said the English general, ""we will take just an island."" ""And which island?"" asked the Aborigine chief. ""Just the island of Australia,"" replied the English general."	es
America, we have come so far. We have seen so much. But there is so much more to do. So tonight, let us ask ourselves, if our children should live to see the next century, if my daughters should be so lucky to live as long as Ann Nixon Cooper, what change will they see? What progress will we have made?	es
In the Kabyle dress, we find more than one color. There are black, blue, green, purple, navy, pink, red, silver, turquoise, purple, white, yellow, orange, and gray. It is multicolored.	fr
If Darwin lived today, would he have imagined that the highly sophisticated information-processing system that our advanced technology allows us to see in action in cells came about randomly and blindly and by natural selection?	de
I regard the theatre as the greatest of all art forms, the most immediate way in which a human being can share with another the sense of what it is to be a human being.	fr
If you hand over the queen or a rook in exchange for your opponent's bishop, knight, or even pawn, you are making a sacrifice, which is almost always, in fact, an investment because you are looking to gain advantageous compensation.	de
And then came the flies: they crept upon her eyes, and however much she winked they would not fly away; they could not, for she had pulled off their wings.	de
Remember that the purpose of the Tatoeba Project is to create example sentences that can be used for studying languages. It's not really a place to be contributing non-native language sentences for others to correct for you.	ru
In the depths of humanity's collective unconscious, the troglodytes' way of thinking must be found. Toki Pona is a useful tool to bring this to the surface of our consciousness.	ru
People that have experienced so-called 'lucid dreams' often describe them as being 'more real than reality'. They also describe reality after waking up from a 'lucid dream' to be like a 'whimsical dream'.	es
When I first took a C course, I couldn't understand a single thing explained in class. Thank God I got a friend of mine who's a programmer to explain to me how the whole caboodle works.	ru
"The recent outbreak of monkeypox in the American mid-west, and its connection to prairie dogs that were kept as pets, has focused attention on so-called ""exotic pet ownership."" Here in America, it's not at all unusual for people to keep domesticated animals like dogs, or cats, or horses as pets. But prairie dogs are wild animals, and because of that, some people believe they shouldn't be owned. But as VOA's Maura Farrelly found out, dogs aren't the only wild animals being brought into American homes."	ru
Patriotism in its simple, clear and plain meaning is nothing other to rulers than an instrument for achieving their power-hungry and self-serving goals. To those who are subjected to them, it is a denial of human dignity, reason, and conscience, as well as a slavish submission of themselves to those who are in power.	fr
As customary on Christmas Day, Pope Francis appeared at the balcony of Saint Peter’s Basilica overlooking the square to deliver his “Urbi et Orbi” message and blessing to the city and to the world.	de
I know that adding sentences only in your native or strongest language is probably not as much fun as practicing writing foreign languages, but please don't add sentences to the Tatoeba Corpus if you are not absolutely sure they are correct. If you want to practice languages that you are studying, please do so by using a website designed for that purpose such as www.lang-8.com.	ru
The money spent by Brazil on the construction of the stadiums for the FIFA World Cup in 2014 already exceeded what Germany spent in 2006 and South Africa in 2010 combined.	es
All are equal before the law and are entitled without any discrimination to equal protection of the law. All are entitled to equal protection against all types of discrimination in violation of this Declaration and against any incitement to any form of discrimination.	es
I dreamt that Congress effected sensible tax reform to improve the lot of the working class. I then woke up in a gutter with nothing but ragged clothes and a stolen guitar to my name.	es
As Lincoln said to a nation far more divided than ours, we are not enemies but friends. Though passion may have strained, it must not break our bonds of affection.	fr
After 136 moves and almost 8 hours of intense fighting, Magnus Carlsen, with White, beat Ian Nepomniachtchi in the 6th game of the World Chess Championship, Dubai-2021. We now have Carlsen 3.5 - Nepo 2.5.	es
All science is experiential; but all experience must be related back to and derives its validity from the conditions and context of consciousness in which it arises, i.e. the totality of our nature.	es
As the government of the United States of America is not in any sense founded on the Christian Religion, as it has in itself no character of enmity against the laws, religion or tranquility of Musselmen, and as the said States never have entered into any war or act of hostility against any Mehomitan nation, it is declared by the parties that no pretext arising from religious opinions shall ever produce an interruption of the harmony existing between the two countries.	fr
Guerra had a grapevine, and Parra had a dog, and Parra's dog bit Guerra's grapevine, so Guerra beat Parra's dog with a club. —Tell me, Mister Guerra: Why have you beaten the dog with your club? —Because if Parra's dog hadn't bitten Guerra's grapevine, Guerra wouldn't have beaten Parra's dog with the club.	es
My sister didn't own up to breaking the lamp. Instead, she made up some story about aliens coming to Earth with the objective of destroying every piece of yellow furniture.	es
"Jeeves, my good man, I do believe something is amiss. ""What do you mean, sir?"" ""You are driving on the left side of the road."" ""Astute observation, sir."" ""Well, we're in Germany!"""	de
For more than 200 years, or since the industrial revolution, the concentration of carbon dioxide in the atmosphere has increased due to the burning of fossil fuels and land use change.	de
Time has no divisions to mark its passage, there is never a thunderstorm or blare of trumpets to announce the beginning of a new month or year. Even when a new century begins it is only we mortals who ring bells and fire off pistols.	es
Sometimes I want to ask God why He allows poverty, famine and injustice in the world when He could do something about it, but I'm afraid He might just ask me the same question.	fr
I know that adding sentences only in your native or strongest language is probably not as much fun as practicing writing foreign languages, but please don't add sentences to the Tatoeba Corpus if you are not absolutely sure they are correct. If you want to practice languages that you are studying, please do so by using a website designed for that purpose such as www.lang-8.com.	ru
The future will not be built through force, nor the desire to conquer, but by the patient application of the democratic method, the constructive spirit of agreement, and by respect for freedom.	fr
Bad actors and trolls looking to exploit people's fears around coronavirus are using a variety of techniques to sow confusion. False news articles are just a small part of this.	de
"From time to time she fell into a sort of reverie, and when she was quite alone she would reason thus: ""I am ill, and yet I do not know my complaint. I suffer, and yet I bear no wound. I feel afflicted, and yet I have not lost any one of my sheep. I burn, although I am seated in the deep shade. How many times have the brambles torn my skin and yet I did not cry? How many bees have pricked me with their stings and yet I was soon cured? Thus that which has now wounded me in the heart must be keener than all those!"""	fr
Yea, would to God, I were among the roses, That lean to kiss you as you float between While on the lowest branch a bud uncloses A bud uncloses, to touch you, my queen.	fr
"Unlike with most sports recognized by the International Olympic Committee, where competition can be ""mixed"" (for all, regardless of gender) or accessible only to men or only to women, in chess women can compete in an ""open"" division (including the World Chess Championship) but they also have an exclusively female championship."	es
In order to claim the sizable inheritance that your distant great uncle left you in his will, I'm happy to inform you that all you have to do is make a one-time, $500 bank transfer to the following account.	ru
In the exercise of his rights and freedoms, everyone shall be subject only to such limitations as are determined by law solely for the purpose of securing due recognition and respect for the rights and freedoms of others and of meeting the just requirements of morality, public order and the general welfare in a democratic society.	es
There were three 9-point territories: one, in the center of the board, surrounded by 12 white stones; another, on the right side, surrounded by 9 black stones; and another, in the upper left corner, surrounded by 6 black stones.	ru
"The police are really good at understanding ""Someone stole my credit card and ran up a lot of charges."" It's a lot harder to get them to buy into ""Someone stole my magic sword."""	es
According to legend, the French composer Alkan was killed by a collapsing bookcase when he tried to reach for the Talmud, a holy Jewish book, in the study in his house.	de
"Today in the blue-sky morning of the 2nd of July of 2022, walking back from a Lulu Island corner convenience store, I saw Michael the Dane-French. He said that he was fighting nicotine. Then, he said that it struck him to find out that I have been a great traveller of this world. ""I've seen everything!"" I boasted. Michael said that the best thing is ""great literature whilst travelling."" As a musician, Michael himself has travelled across North America, the Caribbean, and Mexico. He said that he has never been to Europe. ""It's a whole different planet!"" I said."	es
Be careful of your thoughts, for your thoughts become your words. Be careful of your words, for your words become your actions. Be careful of your actions, for your actions become your habits. Be careful of your habits, for your habits become your character. Be careful of your character, for your character becomes your destiny.	fr
"There is a saying, that ""Those who don't understand UNIX are condemned to reinvent it, poorly"". If one looks at the Linux desktop, one will realise, that it's also true for desktop operating systems."	fr
Should any political party attempt to abolish social security, unemployment insurance, and eliminate labor laws and farm programs, you would not hear of that party again in our political history. There is a tiny splinter group, of course, that believes you can do these things. Among them are H. L. Hunt (you possibly know his background), a few other Texas oil millionaires, and an occasional politician or business man from other areas. Their number is negligible and they are stupid.	ru
It can be said, in fact, that research, by exploring the greatest and the smallest, contributes to the glory of God which is reflected in every part of the universe.	ru
When he couldn't find his pencil sharpener, Luis tried to sharpen his pencil with his scissors. But when he wasn't able to, he went to go buy a new pencil sharpener.	es
To deactivate a J-11 robot, attack it from the top by jumping out of a window on the second floor and then smashing a bucket full of mud on its head.	fr
In the cultures of certain peoples, a marked feeling of superiority has developed, so much so that it makes them capable of completely dehumanizing other peoples, to the point that that any kind of torture, rape, or mass murder seems acceptable to them.	fr
I know that adding sentences only in your native or strongest language is probably not as much fun as practicing writing foreign languages, but please don't add sentences to the Tatoeba Corpus if you are not absolutely sure they are correct. If you want to practice languages that you are studying, please do so by using a website designed for that purpose such as www.lang-8.com.	ru
"In the case of the big-bang theory, they assume the existence of all the matter and energy of the universe, and all of space and time, wrapped up into an infinitesimally small point. From this ""singularity"", as it is called, the whole universe sprang forth."	es
"In medium size stars, after the nuclear fusion has used up all the fuel it has, gravity will pull the remaining material closer together. The star will shrink. It is then called a ""white dwarf""."	de
"André Danican Philidor used to play three games at the same time, two blindly and one looking at the board. Diderot and D'Alembert cited it in the Encyclopedia as ""one of the most phenomenal manifestations of the human mind""."	de
The most profitable sectors in the United States and Europe are the military and pharmaceutical industries. Knowing this, there is no need to explain why there are always wars on Earth. Yes, it's a shame.	fr
"When I went to bed on the evening of November 27, I picked up my blind cat and said to her, ""You and me, we're alone in this world."" But two days later, my blind cat died, and I've remained completely and utterly alone."	de
A team of scientists studying data from a satellite orbiting Mars say they have discovered evidence of several lakes of what they believe is salty, liquid water beneath the surface of the planet’s south pole.	de
If there is anyone out there who still doubts that America is a place where all things are possible; who still wonders if the dream of our founders is alive in our time; who still questions the power of our democracy, tonight is your answer.	es
I'd get a soup plate and then slide the glass very carefully over to the edge of the table, and let the water run into the soup plate - it doesn't have to run onto the floor.	de
Across the entire universe, there are infinite numbers of these massive spinning balls of matter, each with their own quirks and wonders, but without living beings on them to make anything of it, like what we have on Earth.	ru
Tom was the first man that Maria could not immediately seduce. For her he seemed out of reach. All the more reason for her to fall ever more deeply in love with him.	de
That ineffable condescension of a God made man, shedding his blood for the redemption of all men, was the most powerful motive that induced the Church to take such a zealous interest in the manumission of slaves.	es
The committee would like me to have someone to whom I can direct questions or go to for guidance about the city and its resources; I believe, therefore, that you would be a very good match.	ru
"Etymologically, checkmate means ""the king is dead"". However, the king has not ""died"" in the game of chess for a long time. In fact, the king is the only piece that cannot even be captured, although checkmate finishes the game and, strictly speaking, can be considered as a ""death"" for the king."	ru
"She sat beside the reapers, and they passed her parched grain. She ate, was satisfied, and left some of it. When she had risen up to glean, Boaz commanded his young men, saying, ""Let her glean even among the sheaves, and don’t reproach her. Also pull out some for her from the bundles, and leave it. Let her glean, and don’t rebuke her."""	fr
