translated	origin_language
An honest farmer had once an ass that had been a faithful servant to him a great many years, but was now growing old and every day more and more unfit for work.	de
"Whoever thinks: ""These days, everyone speaks English"" or ""The entire world speaks English"" without asking what portion of the global population it is that speaks English, and how well they can speak it, is someone who does not want to see the reality in front of their eyes."	de
All of the great leaders have had one characteristic in common: it was the willingness to confront unequivocally the major anxiety of their people in their time. This, and not much else, is the essence of leadership.	fr
The construction group is seeking to inform all local employee representatives throughout Europe on this topic in a transparent manner and to investigate suggestions for improving working conditions and for the prevention of industrial accidents and occupational hazards.	de
There were three 9-point territories: one, in the center of the board, surrounded by 12 white stones; another, on the right side, surrounded by 9 black stones; and another, in the upper left corner, surrounded by 6 black stones.	de
"It is the 4th of December of 2012. Today, Bratislav uses a long wooden stick to prod his dogs Chino and Rafa. He says that it is too cold to use the water spray bottle. He talks about the emerging Plasma Universe Paradigm. He says that space is not empty. I tell him what I read in Astronomy magazine about Jupiter-sized worlds, twice as many as stars, lonely worlds wandering unanchored to a sun, or primary star. Recently, I have been fantasizing of an elegant teahouse in orbit around such a giant world surrounded by sunless darkness. I call this quiet, eerie fantasy ""La Teejo"" in Esperanto, or undecidedly ""la .tcat. .barj."" in Lojban. Some men prefer a Bath and Sauna Dream."	ru
Now the ships were usually beached on the dry sand: / the young men were busy with weddings and their fresh fields: / I was deciding on laws and homesteads: suddenly, / from some infected region of the sky, came a wretched plague, / corrupting bodies, trees, and crops, and a season of death. / They relinquished sweet life, or dragged their sick limbs / around: then Sirius blazed over barren fields: / the grass withered, and the sickly harvest denied its fruits.	fr
"The board used in the game of Go is checkered, but it doesn't have light and dark squares like chess and checkers boards. In Go, the stones are placed not on ""squares"", but on the intersections of the horizontal and vertical lines drawn on the board."	ru
If there were no such thing as display in the world, my private opinion is, and I hope you agree with me, that we might get on a great deal better than we do, and might be infinitely more agreeable company than we are.	fr
There are only two cases in which war is just: first, in order to resist the aggression of an enemy, and second, in order to help an ally who has been attacked.	de
There are no longer any problems in business life, there are only challenges. And challenges are opportunities. So it is no problem at all if the company is in the red, it's just another opportunity!	ru
The young king let it be known that he intended to marry, and commanded all the maidens in the kingdom to come to a feast, so that he might choose a wife from among them.	fr
He had entertained hopes of being admitted to a sight of the young ladies, of whose beauty he had heard much; but he saw only the father. The ladies were somewhat more fortunate, for they had the advantage of ascertaining from an upper window that he wore a blue coat, and rode a black horse.	fr
We recommend adding sentences and translations in your strongest language. If you are interested primarily in having your sentences corrected, you should try a site like Lang-8.com, where that's the focus.	ru
He wore a jaunty coat of chocolate-colored velvet, with diamond buttons, and with two huge pockets which were always filled with bones, dropped there at dinner by his loving mistress.	es
I thought I'd have to take my car into a garage and shell out a horrendous amount again, but luckily it turned out to be only a flat battery caused by Tom forgetting to switch the interior light off.	de
I have just seen a game of checkers, played by Françualdo Gonçalves de Souza in 1997, more beautiful than the chess game called Immortal, played by Adolf Anderssen in 1895.	fr
Roger Miller's father died when he was only one year old and his mother became sick soon after, so he was sent to live with his uncle in Erick, Oklahoma.	ru
Remember that the purpose of the Tatoeba Project is to create example sentences that can be used for studying languages. It's not really a place to be contributing non-native language sentences for others to correct for you.	ru
If you want to sound like a native speaker, you must be willing to practice saying the same sentence over and over in the same way that banjo players practice the same phrase over and over until they can play it correctly and at the desired tempo.	es
"In my language, the "","" is called a comma, the "";"" is called a semicolon, "":"" is called a colon, ""..."" is called an ellipsis and this sentence ends in a full stop."	es
And when this happens, and when we allow freedom ring, when we let it ring from every village and every hamlet, from every state and every city, we will be able to speed up that day when all of God's children, black men and white men, Jews and Gentiles, Protestants and Catholics, will be able to join hands and sing in the words of the old Negro spiritual: Free at last! Free at last!	es
Black plays E8 and captures the white stone on D8. On E8, the black stone is at Ko, that is, on the next move, White will be prohibited from capturing it by playing D8. White then plays E2, practically forcing Black to play E1. Now White can play D8 and capture the Ko stone.	ru
He wrote an epitaph to the one he loved, telling her everything he had never gotten to tell her, despite knowing it was already too late. If she were still alive and had gotten the chance to hear it, maybe her story would have turned out differently.	es
I know that adding sentences only in your native or strongest language is probably not as much fun as practicing writing foreign languages, but please don't add sentences to the Tatoeba Corpus if you are not absolutely sure they are correct. If you want to practice languages that you are studying, please do so by using a website designed for that purpose such as www.lang-8.com.	ru
99% of the time, it's not worth keeping anything. It just takes up space and weighs you down. Haven't you noticed that it's not you who owns things, but the other way around?	es
"By the way, do you know what a Shinto shrine is? ""I've a little bit of knowledge on the subject. It's a religious facility where that which is the object of worship, that called the genius loci, is enshrined."""	ru
I may seem confident, but I get extremely nervous speaking in front of people. My hands tremble, I get all tongue-tied, and sometimes I don't even know what I'm saying myself.	ru
"Where are you from? ""My country no longer exists."" ""What do you mean?"" ""I was born, raised and spent most of my adult life in the Soviet Union. It's not there anymore. When the country collapsed, I was in Algeria, so I decided to stay here for good."" ""Are you Russian?"" ""No. In fact, I'm a mix of several cultures, way more than you can imagine."" ""Why don't you return to Russia?"" ""I'm not even from Russia. There is no country I could return to."""	es
"One of the great misunderstandings of our epoch seems to be the claim that, with the collapse of the communist Soviet state, socialism has failed and capitalism has been victorious. But was the ""socialism"" of the Soviet Union anything other than state capitalism?"	de
I have just seen a game of checkers, played by Françualdo Gonçalves de Souza in 1997, more beautiful than the chess game called Immortal, played by Adolf Anderssen in 1895.	es
I want to stand as close to the edge as I can without going over. Out on the edge you see all the kinds of things you can't see from the center.	fr
When Cameroonian golf champion Issa Nlareb Amang lost his legs and most of his fingers to meningitis in 2018, many thought his life in the sport was over. But, thanks to donors, he was able to get prosthetics that allowed him to return to the game and become the only disabled professional golfer in West Africa.	es
In 1992, Marion Tinsley (1927-1995), the seemingly unbeatable World Checker Champion, defended his title against the computer program CHINOOK, in a series of games, of which he won 4, lost 2, and drew 33. This was the first time ever that a human world champion defended his title against a computer.	es
My East Indian friend Jai, whose family background was Hindu, and I often discussed what belief system would be good for India. We both tended to think that Buddhism or secularism would be best.	fr
The future will not be built through force, nor the desire to conquer, but by the patient application of the democratic method, the constructive spirit of agreement, and by respect for freedom.	ru
In the game of chess, the relative value of pieces is usually as follows: the queen is worth 9, the rook 5, the bishop 3, the knight also 3, and the pawn 1. The king has absolute value.	ru
It's a very strange feeling for someone like me, writing in a diary. Not only because I've never written before, but also because later on, neither me nor anyone will care about a thirteen year old schoolgirl's secrets.	fr
I panicked when I read that they expected big protests in Riyadh today, but then my wife reassured me, saying that she had just bought two bottles of olive oil, ensuring our living standard for months, even if oil prices were to explode.	ru
The first prison I ever saw had inscribed on it CEASE TO DO EVIL: LEARN TO DO WELL; but as the inscription was on the outside, the prisoners could not read it.	de
The microorganisms on the ground, such as bacteria and fungi, fertilize the earth, support the production of food and act as a drain for carbon dioxide emitted into the atmosphere from the burning of fossil fuels.	es
I am running away from the man I love because I am a devout Catholic from Rome. If I stay longer with this man, he will drag my soul to hell; He is godless and deals with the dead and spirits, and God warned him with his voice of thunder.	fr
At that time in the courts of the feudal lords there were many scholars who engaged in discrimination, such as the followers of Xun Kuang, who wrote books that were disseminated throughout the whole world.	es
America, we have come so far. We have seen so much. But there is so much more to do. So tonight, let us ask ourselves, if our children should live to see the next century, if my daughters should be so lucky to live as long as Ann Nixon Cooper, what change will they see? What progress will we have made?	de
Kamui no Ken was a sort of samurai/ninja story set during the transition of the fall of the Tokugawa Shogunate and the re-establishment of Japan under the Emperor Meiji in 1868.	de
In many languages, such as Portuguese, German, French, Spanish, and Italian, the verb ending changes according to who is doing the action. So the patterns of the verb have to be learned.	es
It is no unusual thing for both parties to be overreached in a bargain, though the one must be always the greater loser; as was he who sold a blind horse, and received a bad note in payment.	fr
The Seven Wonders of the Ancient World are the Great Pyramid of Giza, the Hanging Gardens of Babylon, the Temple of Artemis, the Statue of Zeus at Olympia, the Mausoleum at Halicarnassus, the Colossus of Rhodes, and the Lighthouse of Alexandria.	de
Since most speakers of Esperanto have learned the language through self study, the Internet in general, and websites such as www.lernu.net in particular, have been a great boon to the language.	ru
Tom grew up speaking five languages; his father spoke as many as seven. The language at home was mostly German, while among friends and acquaintances he spoke Ukrainian and Polish.	de
I can't keep this up. It's an emotional roller coaster around here and all we have to do is look at the boss's face to know whether everybody is going to be happy or sad.	de
Mastery is the best goal because the rich can't buy it, the impatient can't rush it, the privileged can't inherit it, and nobody can steal it. You can only earn it through hard work. Mastery is the ultimate status.	es
Tom had lost a hand and a leg up to the knee in a fight against a shark. He now had a wooden leg and a hook instead of a hand.	de
A black stone captured a white stone and was left with only one liberty after the white stone was removed from the board. On the next move, if a white stone occupied that same spot, now empty, it would capture that black stone, but this was not allowed, because playing such a move would repeat the last position on the board.	de
I'm alone standing at the tip of the slow-dying year, the universe breaking in waves at my feet, planets whirling about my head, rumpling my hair in the wind that rushes by, without giving an answer that would fill the abyss.	de
In 1992, Marion Tinsley (1927-1995), the seemingly unbeatable World Checker Champion, defended his title against the computer program CHINOOK, in a series of games, of which he won 4, lost 2, and drew 33. This was the first time ever that a human world champion defended his title against a computer.	ru
A quarter century after the end of the Cold War, the world is by many measures less violent and more prosperous than ever before, and yet our societies are filled with uncertainty, and unease, and strife.	de
If you want my opinion, Dan has never stepped foot on Italy, if not, how would you explain how he doesn’t know a single Italian word assuming he’s lived there for ten years?	es
The will of the people shall be the basis of the authority of government; this will shall be expressed in periodic and genuine elections which shall be by universal and equal suffrage and shall be held by secret vote or by equivalent free voting procedures.	ru
The fly running on the mirror doesn't worry about its reflection on the points of its legs from which it sits and runs; but on the contrary, it sees on the smooth surface a quantity of very small things which interest it and which we confuse with dust and grime.	fr
Boeing's safety experts have joined others in the industry to form an international task force to try to eliminate one particular kind of air crash known as controlled flight into terrain, CFIT.	de
Eleven-year-old Gracia sits in a chair that is two sizes too big for her, dangling her skinny legs and speaking with poise and wisdom about a life that has not been easy.	de
"Smaller, open-source AI models are now supposed to outperform their larger counterparts if they are taught to ""reason""—generate more tokens that consider all possible options in a logical question—before producing a final answer."	fr
Stanley Abbot, an architect, was the first designer of the parkway. He believed it was important to have variety in what people saw. Along with the mountains, Abbott wanted visitors to the parkway to see the valleys, forests, farms, rivers and homes of the surrounding communities.	es
If current trends continue, by the year 2050 the Americas will have 15 percent fewer plants and animals than now. That means there will be 40 percent fewer plants and animals in the Americas than in the early 1700s.	de
Actually I wanted to be a damsel in a tower guarded by seven dragons, and then a prince on a white horse would chop off the dragons' heads and liberate me.	es
Every time a failure like that occurs in another department, I'm tempted to call them idiots, but then people like you come along to demonstrate what true idiocy looks like.	ru
A great fire was lighted in the courtyard in which she was to be burnt, and the King stood above at the window and looked on with tearful eyes, because he still loved her so much.	de
Astronomy is perhaps the science whose discoveries owe least to chance, in which human understanding appears in its whole magnitude, and through which man can best learn how small he is.	es
It is true that behavior cannot be legislated, and legislation cannot make you love me, but legislation can restrain you from lynching me, and I think that is kind of important.	fr
Without giving up your privacy, I would also advise you to share with him what you do when he's not there, naturally, so he'll understand that there's no reason to be jealous.	es
Jealousy is a disease; love is a healthy condition. The immature mind often confuses one for the other, or assumes the greater the love, the greater the jealousy. In fact they are almost incompatible; both at once produce unbearable turmoil.	es
Ian Nepomniachtchi (2695), the 30-year-old Russian Grand Master, has just won the Candidate Tournament, securing the right to compete this year with current champion Magnus Carlsen for the title of World Chess Champion.	es
Based on how much Mary, John, and Alice have also done in their small lives, it's probable that while they were still alive, one of Tom's clones gave the three access to the cloning machine without the real Tom knowing.	es
"Two dragonflies are mating on your head. ""I didn't feel them landing. Are they still on my hair?"" ""No, they just took flight again."" ""Oh, now I see them. How beautiful they are!"""	es
"In 1969, Roger Miller recorded a song called ""You Don't Want My Love."" Today, this song is better known as ""In the Summer Time."" It's the first song he wrote and sang that became popular."	ru
For the past few years, teenagers who imitate overweight American rappers have been walking like inverted pendulums, swinging from left to right, which is the only way forward if you weigh over two hundred and sixty pounds, but completely ineffective if you are a scrawny teenager weighing half of that, since most of the energy is wasted on side steps, not to mention the sheer absurdity of that swinging gait.	es
This is why Tatoeba is multilingual. But not that kind of multilingual. Not the kind where languages are simply being paired up together, and where some pairs are left behind.	de
But I will always be honest with you about the challenges we face. I will listen to you, especially when we disagree. And above all, I will ask you to join in the work of remaking this nation, the only way it's been done in America for 221 years; block by block, brick by brick, calloused hand by calloused hand.	ru
Although open purchase orders are considered enforceable and legally binding, their terms generally allow us the option to cancel, reschedule and adjust our requirements based on our business needs prior to the delivery of goods or performance of services.	de
If an Icelandic sentence has a translation in English, and the English sentence has a translation in Swahili, then indirectly, this will provide a Swahili translation for the Icelandic sentence.	fr
Remember that the purpose of the Tatoeba Project is to create example sentences that can be used for studying languages. It's not really a place to be contributing non-native language sentences for others to correct for you.	ru
It may be impossible to get a completely error-free corpus due to the nature of this kind of collaborative effort. However, if we encourage members to contribute sentences in their own languages rather than experiment in languages they are learning, we might be able to minimize errors.	ru
All the world is a stage, and all the men and women merely players. They have their exits and their entrances, and one man in his time plays many parts, his acts being seven ages.	de
In response to Angela Merkel's concern regarding the developments in Crimea and Ukraine as a whole, Vladimir Putin drew the attention to the unrelenting threat of violence by ultra-nationalist forces, endangering the lives and legitimate interests of Russian citizens and the entire Russian-speaking population.	de
My grandson has a kitten. The kitten has white and black fur and greenish eyes. My grandson loves playing with it. He named it Vivi. Vivi is beautiful. It is our pet.	ru
The sister of North Korean leader Kim Jong Un has issued an ominous military threat toward South Korea, vowing unspecified retaliation over South Korean activists who have floated anti-Pyongyang leaflets into the North.	fr
On my desk is a rubber duck that I sometimes ask for technical support. Of course, it can't answer, but the process of explaining the problem often helps me find a solution.	de
And these signs shall follow them that believe; In my name shall they cast out devils; they shall speak with new tongues; they shall take up serpents; and if they drink any deadly thing it shall not hurt them; they shall lay hands on the sick, and they shall recover!	fr
After many years of meditation, I've come to the conclusion that for each person, the meaning of life consists precisely in finding the meaning of life. Each of us is a unique individual. And each of us has in themselves the potential to find and fulfill a unique mission in their life.	ru
There is a good number of problems for which the Karush-Kuhn-Tucker conditions are insufficient to guarantee optimality, but this doesn't change the fact that these conditions are an indispensable tool for doing optimization.	fr
He who fights with monsters should look to it that he himself does not become a monster. And when you gaze long into an abyss the abyss also gazes into you.	es
You were alive when you were born and you are alive at this moment, so you must have been alive at every point in between. That implies that everyone's life is convex.	fr
They came to the place that was revealed to him by God, and he there erected an altar in the ancient manner, and the wood was arranged just as he wanted to have it happen for his son's burning after he slayed him.	ru
We the People of the United States, in Order to form a more perfect Union, establish Justice, insure domestic Tranquility, provide for the common defense, promote the general Welfare, and secure the Blessings of Liberty to ourselves and our Posterity, do ordain and establish this Constitution for the United States of America.	es
The fathers of modern science – Copernicus, Galileo, Kepler, Newton, Boyle, and many others – saw clear evidence of design in the universe and, in fact, were inspired to discover the laws of nature by their faith in a transcendent lawgiver.	ru
"When I was younger, I hated going to weddings. My grandmothers and aunts would huddle around me, poke me in the side, and giggle ""You're next! You're next!"" They only stopped this nonsense when I began to do the same thing at funerals."	ru
"What's that you've got behind your back? ""Nothing. Nothing at all."" ""Show me!"" ""For goodness sake, Mary! It's your birthday present. It was meant to be a surprise. Why do you always come bursting into the room like that without knocking?"""	de
No one was responsible for the great Wall Street crash. No one engineered the speculation that preceded it. Both were the product of free choice and decision of hundreds of thousands of individuals.	fr
They went on travelling for two days through a great forest, without food or drink, and without coming across a single house, and every night they had to climb up into the trees through fear of the wild beasts that were in the wood.	de
Especially over the last 20 years, the purported link between progressive welfare policies and economic failure in the Northern European countries seems to point to the difficulty of sustaining both full social welfare and international competitivity.	fr
All human beings are born free and equal in dignity and rights. They are endowed with reason and conscience and should act towards one another in a spirit of brotherhood.	fr
In the 100s BC, Hipparchus, the most important Greek astronomer of his time, calculated the comparative brightness of as many as 1,000 different stars. He also calculated the Moon's distance from the Earth.	de
Please forget about the orienteering that you did at that outdoors school. Well, actually, you don't have to forget it, but the orienteering that we're doing here is completely different.	ru
And while she's no longer with us, I know my grandmother's watching, along with the family that made me who I am. I miss them tonight. I know that my debt to them is beyond measure. To my sister Maya, my sister Alma, all my other brothers and sisters, thank you so much for all the support that you've given me. I'm grateful to them.	es
There are no longer any problems in business life, there are only challenges. And challenges are opportunities. So it is no problem at all if the company is in the red, it's just another opportunity!	ru
There is now less flogging in our great schools than formerly, but then less is learned there; so that what the boys get at one end they lose at the other.	fr
Actually I wanted to be a damsel in a tower guarded by seven dragons, and then a prince on a white horse would chop off the dragons' heads and liberate me.	fr
Since Tom arrived at Guantanamo Bay he has been exposed to different forms of torture: sleep deprivation, sensory deprivation, extreme temperatures, prolonged isolation, lack of sunlight and limited health care.	fr
Authorities in Poland last week banned swimming at over 50 beaches along its Baltic coast, after hot weather led to the growth of toxic bacteria in the unusually warm sea.	de
All men who profit from the fruits of the earth must give back part of them to the Church, who will apply them to three uses: providing for pastors, the maintenance of religious buildings, help to the poor.	fr
