translated	origin_language
The English language should really have more letters than 26, or at least, it should use accents to cover all the phonemes that it has. Anglophones know that their language cannot be reformed.	es
The megalomaniac differs from the narcissist by the fact that he wishes to be powerful rather than charming, and seeks to be feared rather than loved. To this type belong many lunatics and most of the great men of history.	fr
A building with high ceilings and huge rooms may be less practical than the colorless block of offices that takes its place, but it often fits in well with its surroundings.	ru
"Why does this quote from Einstein sound like a word-for-word translation from the English? He can't have said it like that. ""Probably because it is in fact a translation from the English."""	de
It is possible for us to know what has been achieved in the past, but it is not possible for us to change it. And it is possible for us to change the future, but it is not possible for us to know what will be achieved in it.	es
The father's heart rejoiced to see that son who, eager for knowledge, learned so quickly and grew surely to become a learned priest, a true prince among the men of knowledge of his caste.	fr
The boundary of the solar cavity is the heliopause, about fifty astronomical units from the sun, where the solar wind pressure is down to the tiny pressure between stars in our arm of the galaxy.	fr
I know that adding sentences only in your native or strongest language is probably not as much fun as practicing writing foreign languages, but please don't add sentences to the Tatoeba Corpus if you are not absolutely sure they are correct. If you want to practice languages that you are studying, please do so by using a website designed for that purpose such as www.lang-8.com.	ru
If you can't visit a country where they speak the language you are learning, find a local bar where native speakers of that language hang out and start hanging out there.	ru
Love is like some fresh spring, that leaves its cresses, its gravel bed and flowers to become first a stream and then a river, changing its aspect and its nature as it flows to plunge itself in some boundless ocean, where restricted natures only find monotony, but where great souls are engulfed in endless contemplation.	fr
Man has many wishes that he does not really wish to fulfil, and it would be a misunderstanding to suppose the contrary. He wants them to remain wishes, they have value only in his imagination; their fulfilment would be a bitter disappointment to him. Such a desire is the desire for eternal life. If it were fulfilled, man would become thoroughly sick of living eternally, and yearn for death.	es
In 1912, the Austrian tailor Franz Reichelt died jumping off the first floor of the Eiffel Tower while trying out his new invention, the parachute coat, which did not work...	es
At the beginning of a game of checkers, on a 64-square board, the white pieces are placed on a1, c1, e1, g1; b2, d2, f2, h2; a3, c3, e3, and g3. Black occupies the b8, d8, f8, h8, a7, c7, e7, g7, b6, d6, f6, and h6 squares.	ru
Buying books would be a good thing if one could also buy the time to read them in: but as a rule the purchase of books is mistaken for the appropriation of their contents.	de
Transparency in government is a key component of a democracy. Ensuring that the public has access to government information both builds public trust in government decision-making and allows the public to hold government accountable for those decisions.	es
Chicken tikka masala is now a true British national dish, not only because it is the most popular, but because it is a perfect illustration of the way Britain absorbs and adapts external influences. Chicken tikka is an Indian dish. The masala sauce was added to satisfy the desire of British people to have their meat served in gravy.	ru
"After torturing a fortune-teller by tickling him to death for several hours, Christopher Columbus placed the noob toy in a treasure chest with the inscription: ""To the great pirate of the future Al-Sayib: Noobs always deserve it."""	ru
I wrote a sentence in Portuguese that I thought was interesting, and I wanted to translate it into other languages. But sadly, my knowledge of foreign languages is too limited.	fr
"One day their father said to his sons: ""My dear boys, take each of you an arrow, draw your strong bow and let your arrow fly; in whatever court it falls, in that court there will be a wife for you."""	fr
For the sharks, we saw them, not by units, nor by tens, nor by hundreds; but by thousands and by myriads. Trust me, there are more sharks in the sea than mortals on land.	fr
Most scientists believe that this has been caused by man, through the release of methane, of carbon dioxide, and other greenhouse gases since industrialization. A few other scientists doubt this, however.	ru
"Tom's sitting down there. ""It's a free country."" ""Don't you want to go and speak to him? He's definitely waiting for you."" ""Then he can keep waiting. If he wants something, he can come here."""	fr
Magnus Carlsen retained his title of World Chess Champion. With four wins and seven draws in eleven games, he subdued by 7.5 x 3.5 the challenger Ian Nepomniachtchi, who throughout the competition made some serious mistakes.	fr
Bernard of Chartres used to say that we are like dwarfs on the shoulders of giants, so that we can see more than they, and things at a greater distance, not by virtue of any sharpness of sight on our part, or any physical distinction, but because we are carried high and raised up by their giant size.	fr
He had gone barely half a mile when he met a lame Fox and a blind Cat, walking together like two good friends. The lame Fox leaned on the Cat, and the blind Cat let the Fox lead him along.	es
We can debate the point if Magnus is the greatest player of all time, yet there is no disputing (at least to my mind) that he is the strongest player of all time.	ru
Shortly after, a Turkish dictator decided that all his people must dress in the Western fashion. Anyone who disobeyed would be sentenced to death. Afterwards, he went back to speak again with the astronomers about his discovery. And this time everyone believed he was telling the truth.	es
Syndromes are often named after the physician or group of physicians who discovered them or initially described the full clinical picture. Such eponymous syndrome names are examples of medical eponyms. Recently, there has been a shift towards naming conditions descriptively (by symptoms or underlying cause) rather than eponymously, but the eponymous syndrome names often persist in common usage.	ru
The Anglo-Saxons will not just take your land. They will also take you as a slave, then, when you die, they're going to store your bones in a museum and describe you as a savage in their history books. They are also going to make a couple of movies to show how ugly you were and how brave their heroes were.	fr
Between the minded planetary systems occurred infinite variations of personal intercourse. As between human individuals, there were loves and hates, temperamental sympathies and antipathies, joyful and distressful intimacies, cooperations and thwartings in personal ventures and in the great common venture of building the galactic Utopia.	es
I'm fucked, I'm fucked! I still have over half of this project to finish and I can't get this done in 4 hours. It's already 6 morning so it's been more than 12 hours now I've been at it.	es
My Latin teacher used to look down sternly on me over the rim of her glasses, but now I know it only had to do with the fact that she was wearing reading glasses and that she will have found it a nuisance taking them off all the time, so what looked like contempt towards us students might well and truly have been kindness.	ru
I say now amo “I love”, then you say quem amas? “Whom do you love?” I say te amo “I love you” then my love falls on you, and you can say amor a te “I am loved by you”; doceo te “I teach you”, and you say: doceor a te “I am taught by you”, et cetera.	de
The provision for warranty expense is generally established for specific losses, along with historical estimates of customer claims as a percentage of sales, which can cause variability in warranty expense between quarters.	de
They say that on Columbus Day, Christopher Columbus's ghost rises up from its grave and flies around the world, punishing the bad boys and girls who don't believe in Christopher Columbus.	es
"Just then the door opened a little way, and a creature with a long beak put its head out for a moment and said: ""No admittance till the week after next!"" and shut the door again with a bang."	fr
The driver of an oncoming car flashed his lights at Tom as a warning that there was a mobile speed camera up ahead. Tom, who had been speeding, immediately slowed down and passed the camera at just under the speed limit.	ru
Remember that the purpose of the Tatoeba Project is to create example sentences that can be used for studying languages. It's not really a place to be contributing non-native language sentences for others to correct for you.	ru
Several literary works have appeared in Interlingua, among them a translation of William Shakespeare's Hamlet and several novels by Luigi Pirandello, and the publication rate of literary works in Interlingua is continually on the rise.	es
Ah, Alsace! It is usually known for the beauty of its half-timbered houses, its renowned gastronomy and its famous Christmas markets. However, it is also a cultural crossroads in the heart of Europe. It links France, Switzerland and Germany through an incredible diversity of landscapes where, flanked by mountains and the banks of the Rhine, open-air activities abound.	fr
"When Mark Twain wrote ""The Adventures of Huckleberry Finn,"" he regularly used the n-word about ""Jim,"" whom he otherwise described in the kindest terms. Twain certainly had character flaws, but he was personally aware of many of them, and I don't think he should be described as a racist; by the standards of his time, he would be seen as astonishingly broad-minded and liberal. Nevertheless, knowing how the n-word has been used within a society afflicted by systemic racism, a person with any ordinary feelings of respect for fellow-creatures would refrain from using it today."	de
Telling our busy developers and admins (or any other members of the community) the order in which they should tackle issues, or how long it should take to fix them, is not the way to get them to the front of the queue, or to make friends.	fr
"That jumper's got a hole in the arm. I can't let you go anywhere in that. ""Where's there a hole?"" ""There!"" ""Oh, no one'll see that."" ""You're not leaving my house looking like that. End of!"""	fr
"A curious German word is ""entfernen"" (to put some distance between), because the prefix ""ent-"" means to take something away, in this case the distance, but taking away the distance would mean to bring it closer which is the exact opposite of what the word ""entfernen"" means."	de
"Do you have a moment to talk with me, Tom? ""That's fine, but I've only got a minute or two to spend, so you'll need to keep whatever you have to say very brief."""	fr
Merkel was born in Hamburg in West Germany, but moved to what was then East Germany when she was three months old after her father became pastor at a church near Templin, a quiet town in the countryside 90 kilometers north of Berlin.	de
More recently, tension has been fed by colonialism that denied rights and opportunities to many Muslims, and a Cold War in which Muslim-majority countries were too often treated as proxies without regard to their own aspirations.	fr
Hundreds of motorists stopped in the middle of the road to look at a supposed UFO. It was Tom flying by in a saucer-shaped hot-air balloon to play an April Fool's joke.	de
The dogs (the guardians of the sheep and goats) accompanied Chloe, and scenting about in their usual manner they discovered Dorcon who was in the act of rising up to seize their mistress. Taking him for a wolf they set up a full cry, rushed upon him and began to bite before he could recover from his astonishment.	ru
The father of a father is a grandfather, a grandfather's father is a great-grandfather, a great-grandfather's father is a great-great-grandfather, but no word has been decided upon for the generations before great-great-grandfather.	es
No one shall be subjected to arbitrary interference with his privacy, family, home or correspondence, nor to attacks upon his honour and reputation. Everyone has the right to the protection of the law against such interference or attacks.	de
It's still too hard to find a job. And even if you have a job, chances are you're having a tougher time paying the rising costs of everything from groceries to gas.	es
That is not my fault; the grown-ups had put a stop to my artistic career when I was six and I had never drawn anything other than my two boa constrictors.	fr
Based on the assumption that advanced life – a technologically capable civilization that sends out communications – takes up to five billion years to form, the researchers calculated there are about 36 advanced civilizations in the Milky Way.	es
In a far, far away universe where whatever is visualized becomes real, a noob tried to visualize a four dimensional object only to end up visualizing an object with an infinite number of dimensions that sent our entire existence into disarray thereby ending the universe as we know it.	ru
"I can see mine, but not yours. ""What are you on about again? How should I know what you mean without a given context?"" ""I'm talking about our socks, of course – what else?"" ""Well, I've put mine in the drawer. I left yours lying about. They are indeed yours, not mine."""	de
A building with high ceilings and huge rooms may be less practical than the colorless block of offices that takes its place, but it often fits in well with its surroundings.	ru
In the game of chess, the relative value of pieces is usually as follows: the queen is worth 9, the rook 5, the bishop 3, the knight also 3, and the pawn 1. The king has absolute value.	fr
Eeny, meeny, miny, moe, catch a tiger by his toe, if he hollers let him go, eeny, meeny, miny, moe. My mother told me to catch the very best one and you are not it.	es
"Then your worship understands rhyming too? ""And better than thou thinkest,"" replied Don Quixote, ""as thou shalt see when thou carriest a letter written in verse from beginning to end to my lady Dulcinea del Toboso, for I would have thee know, Sancho, that all or most of the knights-errant in days of yore were great troubadours and great musicians, for both of these accomplishments, or more properly speaking gifts, are the peculiar property of lovers-errant: true it is that the verses of the knights of old have more spirit than neatness in them."""	es
Major life changes, such as changes in income level or legal and financial issues, can also create mental and physical feelings of stress and anxiety, which can overload the ability to function well.	es
In the game of chess, the relative value of pieces is usually as follows: the queen is worth 9, the rook 5, the bishop 3, the knight also 3, and the pawn 1. The king has absolute value.	es
"The president of the Amazigh World Congress, an ""international NGO that defends and promotes the individual and collective rights of the Berbers"" was summoned and interrogated for two hours by the Algerian police about its activities and reports of violations of human rights in Kabylia."	fr
"Those few years of happiness, abruptly ended by the most terrible catastrophes, were resurrected in his mind. All the details, no matter how slight they were, came back to memory with such clarity that reality perhaps could not have been more ""real""!"	fr
Doubtless there exists in this world precisely the right woman for any given man to marry and vice versa; but when you consider that a human being has the opportunity of being acquainted with only a few hundred people, and out of the few hundred that there are but a dozen or less whom he knows intimately, and out of the dozen, one or two friends at most, it will easily be seen, when we remember the number of millions who inhabit this world, that probably, since the earth was created, the right man has never yet met the right woman.	de
At the beginning of the game, the pawn is the piece with the lowest value, but if a pawn advances to the other end of the board (eighth row for white, first row for black) it will be promoted, that is, it will be replaced, to player's choice, by a knight, a bishop, a rook or, most often, a queen.	es
"Can you tell me what you're doing in my room? ""Nothing. I just wanted to see how your flowers were. I know how important they are to you."" ""And I'm the Queen of Sheba. Out! Now!"""	fr
"I told the other kids all about how our train hit a person, and that's why we were delayed. ""Oh my God, no you didn't, really? The teacher is going to call me. . ."" ""Everyone wanted to know if the person died, and I said they went to the hospital."" ""First you were telling kids about the war in Ukraine, now this? Please don't talk about this stuff at school honey. Some kids will be upset."""	ru
And Israel taking his journey, with all that he had, came to the well of the oath, and killing victims there to the God of his father Isaac, he heard him, by a vision in the night, calling him, and saying to him: Jacob, Jacob. And he answered him: Lo, here I am.	fr
If you're scared of snakes, don't come in my room because I have five of them roaming around. I only put them in the terrarium when it's time to eat.	es
The match for the 2020 FIDE World Championship, postponed because of the Coronavirus pandemic (COVID-19), will now be held from November 26th to December 16th, 2021, alongside the World Expo in Dubai, UAE, between current world champion Magnus Carlsen and GM Ian Nepomniachtchi, who won the 2020 Candidates Tournament.	ru
On the night of November 16, 1966, the Leonid meteor shower, which occurs in November of each year, rained down on Arizona at the rate of 2300 meteors per minute for a 20 minute period.	es
According to Tom, the theory of evolution by random mutations and natural selection is not convincing for several reasons, the most important of which is the existence of DNA. Among other unacceptable points, Tom adds, this theory claims that the human mind – Socrates, Plato, Aristotle, Galileo, Newton, Shakespeare, Descartes, Da Vinci, Mozart, Einstein, Darwin himself – evolved from the mind of an unidentified primate, which would be our ancestor.	ru
Rafael Leitão points out that the insertion of chess in Brazilian schools is a positive fact, but he believes that we are still far from the minimum acceptable level for someone to earn stable incomes as a professional chess player.	ru
Record flooding in Australia this week has had an unexpected consequence, driving hordes of spiders—including one of the world’s deadliest species—out of their usual habitat and into homes and backyards.	de
Transparency in government is a key component of a democracy. Ensuring that the public has access to government information both builds public trust in government decision-making and allows the public to hold government accountable for those decisions.	ru
And the Lord said to Abram: Go forth out of thy country, and from thy kindred, and out of thy father's house, and come into the land which I shall shew thee.	fr
In checkers tournaments, each player's reflection time, defined by the competition rules, is controlled by a special clock, with two dials, equipped with a mechanism that, activated by the player who has just made the move, interrupts his timing and starts (restarts) the opponent's timing.	fr
If the chessboard is in the right position, the square h1 to the right of White is a white square. Consequently, the square a8 to the right of Black is also a white square.	de
In 1609, Galileo heard about the invention of the spyglass, a device which made distant objects appear closer. Galileo used his mathematical knowledge and technical skills to improve upon the spyglass and build a telescope.	es
Automatic doors can be controlled more intelligently than is now the case. A newly developed control system opens the door only when someone is actually approaching. The door will remain closed if someone is merely standing in front of it or walking past.	fr
Is it possible to believe that subatomic particles, as well as the very peculiar forces that lead them to combine to generate matter, are not the work of a Supernatural Intelligence?	ru
Many heretics, witches, and atheists were burned at the stake of the Inquisition. Today, the scientist who unwittingly declares that he believes in a supernatural intelligence will be discriminated against by his materialistic peers and persecuted in his professional career.	fr
Eeny, meeny, miny, moe, catch a tiger by his toe, if he hollers let him go, eeny, meeny, miny, moe. My mother told me to catch the very best one and you are not it.	es
Should any political party attempt to abolish social security, unemployment insurance, and eliminate labor laws and farm programs, you would not hear of that party again in our political history. There is a tiny splinter group, of course, that believes you can do these things. Among them are H. L. Hunt (you possibly know his background), a few other Texas oil millionaires, and an occasional politician or business man from other areas. Their number is negligible and they are stupid.	ru
The French language, by the way, is a clear stream that affected writers have never been, and will never be able to ripple. Each century has thrown in this limpid current its fashions, its pretentious archaisms and its preciousness, without anything surfacing from those useless attempts, those powerless efforts. The nature of this language is to be clear, logical and nervous. It won't let itself be weakened, obscured or corrupted.	fr
"When we come to die, we shall be alone. From all our worldly possessions we shall be about to part. Worldly friends — the friends drawn to us by our position, our wealth, or our social qualities, — will leave us as we enter the dark valley. From those bound to us by stronger ties — our kindred, our loved ones, children, brothers, sisters, and from those not less dear to us who have been made our friends because they and we are the friends of the same Saviour, — from them also we must part. Yet not all will leave us. There is One who ""sticketh closer than a brother"" — One who having loved His own which are in the world loves them to the end."	es
On May 6, 2014, the Administration released the Third U.S. National Climate Assessment (NCA), the most authoritative and comprehensive source of scientific information to date about climate change impacts across all U.S. regions and on critical sectors of the economy.	de
Since there are usually multiple websites on any given topic, I usually just click the back button when I arrive on any webpage that has pop-up advertising. I just go to the next page found by Google and hope for something less irritating.	ru
Despite a flattering supposition to the contrary, people come readily to terms with power. There is little reason to think that the power of the great bankers, while they were assumed to have it, was much resented. But as the ghosts of numerous tyrants, from Julius Caesar to Benito Mussolini will testify, people are very hard on those who, having had power, lose it or are destroyed. Then anger at past arrogance is joined with contempt for the present weakness. The victim or his corpse is made to suffer all available indignities.	fr
When the trumpets sounded, the army shouted, and at the sound of the trumpet, when the men gave a loud shout, the wall collapsed; so everyone charged straight in, and they took the city. They devoted the city to the LORD and destroyed with the sword every living thing in it—men and women, young and old, cattle, sheep and donkeys.	fr
The other day, I stopped at a secondhand bookstore on my way home from school and happened to find a book I had been looking for for a long time.	de
The sun creates the heliosphere by sending a constant flow of particles and a magnetic field out into space at over 670,000 miles per hour. This stream is called the solar wind.	de
God is not a limited individual who sits alone up in the clouds on a golden throne. God is pure Consciousness that dwells within everything. Understanding this truth, learn to accept and love everyone equally.	es
And tonight, I think about all that she's seen throughout her century in America. The heartache and the hope, the struggle and the progress. The times we were told that we can't, and the people who pressed on with that American creed: Yes, we can.	de
Without bolder action, our children won't have time to debate the existence of climate change. They'll be busy dealing with its effects: more environmental disasters, more economic disruptions, waves of climate refugees seeking sanctuary.	fr
"In March 1999, Marcy and Butler announced the detection of the first true other ""solar system"" in which they found evidence of 3 planets orbiting a single star. The star is called Upsilon Andromedae."	de
Me and my colleagues lived in a small 2 room cabin built on the edge of a cliff on the mountain. I say 2 rooms, but besides the entrance, there was a 6 by 2 tatami room. We ate potatoes, dried fish and tofu. Because we were on the top of a cold mountain, the potatoes would freeze during the winter.	ru
The empty intersections adjacent to a stone are its degrees of freedom (at least 1, at most 4). A stone that has no degree of freedom cannot remain on the board.	es
